"","record_id","policy_id","entry_type","correct_type","update_type","update_level","description","date_announced","date_start","date_end","country","ISO_A3","ISO_A2","init_country_level","domestic_policy","province","city","type","type_sub_cat","type_text","institution_status","target_country","target_geog_level","target_region","target_province","target_city","target_other","target_who_what","target_direction","travel_mechanism","compliance","enforcer","index_high_est","index_med_est","index_low_est","index_country_rank","link","date_updated","recorded_date"
"81","R_1Kl6IewB4DXZiPBNA","4924163","new_entry","original",NA,NA,"Commonwealth Summit in Rwanda postponed",2020-04-22,2020-04-22,NA,"Rwanda","RWA","RW","National",1,NA,NA,"Restrictions of Mass Gatherings",NA,NA,"","Rwanda",NA,NA,NA,NA,NA,"All Residents (Citizen Residents + Foreign Residents)",NA,NA,"Mandatory (Unspecified/Implied)","National Government",54.8064518574034,53.914037633426,52.9819041728374,147,"https://www.bbc.com/news/topics/cwlw3xz0zdet/rwanda",2020-04-22,2020-04-22 18:51:20
"82","R_1OI7nJYBtZXLZpMNA","6182952","new_entry","original",NA,NA,"Meeting in Public places and mass gatherings  prohibited",2020-04-30,2020-05-04,NA,"Rwanda","RWA","RW","National",1,NA,NA,"Restrictions of Mass Gatherings",NA,NA,"","Rwanda",NA,NA,NA,NA,NA,"All Residents (Citizen Residents + Foreign Residents)",NA,NA,"Mandatory (Unspecified/Implied)","National Government,Police",NA,NA,NA,NA,"https://www.newtimes.co.rw/covid-19/rwanda-eases-covid-19-lockdown-here-are-10-guidelines-follow",2020-05-01,2020-05-01 14:24:34
"83","R_3iRtZSdg4PjviF4Ah","1193299","new_entry","original",NA,NA,"Mass gatherings remain banned in Rwanda till further notice as of directive issued on 02-06-2020",2020-06-02,2020-06-02,NA,"Rwanda","RWA","RW","National",1,NA,NA,"Restrictions of Mass Gatherings","Attendance at religious services restricted (e.g. mosque/church closings)",NA,"","Rwanda",NA,NA,NA,NA,NA,"All Residents (Citizen Residents + Foreign Residents)",NA,NA,"Mandatory (Unspecified/Implied)","National Government,Police",NA,NA,NA,NA,"https://www.newtimes.co.rw/news/govt-okays-inter-provincial-travel-taxi-moto-operations",2020-06-03,2020-06-03 06:33:21
"84","R_1JOufpSSXLcT2eWNA","1405600","new_entry","original",NA,NA,"Kigali imposes strict sanctions on those caught going against rules meant to curb spread of Covid-19 as from September 3,2020.",2020-09-03,2020-09-03,NA,"Rwanda","RWA","RW","National",1,NA,NA,"Restrictions of Mass Gatherings",NA,NA,"","Rwanda",NA,NA,NA,NA,NA,"All Residents (Citizen Residents + Foreign Residents)",NA,NA,"Mandatory with Legal Penalties (Jail Time),Mandatory with Fines","National Government,Police",NA,NA,NA,NA,"https://www.newtimes.co.rw/news/city-kigali-imposes-hefty-fines-violation-covid-19-guidelines",2020-09-08,2020-09-08 03:32:14
"85","R_2SCRfo8GK96uagSNA","7094198","new_entry","original",NA,NA,"On March 11 President Kagame popularized the elbow bump greeting thus encouraging sensitizing the public to avoid handshakes.",2020-03-11,2020-03-11,NA,"Rwanda","RWA","RW","National",1,NA,NA,"Social Distancing",NA,NA,"","Rwanda",NA,NA,NA,NA,NA,"All Residents (Citizen Residents + Foreign Residents)",NA,NA,"Voluntary/Recommended but No Penalties","National Government,Ministry/Department of Health",52.9918528541938,51.3402639227944,49.4916596171872,144,"http://www.anews.com.tr/world/2020/03/22/rwanda-steps-up-efforts-to-beat-coronavirus",2020-04-06,2020-04-06 23:15:22
"86","R_1PSiIOXPmf596ivCj","14120","new_entry","original",NA,NA,"Public transport resume but Moto bikes will not be allowed to carry passengers but can ferry goods as from 04-05-2020 in Rwanda",2020-04-30,2020-05-04,NA,"Rwanda","RWA","RW","National",1,NA,NA,"Social Distancing","Other Mask Wearing Policy",NA,"","Rwanda",NA,NA,NA,NA,NA,"All Residents (Citizen Residents + Foreign Residents)",NA,NA,"Mandatory (Unspecified/Implied)","National Government,Police",NA,NA,NA,NA,"https://www.newtimes.co.rw/covid-19/rwanda-eases-covid-19-lockdown-here-are-10-guidelines-follow",2020-05-01,2020-05-01 14:13:09
"87","R_D1uQeVPlRabb8TDCj","9368869","new_entry","original",NA,NA,"Rwanda public and private transport resume from 04 May 2020 but must observe social distancing regulations",2020-04-30,2020-05-04,NA,"Rwanda","RWA","RW","National",1,NA,NA,"Social Distancing","Other Mask Wearing Policy",NA,"","Rwanda",NA,NA,NA,NA,NA,"All Residents (Citizen Residents + Foreign Residents)",NA,NA,"Mandatory with Fines","National Government,Police",NA,NA,NA,NA,"https://www.newtimes.co.rw/covid-19/rwanda-eases-covid-19-lockdown-here-are-10-guidelines-follow",2020-05-01,2020-05-01 14:09:52
"88","R_11bv65SZISmAxTaEq","7558129","new_entry","original",NA,NA,"Non contact sports outside to continue in Rwanda as of 02-06-2020",2020-06-02,2020-06-02,NA,"Rwanda","RWA","RW","National",1,NA,NA,"Social Distancing","Wearing Masks in all public spaces/everywhere",NA,"","Rwanda",NA,NA,NA,NA,NA,"All Residents (Citizen Residents + Foreign Residents)",NA,NA,"Mandatory (Unspecified/Implied)","National Government,Police",NA,NA,NA,NA,"https://www.newtimes.co.rw/news/govt-okays-inter-provincial-travel-taxi-moto-operations",2020-06-03,2020-06-03 06:54:29
"89","R_3JlTjV6YfCS6fNqBp","3235031","new_entry","original",NA,NA,"All resumed businesses in Rwanda MUST adhere to health regulations set by the Health Ministry,per new directions announced on 02-06-2020",2020-06-02,2020-06-03,NA,"Rwanda","RWA","RW","National",1,NA,NA,"Social Distancing","Keeping a distance of at least 6 feet or 1.5 meters apart",NA,"","Rwanda",NA,NA,NA,NA,NA,"All Residents (Citizen Residents + Foreign Residents)",NA,NA,"Mandatory (Unspecified/Implied)","National Government,Ministry/Department of Health,Police",NA,NA,NA,NA,"https://www.newtimes.co.rw/news/govt-okays-inter-provincial-travel-taxi-moto-operations",2020-06-03,2020-06-03 05:47:10
"90","R_3JlTjV6YfCS6fNqEq","3235031","new_entry","original",NA,NA,"All resumed businesses in Rwanda MUST adhere to health regulations set by the Health Ministry,per new directions announced on 02-06-2020",2020-06-02,2020-06-03,NA,"Rwanda","RWA","RW","National",1,NA,NA,"Social Distancing","Wearing Masks in all public spaces/everywhere",NA,"","Rwanda",NA,NA,NA,NA,NA,"All Residents (Citizen Residents + Foreign Residents)",NA,NA,"Mandatory (Unspecified/Implied)","National Government,Ministry/Department of Health,Police",NA,NA,NA,NA,"https://www.newtimes.co.rw/news/govt-okays-inter-provincial-travel-taxi-moto-operations",2020-06-03,2020-06-03 05:47:10
"91","R_3JlTjV6YfCS6fNqEw","3235031","new_entry","original",NA,NA,"All resumed businesses in Rwanda MUST adhere to health regulations set by the Health Ministry,per new directions announced on 02-06-2020",2020-06-02,2020-06-03,NA,"Rwanda","RWA","RW","National",1,NA,NA,"Social Distancing","Wearing Masks inside public or commercial building",NA,"","Rwanda",NA,NA,NA,NA,NA,"All Residents (Citizen Residents + Foreign Residents)",NA,NA,"Mandatory (Unspecified/Implied)","National Government,Ministry/Department of Health,Police",NA,NA,NA,NA,"https://www.newtimes.co.rw/news/govt-okays-inter-provincial-travel-taxi-moto-operations",2020-06-03,2020-06-03 05:47:10
"92","R_DRZJ2oqWKufw9rjEq","9506361","new_entry","original",NA,NA,"On June 02,Rwandan government announces that Masks MUST be worn in Public in Rwanda",2020-06-02,2020-06-03,NA,"Rwanda","RWA","RW","National",1,NA,NA,"Social Distancing","Wearing Masks in all public spaces/everywhere",NA,"","Rwanda",NA,NA,NA,NA,NA,"All Residents (Citizen Residents + Foreign Residents)",NA,NA,"Mandatory (Unspecified/Implied)","National Government,Police",NA,NA,NA,NA,"https://www.newtimes.co.rw/news/govt-okays-inter-provincial-travel-taxi-moto-operations",2020-06-03,2020-06-03 06:01:20
"93","R_bIuiWXDJKPsrR8BBp","1721530","new_entry","original",NA,NA,"Rwanda reopens Places of worship after long closure,with Rwandans of certain ages banned from attending the services",2020-07-15,2020-07-15,NA,"Rwanda","RWA","RW","National",1,NA,NA,"Social Distancing","Keeping a distance of at least 6 feet or 1.5 meters apart",NA,"","Rwanda",NA,NA,NA,NA,NA,"All Residents (Citizen Residents + Foreign Residents)",NA,NA,"Mandatory (Unspecified/Implied)","National Government,Police",NA,NA,NA,NA,"https://www.newtimes.co.rw/news/covid-19-five-conditions-places-worship-reopen",2020-07-18,2020-07-18 01:00:31
"94","R_bIuiWXDJKPsrR8BEq","1721530","new_entry","original",NA,NA,"Rwanda reopens Places of worship after long closure,with Rwandans of certain ages banned from attending the services",2020-07-15,2020-07-15,NA,"Rwanda","RWA","RW","National",1,NA,NA,"Social Distancing","Wearing Masks in all public spaces/everywhere",NA,"","Rwanda",NA,NA,NA,NA,NA,"All Residents (Citizen Residents + Foreign Residents)",NA,NA,"Mandatory (Unspecified/Implied)","National Government,Police",NA,NA,NA,NA,"https://www.newtimes.co.rw/news/covid-19-five-conditions-places-worship-reopen",2020-07-18,2020-07-18 01:00:31
