record_id,policy_id,entry_type,correct_type,update_type,update_level,description,date_announced,date_start,date_end,country,ISO_A3,ISO_A2,init_country_level,domestic_policy,province,city,type,type_sub_cat,type_text,institution_status,target_country,target_geog_level,target_region,target_province,target_city,target_other,target_who_what,target_direction,travel_mechanism,compliance,enforcer,index_high_est,index_med_est,index_low_est,index_country_rank,link,date_updated,recorded_date
R_2zpayOd6dDcK87JNA,4992271,new_entry,original,,,"An enhanced order will be imposed in Hulu Langat, Selangor, where 71 out of 274 individuals from a Tahfiz school test were confirmed to be infected with COVID-19. Residents will not be allowed to leave their homes and no visitors will be allowed to enter the area.",2020-04-01,2020-04-01,2020-04-14,Malaysia,MYS,MY,National,1,,,Lockdown,,,"",Malaysia,One or more geographical or administrative units within one or more countries,,,,,All Residents (Citizen Residents + Foreign Residents),,Not Applicable,Mandatory (Unspecified/Implied),Other (Please specify in the text box),51.4137075525,46.26894988673,40.7160171718505,1,https://www.garda.com/crisis24/news-alerts/327731/malaysia-government-implements-phase-2-of-movement-control-order-april-1-14-update-9,2020-09-16,2020-09-16T15:38:53Z
R_1CBVBAP4h1bpf6VCm,8491298,new_entry,original,,,"March 10 — Former Malaysian health minister Datuk Seri Dzulkefly Ahmad has been appointed the chairman of Selangor’s new special action council for the control and prevention of the coronavirus disease (Covid-19). Dzulkefly has agreed to chair the council that will include four health professionals, representatives of the state’s Health department and disaster unit. The council is tasked to find ways to prevent the virus from spreading and threatening the health of the people of the state.
“This is because the state government found that 60 per cent of the 117 positive cases of Covid-19 are those living in Selangor,”.",2020-03-10,2020-03-10,,Malaysia,MYS,MY,Provincial,1,Selangor,,"New Task Force, Bureau or Administrative Configuration",New Task Force or Bureau (i.e. establishment of a temporary body),,"",Malaysia,,,Selangor,,,All Residents (Citizen Residents + Foreign Residents),,,Mandatory (Unspecified/Implied),"Ministry/Department of Health,Provincial/State Government",50.855174212828,46.4089671543927,42.3888242416996,1,https://www.malaymail.com/news/malaysia/2020/03/10/selangor-taps-ex-health-minister-dzulkefly-to-lead-covid-19-special-action/1845062 ; https://www.sinarharian.com.my/article/73245/KHAS/Covid-19/Dr-Dzulkefly-ketuai-Majlis-Tindakan-Khas-Covid-19-Selangor,2020-12-18,2020-12-18T17:44:34Z
R_r856OSNuKVtWyv7Cm,7187803,new_entry,original,,,"On May 19th, Malaysian police have formed a special task force to identify individuals travelling interstate without permission to celebrate Aidilfitri across the country, says Inspector-General of Police Abdul Hamid Bador.",2020-05-19,2020-05-19,,Malaysia,MYS,MY,National,1,,,"New Task Force, Bureau or Administrative Configuration",New Task Force or Bureau (i.e. establishment of a temporary body),,"",Malaysia,,,,,,All Residents (Citizen Residents + Foreign Residents),,,Mandatory (Unspecified/Implied),Police,,,,,https://www.malaysiakini.com/news/526357,2020-05-29,2020-05-29T13:57:20Z
R_3DwnybCFeDdjZJ9NA,2627527,new_entry,original,,,"In Malaysia, visits to homes are permitted on first day of Raya celebrations only (May 24th). This is a restriction of religious gatherings. Visits, too, would be limited to just family members and are to be capped at a maximum of 20 people for the entire day.

",2020-05-13,2020-05-24,,Malaysia,MYS,MY,National,0,,,Other Policy Not Listed Above,,"In Malaysia, visits to homes are permitted on first day of Raya celebrations only (May 24th).","",Malaysia,,,,,,,,,Mandatory (Unspecified/Implied),Other (Please specify in the text box),,,,,https://www.malaysiakini.com/news/525438%2020,2020-05-29,2020-05-29T15:23:32Z
R_1GCYwhg4bQUKtKWNA,9591406,new_entry,original,,,"In Malaysia, the police and armed forces will go on patrols during the Hari Raya Aidilfitri celebrations to ensure the conditional movement control order (MCO) standard operating procedures are being followed.",2020-05-19,2020-05-24,,Malaysia,MYS,MY,National,0,,,Other Policy Not Listed Above,,The police and armed forces will go on patrols during the Hari Raya Aidilfitri celebrations to ensure the conditional movement control order (MCO) standard operating procedures are being followed.,"",Malaysia,,,,,,,,,"Mandatory with Fines,Mandatory (Unspecified/Implied)",Police,,,,,https://www.malaysiakini.com/news/526382,2020-05-29,2020-05-29T14:16:58Z
R_3hcCrIleAET2RrqNA,1198168,new_entry,original,,,"Malaysia has agreed to relax the four people per vehicle limit effective tomorrow, Defence Minister Ismail Sabri Yaakob announced today. Policy takes effect on May 27th, and this is a lifting of social distancing restrictions.",2020-05-26,2020-05-27,,Malaysia,MYS,MY,National,0,,,Other Policy Not Listed Above,,"On May 27th, Malaysia will relax the four people per vehicle limit.","",Malaysia,,,,,,,,,Voluntary/Recommended but No Penalties,National Government,,,,,https://www.malaysiakini.com/news/527333,2020-05-29,2020-05-29T13:46:29Z
R_3DolXE1Ws0MZod0NA,6169082,new_entry,original,,,"Malaysia's Unity Ministry today released list of 174 non-Muslim places of worship allowed to resume operations on June 10th, after the movement control order (MCO) is lifted on June 9th. Number of people in attendance at gatherings cannot be more than 30, and only prayer services are permitted. Wedding activities are postponed to July 31st.",2020-05-28,2020-06-10,,Malaysia,MYS,MY,National,0,,,Other Policy Not Listed Above,,Unity Ministry released list of 174 non-Muslim places of worship allowed to resume operations on June 10th.,"",Malaysia,,,,,,,,,Mandatory (Unspecified/Implied),Other (Please specify in the text box),,,,,https://www.malaysiakini.com/news/527606,2020-05-29,2020-05-29T13:24:17Z
R_55NlkN1GXY6MfS1Aw,2280863,new_entry,original,,,"On the afternoon of March 16, Penang launched the “Penang Lawan Covid-19” (Penang Fights Covid-19) campaign, becoming the first state in Malaysia to do so. The main aim is to dispel fake news and keep the public informed.

“We are providing information such as statistics and news on Covid-19 while also replying enquiries on the latest situation,” said Bukit Mertajam MP Steven Sim, who is heading the communications and public empowerment of Penang Lawan Covid-19 campaign. 

He said the public needs to get the right information from the right sources and they can obtain it from Penang Lawan Covid-19’s Facebook page, Twitter or its website, penanglawancovid19.com.",2020-03-19,2020-03-16,,Malaysia,MYS,MY,Provincial,0,Penang,,Public Awareness Measures,Disseminating information related to COVID-19 to the public that is reliable and factually accurate,,"",Malaysia,,,Penang,,,,,,Voluntary/Recommended but No Penalties,Provincial/State Government,49.2341531141848,46.7346561211786,42.8072977790968,2,https://www.malaymail.com/news/malaysia/2020/03/19/penang-launches-lawan-covid-19-site-in-battle-against-fake-news-ignorance/1848201 ; https://www.nst.com.my/news/nation/2020/03/579622/how-penang-has-stayed-one-step-ahead-covid-19-pandemic ; https://penangmonthly.com/article.aspx?pageid=17198&name=penang_lawan_covid19_off_to_a_strong_start,2020-12-19,2020-12-19T02:45:34Z
R_wTouQvtQdYN4A0NAw,3455038,new_entry,original,,,"District police have reminded the public that only they, the Malaysian Volunteer Corps (Rela) and the Armed Forces are allowed to enforce the movement control order (MCO).",2020-03-22,2020-03-22,,Malaysia,MYS,MY,National,0,,,Public Awareness Measures,Disseminating information related to COVID-19 to the public that is reliable and factually accurate,,"",Malaysia,,,,,,,,,Mandatory (Unspecified/Implied),National Government,50.2568571445642,46.2015377983767,42.1594243134148,1,https://www.msn.com/en-my/news/national/police-only-cops-rela-and-soldiers-allowed-to-enforce-mco/ar-BB11wAe8?li=BBr8Hnu,2020-09-20,2020-09-20T22:13:24Z
R_3rNSlcBnpjWFK3pAw,7129381,new_entry,original,,,The Human Resources Ministry has listed 'dos and donts' for employers and employees following the extension of the movement control order (MCO) between April 1 to 14.,2020-04-01,2020-04-01,,Malaysia,MYS,MY,National,0,,,Public Awareness Measures,Disseminating information related to COVID-19 to the public that is reliable and factually accurate,,"",Malaysia,,,,,,,,,Mandatory (Unspecified/Implied),"National Government,Other (Please specify in the text box)",51.4137075525,46.26894988673,40.7160171718505,1,https://www.thestar.com.my/news/nation/2020/04/01/ministry-lists-employment-039dos-and-don039ts039-during-mco,2020-09-20,2020-09-20T23:13:42Z
R_1QFvj6yoqf30GybAw,5422593,new_entry,original,,,The Transport ministry has created a special website to provide the latest information on the agencies that come under its jurisdiction.,2020-03-26,2020-09-26,,Malaysia,MYS,MY,National,0,,,Public Awareness Measures,Disseminating information related to COVID-19 to the public that is reliable and factually accurate,,"",Malaysia,,,,,,,,,Mandatory (Unspecified/Implied),"National Government,Other (Please specify in the text box)",,,,,https://www.thestar.com.my/news/2020/03/26/transport-ministry-creates-special-website-to-provide-up-to-date-info ; https://www.carsifu.my/news/ransport-ministry-sets-up-special-website-to-provide-current-info,2020-09-20,2020-09-20T23:03:20Z
R_b1J8Y5HhnvX9TUZEq,3218480,new_entry,original,,,Malaysians who have returned from overseas have to go for a health check-up and undergo self-quarantine for 14 days.,2020-03-16,2020-03-18,2020-03-31,Malaysia,MYS,MY,National,0,,,Quarantine,Self-Quarantine (i.e. quarantine at home),,"",Malaysia,,,,,,,,,Mandatory (Unspecified/Implied),National Government,49.6801917407872,46.6666744309057,42.7471979209896,2,https://www.thestar.com.my/news/nation/2020/03/16/malaysia-announces-restricted-movement-measure-after-spike-in-covid-19-cases?utm_source=outbreak.my,2020-09-21,2020-09-21T20:43:22Z
R_vrf2fye6Ta6beE1Bj,9040136,new_entry,original,,,Covid-19 patients must test negative twice before being discharged. Isolation,2020-04-15,2020-04-15,,Malaysia,MYS,MY,National,0,,,Quarantine,Government Quarantine (i.e. quarantine at a government hotel or facility),,"",Malaysia,,,,,,,,,Mandatory (Unspecified/Implied),"National Government,Ministry/Department of Health",53.6696102490078,46.0637468333853,39.9524285575082,1,https://www.thestar.com.my/news/nation/2020/04/15/health-dg-covid-19-patients-must-test-negative-twice-before-being-discharged,2020-09-16,2020-09-16T22:00:40Z
R_8AgxH74xzP3h8w9Eq,5872623,new_entry,original,,,"Malaysia will change its Covid-19 treatment protocol and discharge patients after 14 days of quarantine, even if they test positive for the virus. Health Ministry director-general Dr Noor Hisham Abdullah said today that patients' infectivity levels have been found to plunge to zero after two weeks.",2020-05-26,2020-05-26,,Malaysia,MYS,MY,National,0,,,Quarantine,Self-Quarantine (i.e. quarantine at home),,"",Malaysia,,,,,,,,,Mandatory with Legal Penalties (Jail Time),Ministry/Department of Health,,,,,https://www.malaysiakini.com/news/527361,2020-05-29,2020-05-29T13:37:06Z
R_8AgxH74xzP3h8w9Bj,5872623,new_entry,original,,,"Malaysia will change its Covid-19 treatment protocol and discharge patients after 14 days of quarantine, even if they test positive for the virus. Health Ministry director-general Dr Noor Hisham Abdullah said today that patients' infectivity levels have been found to plunge to zero after two weeks.",2020-05-26,2020-05-26,,Malaysia,MYS,MY,National,0,,,Quarantine,Government Quarantine (i.e. quarantine at a government hotel or facility),,"",Malaysia,,,,,,,,,Mandatory with Legal Penalties (Jail Time),Ministry/Department of Health,,,,,https://www.malaysiakini.com/news/527361,2020-05-29,2020-05-29T13:37:06Z
R_1jvru38xGXUnv38Dg,7503404,new_entry,original,,,"All Malaysians will now be allowed into Sabah without the need to undergo the mandatory two-week quarantine, however, they would have to be certified free Covid-19, with the test done 3 days before their arrival in Sabah from Peninsular Malaysia, Sarawak and Labuan. A letter from the Health Ministry to validate the Covid-19 negative tests should be provided on entry. Malaysians and foreigners working in Sabah would have to produce a valid work pass or other relevant documents.",2020-06-02,2020-06-02,,Malaysia,MYS,MY,Provincial,1,Sabah,,Quarantine,Other Quarantine,,"",Malaysia,One or more geographical or administrative units within one or more countries,,Sabah,,,All Residents (Citizen Residents + Foreign Residents),Inbound,Not Applicable,Mandatory (Unspecified/Implied),Ministry/Department of Health,,,,,https://www.thestar.com.my/news/nation/2020/06/02/no-quarantine-for-m039sians-arriving-in-sabah-but-prior-screening-a-must,2020-09-16,2020-09-16T22:38:37Z
R_1rMjAct9ohlcxIiEo,2086627,new_entry,original,,,"Muhyiddin added that government and private premises except those providing essential services such as water, electricity, energy, telecommunications, post, transportation, water services, oil, gas, fuel, broadcasting, financial, banking, health, pharmacy, the Fire and Rescue Department, prisons, ports, airports, security, defence, cleaning, retail and food supplies will be closed.",2020-03-16,2020-03-18,2020-03-31,Malaysia,MYS,MY,National,1,,,Restriction and Regulation of Businesses,Retail Businesses,,"This type of business  (""Retail Businesses"") is closed/locked down",Malaysia,,,,,,All Residents (Citizen Residents + Foreign Residents),,,Mandatory (Unspecified/Implied),National Government,49.6801917407872,46.6666744309057,42.7471979209896,2,https://www.thestar.com.my/news/nation/2020/03/16/malaysia-announces-restricted-movement-measure-after-spike-in-covid-19-cases?utm_source=outbreak.my,2020-09-23,2020-09-23T13:13:22Z
R_1rMjAct9ohlcxIiEi,2086627,new_entry,original,,,"Muhyiddin added that government and private premises except those providing essential services such as water, electricity, energy, telecommunications, post, transportation, water services, oil, gas, fuel, broadcasting, financial, banking, health, pharmacy, the Fire and Rescue Department, prisons, ports, airports, security, defence, cleaning, retail and food supplies will be closed.",2020-03-16,2020-03-18,2020-03-31,Malaysia,MYS,MY,National,1,,,Restriction and Regulation of Businesses,Restaurants,,"This type of business  (""Restaurants"") is closed/locked down",Malaysia,,,,,,All Residents (Citizen Residents + Foreign Residents),,,Mandatory (Unspecified/Implied),National Government,49.6801917407872,46.6666744309057,42.7471979209896,2,https://www.thestar.com.my/news/nation/2020/03/16/malaysia-announces-restricted-movement-measure-after-spike-in-covid-19-cases?utm_source=outbreak.my,2020-09-23,2020-09-23T13:13:22Z
R_1rMjAct9ohlcxIiAm,2086627,new_entry,original,,,"Muhyiddin added that government and private premises except those providing essential services such as water, electricity, energy, telecommunications, post, transportation, water services, oil, gas, fuel, broadcasting, financial, banking, health, pharmacy, the Fire and Rescue Department, prisons, ports, airports, security, defence, cleaning, retail and food supplies will be closed.",2020-03-16,2020-03-18,2020-03-31,Malaysia,MYS,MY,National,1,,,Restriction and Regulation of Businesses,Bars,,"This type of business  (""Bars"") is closed/locked down",Malaysia,,,,,,All Residents (Citizen Residents + Foreign Residents),,,Mandatory (Unspecified/Implied),National Government,49.6801917407872,46.6666744309057,42.7471979209896,2,https://www.thestar.com.my/news/nation/2020/03/16/malaysia-announces-restricted-movement-measure-after-spike-in-covid-19-cases?utm_source=outbreak.my,2020-09-23,2020-09-23T13:13:22Z
R_1rMjAct9ohlcxIiEs,2086627,new_entry,original,,,"Muhyiddin added that government and private premises except those providing essential services such as water, electricity, energy, telecommunications, post, transportation, water services, oil, gas, fuel, broadcasting, financial, banking, health, pharmacy, the Fire and Rescue Department, prisons, ports, airports, security, defence, cleaning, retail and food supplies will be closed.",2020-03-16,2020-03-18,2020-03-31,Malaysia,MYS,MY,National,1,,,Restriction and Regulation of Businesses,Shopping Centers,,"This type of business  (""Shopping Centers"") is closed/locked down",Malaysia,,,,,,All Residents (Citizen Residents + Foreign Residents),,,Mandatory (Unspecified/Implied),National Government,49.6801917407872,46.6666744309057,42.7471979209896,2,https://www.thestar.com.my/news/nation/2020/03/16/malaysia-announces-restricted-movement-measure-after-spike-in-covid-19-cases?utm_source=outbreak.my,2020-09-23,2020-09-23T13:13:22Z
R_1rMjAct9ohlcxIiAt,2086627,new_entry,original,,,"Muhyiddin added that government and private premises except those providing essential services such as water, electricity, energy, telecommunications, post, transportation, water services, oil, gas, fuel, broadcasting, financial, banking, health, pharmacy, the Fire and Rescue Department, prisons, ports, airports, security, defence, cleaning, retail and food supplies will be closed.",2020-03-16,2020-03-18,2020-03-31,Malaysia,MYS,MY,National,1,,,Restriction and Regulation of Businesses,Commercial Businesses,,"This type of business  (""Commercial Businesses"") is closed/locked down",Malaysia,,,,,,All Residents (Citizen Residents + Foreign Residents),,,Mandatory (Unspecified/Implied),National Government,49.6801917407872,46.6666744309057,42.7471979209896,2,https://www.thestar.com.my/news/nation/2020/03/16/malaysia-announces-restricted-movement-measure-after-spike-in-covid-19-cases?utm_source=outbreak.my,2020-09-23,2020-09-23T13:13:22Z
R_1rMjAct9ohlcxIiDj,2086627,new_entry,original,,,"Muhyiddin added that government and private premises except those providing essential services such as water, electricity, energy, telecommunications, post, transportation, water services, oil, gas, fuel, broadcasting, financial, banking, health, pharmacy, the Fire and Rescue Department, prisons, ports, airports, security, defence, cleaning, retail and food supplies will be closed.",2020-03-16,2020-03-18,2020-03-31,Malaysia,MYS,MY,National,1,,,Restriction and Regulation of Businesses,Personal Grooming Businesses (e.g. hair salons),,"This type of business  (""Personal Grooming Businesses"") is closed/locked down",Malaysia,,,,,,All Residents (Citizen Residents + Foreign Residents),,,Mandatory (Unspecified/Implied),National Government,49.6801917407872,46.6666744309057,42.7471979209896,2,https://www.thestar.com.my/news/nation/2020/03/16/malaysia-announces-restricted-movement-measure-after-spike-in-covid-19-cases?utm_source=outbreak.my,2020-09-23,2020-09-23T13:13:22Z
R_1rMjAct9ohlcxIiAg,2086627,new_entry,original,,,"Muhyiddin added that government and private premises except those providing essential services such as water, electricity, energy, telecommunications, post, transportation, water services, oil, gas, fuel, broadcasting, financial, banking, health, pharmacy, the Fire and Rescue Department, prisons, ports, airports, security, defence, cleaning, retail and food supplies will be closed.",2020-03-16,2020-03-18,2020-03-31,Malaysia,MYS,MY,National,1,,,Restriction and Regulation of Businesses,Agriculture; forestry and fishing,,"This type of business  (""Agriculture; forestry and fishing"") is closed/locked down",Malaysia,,,,,,All Residents (Citizen Residents + Foreign Residents),,,Mandatory (Unspecified/Implied),National Government,49.6801917407872,46.6666744309057,42.7471979209896,2,https://www.thestar.com.my/news/nation/2020/03/16/malaysia-announces-restricted-movement-measure-after-spike-in-covid-19-cases?utm_source=outbreak.my,2020-09-23,2020-09-23T13:13:22Z
R_1rMjAct9ohlcxIiCk,2086627,new_entry,original,,,"Muhyiddin added that government and private premises except those providing essential services such as water, electricity, energy, telecommunications, post, transportation, water services, oil, gas, fuel, broadcasting, financial, banking, health, pharmacy, the Fire and Rescue Department, prisons, ports, airports, security, defence, cleaning, retail and food supplies will be closed.",2020-03-16,2020-03-18,2020-03-31,Malaysia,MYS,MY,National,1,,,Restriction and Regulation of Businesses,Mining and quarrying,,"This type of business  (""Mining and quarrying"") is closed/locked down",Malaysia,,,,,,All Residents (Citizen Residents + Foreign Residents),,,Mandatory (Unspecified/Implied),National Government,49.6801917407872,46.6666744309057,42.7471979209896,2,https://www.thestar.com.my/news/nation/2020/03/16/malaysia-announces-restricted-movement-measure-after-spike-in-covid-19-cases?utm_source=outbreak.my,2020-09-23,2020-09-23T13:13:22Z
R_1rMjAct9ohlcxIiAu,2086627,new_entry,original,,,"Muhyiddin added that government and private premises except those providing essential services such as water, electricity, energy, telecommunications, post, transportation, water services, oil, gas, fuel, broadcasting, financial, banking, health, pharmacy, the Fire and Rescue Department, prisons, ports, airports, security, defence, cleaning, retail and food supplies will be closed.",2020-03-16,2020-03-18,2020-03-31,Malaysia,MYS,MY,National,1,,,Restriction and Regulation of Businesses,Construction,,"This type of business  (""Construction"") is closed/locked down",Malaysia,,,,,,All Residents (Citizen Residents + Foreign Residents),,,Mandatory (Unspecified/Implied),National Government,49.6801917407872,46.6666744309057,42.7471979209896,2,https://www.thestar.com.my/news/nation/2020/03/16/malaysia-announces-restricted-movement-measure-after-spike-in-covid-19-cases?utm_source=outbreak.my,2020-09-23,2020-09-23T13:13:22Z
R_1rMjAct9ohlcxIiEv,2086627,new_entry,original,,,"Muhyiddin added that government and private premises except those providing essential services such as water, electricity, energy, telecommunications, post, transportation, water services, oil, gas, fuel, broadcasting, financial, banking, health, pharmacy, the Fire and Rescue Department, prisons, ports, airports, security, defence, cleaning, retail and food supplies will be closed.",2020-03-16,2020-03-18,2020-03-31,Malaysia,MYS,MY,National,1,,,Restriction and Regulation of Businesses,Telecommunications,,"This type of business  (""Telecommunications"") is closed/locked down",Malaysia,,,,,,All Residents (Citizen Residents + Foreign Residents),,,Mandatory (Unspecified/Implied),National Government,49.6801917407872,46.6666744309057,42.7471979209896,2,https://www.thestar.com.my/news/nation/2020/03/16/malaysia-announces-restricted-movement-measure-after-spike-in-covid-19-cases?utm_source=outbreak.my,2020-09-23,2020-09-23T13:13:22Z
R_1rMjAct9ohlcxIiBg,2086627,new_entry,original,,,"Muhyiddin added that government and private premises except those providing essential services such as water, electricity, energy, telecommunications, post, transportation, water services, oil, gas, fuel, broadcasting, financial, banking, health, pharmacy, the Fire and Rescue Department, prisons, ports, airports, security, defence, cleaning, retail and food supplies will be closed.",2020-03-16,2020-03-18,2020-03-31,Malaysia,MYS,MY,National,1,,,Restriction and Regulation of Businesses,Financial service activities except insurance and pension funding,,"This type of business  (""Financial service activities Financial service activities except insurance and pension funding"") is closed/locked down",Malaysia,,,,,,All Residents (Citizen Residents + Foreign Residents),,,Mandatory (Unspecified/Implied),National Government,49.6801917407872,46.6666744309057,42.7471979209896,2,https://www.thestar.com.my/news/nation/2020/03/16/malaysia-announces-restricted-movement-measure-after-spike-in-covid-19-cases?utm_source=outbreak.my,2020-09-23,2020-09-23T13:13:22Z
R_1rMjAct9ohlcxIiCa,2086627,new_entry,original,,,"Muhyiddin added that government and private premises except those providing essential services such as water, electricity, energy, telecommunications, post, transportation, water services, oil, gas, fuel, broadcasting, financial, banking, health, pharmacy, the Fire and Rescue Department, prisons, ports, airports, security, defence, cleaning, retail and food supplies will be closed.",2020-03-16,2020-03-18,2020-03-31,Malaysia,MYS,MY,National,1,,,Restriction and Regulation of Businesses,Insurance; reinsurance; and pension funding except compulsory social security,,"This type of business  (""Insurance; reinsurance; and pension funding except compulsory social security"") is closed/locked down",Malaysia,,,,,,All Residents (Citizen Residents + Foreign Residents),,,Mandatory (Unspecified/Implied),National Government,49.6801917407872,46.6666744309057,42.7471979209896,2,https://www.thestar.com.my/news/nation/2020/03/16/malaysia-announces-restricted-movement-measure-after-spike-in-covid-19-cases?utm_source=outbreak.my,2020-09-23,2020-09-23T13:13:22Z
