record_id,policy_id,entry_type,correct_type,update_type,update_level,description,date_announced,date_start,date_end,country,ISO_A3,ISO_A2,init_country_level,domestic_policy,province,city,type,type_sub_cat,type_text,institution_status,target_country,target_geog_level,target_region,target_province,target_city,target_other,target_who_what,target_direction,travel_mechanism,compliance,enforcer,index_high_est,index_med_est,index_low_est,index_country_rank,link,date_updated,recorded_date
R_1rMjAct9ohlcxIiFc,2086627,new_entry,original,,,"Muhyiddin added that government and private premises except those providing essential services such as water, electricity, energy, telecommunications, post, transportation, water services, oil, gas, fuel, broadcasting, financial, banking, health, pharmacy, the Fire and Rescue Department, prisons, ports, airports, security, defence, cleaning, retail and food supplies will be closed.",2020-03-16,2020-03-18,2020-03-31,Malaysia,MYS,MY,National,1,,,Restriction and Regulation of Businesses,Transportation (land; water and air),,"This type of business  (""Transportation (land; water and air)"") is closed/locked down",Malaysia,,,,,,All Residents (Citizen Residents + Foreign Residents),,,Mandatory (Unspecified/Implied),National Government,49.6801917407872,46.6666744309057,42.7471979209896,2,https://www.thestar.com.my/news/nation/2020/03/16/malaysia-announces-restricted-movement-measure-after-spike-in-covid-19-cases?utm_source=outbreak.my,2020-09-23,2020-09-23T13:13:22Z
R_1rMjAct9ohlcxIiFn,2086627,new_entry,original,,,"Muhyiddin added that government and private premises except those providing essential services such as water, electricity, energy, telecommunications, post, transportation, water services, oil, gas, fuel, broadcasting, financial, banking, health, pharmacy, the Fire and Rescue Department, prisons, ports, airports, security, defence, cleaning, retail and food supplies will be closed.",2020-03-16,2020-03-18,2020-03-31,Malaysia,MYS,MY,National,1,,,Restriction and Regulation of Businesses,Warehousing and support activities for transportation,,"This type of business  (""Warehousing and support activities for transportation"") is closed/locked down",Malaysia,,,,,,All Residents (Citizen Residents + Foreign Residents),,,Mandatory (Unspecified/Implied),National Government,49.6801917407872,46.6666744309057,42.7471979209896,2,https://www.thestar.com.my/news/nation/2020/03/16/malaysia-announces-restricted-movement-measure-after-spike-in-covid-19-cases?utm_source=outbreak.my,2020-09-23,2020-09-23T13:13:22Z
R_2zcfUXxGafTMpKYAi,3262170,new_entry,original,,,"March 17 - Malaysia will effectively be pausing all non-essential activities for two weeks from tomorrow (March 18) until March 31 to stop the spread of the Covid-19 virus. All business premises will have to close except for supermarkets, sundry goods stores, markets and other places selling daily necessities or things that people would need for their day-to-day lives.",2020-03-17,2020-03-18,2020-03-31,Malaysia,MYS,MY,National,1,,,Restriction and Regulation of Businesses,All or unspecified businesses,,"This type of business  (""All or unspecified businesses"") is closed/locked down",Malaysia,,,,,,All Residents (Citizen Residents + Foreign Residents),,,Mandatory (Unspecified/Implied),"National Government,Police",49.6801917407872,46.6666744309057,42.7471979209896,2,https://www.malaymail.com/news/malaysia/2020/03/17/covid-19-malaysia-goes-into-nationwide-pause-from-tomorrow-and-what-we-know/1847235 ; https://www.nst.com.my/news/nation/2020/03/575372/full-text-pms-movement-control-order-speech-english,2020-12-21,2020-12-21T06:58:29Z
R_30cMvogdDwCYM91NA,5317790,new_entry,original,,,"March 17 - Tomorrow (March 18) which is a Wednesday, until March 31 which is a Tuesday, Malaysia's government’s order to control movement will take effect. 

Only this list of essential services will continue to operate during the two-week period starting from tomorrow: water, electricity, telecommunications, postal, transportation, irrigation, oil and gas, fuel, lubricants, broadcast, financial, banking, health, pharmacies, fire and rescue services, prison services, ports, airports, security, defence, cleaning, sundry goods and food supply.

All other non-essential government and private premises will have to close temporarily.",2020-03-17,2020-03-18,2020-03-31,Malaysia,MYS,MY,National,1,,,Restriction and Regulation of Businesses,,,"",Malaysia,,,,,,All Residents (Citizen Residents + Foreign Residents),,,Mandatory (Unspecified/Implied),"National Government,Police",49.6801917407872,46.6666744309057,42.7471979209896,2,https://www.malaymail.com/news/malaysia/2020/03/17/covid-19-malaysia-goes-into-nationwide-pause-from-tomorrow-and-what-we-know/1847235 ; https://www.nst.com.my/news/nation/2020/03/575372/full-text-pms-movement-control-order-speech-english ; https://www.astroawani.com/berita-malaysia/covid19-perintah-kawalan-pergerakan-mulai-18-hingga-31-mac-pm-233914,2020-12-21,2020-12-21T07:35:37Z
R_1MTacWT6OMhsErfEi,4400782,new_entry,original,,,"March 22 - DBKL posted a notice dated today by the Kuala Lumpur mayor that laid down rules relating to supermarkets, grocery stores, restaurants, public and private markets in Kuala Lumpur that will take effect until March 31.The mayor said that all licensees, workers, visitors, buyers and suppliers who wish to enter such places will have to wear face masks and practise social distancing or staying one metre apart from each other. The owner/businesses are responsible for controlling the number of visitors in supermarkets, grocery stores, restaurants and public and private markets at a time to ensure social distance. The mayor warned that such places will be closed down under the Local Government Act 1976 if the order is not complied with.",2020-03-22,2020-03-22,2020-03-31,Malaysia,MYS,MY,Provincial,1,Kuala Lumpur,,Restriction and Regulation of Businesses,Restaurants,,"This type of business  (""Restaurants"") is allowed to open with conditions",Malaysia,,,Kuala Lumpur,,,All Residents (Citizen Residents + Foreign Residents),,,Mandatory (Other; please list other enforcement mechanisms in the text entry),Provincial/State Government,50.2568571445642,46.2015377983767,42.1594243134148,1,https://www.malaymail.com/news/malaysia/2020/03/22/kl-mayor-says-24-hour-restaurants-can-go-back-to-operating-24-hours/1849038 ; https://www.mstar.com.my/lokal/viral/2020/03/24/doktor-say-face-mask-pasaraya,2020-12-19,2020-12-19T08:55:13Z
R_1MTacWT6OMhsErfEt,4400782,new_entry,original,,,"March 22 - DBKL posted a notice dated today by the Kuala Lumpur mayor that laid down rules relating to supermarkets, grocery stores, restaurants, public and private markets in Kuala Lumpur that will take effect until March 31.The mayor said that all licensees, workers, visitors, buyers and suppliers who wish to enter such places will have to wear face masks and practise social distancing or staying one metre apart from each other. The owner/businesses are responsible for controlling the number of visitors in supermarkets, grocery stores, restaurants and public and private markets at a time to ensure social distance. The mayor warned that such places will be closed down under the Local Government Act 1976 if the order is not complied with.",2020-03-22,2020-03-22,2020-03-31,Malaysia,MYS,MY,Provincial,1,Kuala Lumpur,,Restriction and Regulation of Businesses,Supermarkets/grocery stores,,"This type of business  (""Supermarkets/grocery stores"") is allowed to open with conditions",Malaysia,,,Kuala Lumpur,,,All Residents (Citizen Residents + Foreign Residents),,,Mandatory (Other; please list other enforcement mechanisms in the text entry),Provincial/State Government,50.2568571445642,46.2015377983767,42.1594243134148,1,https://www.malaymail.com/news/malaysia/2020/03/22/kl-mayor-says-24-hour-restaurants-can-go-back-to-operating-24-hours/1849038 ; https://www.mstar.com.my/lokal/viral/2020/03/24/doktor-say-face-mask-pasaraya,2020-12-19,2020-12-19T08:55:13Z
R_1MTacWT6OMhsErfCu,4400782,new_entry,original,,,"March 22 - DBKL posted a notice dated today by the Kuala Lumpur mayor that laid down rules relating to supermarkets, grocery stores, restaurants, public and private markets in Kuala Lumpur that will take effect until March 31.The mayor said that all licensees, workers, visitors, buyers and suppliers who wish to enter such places will have to wear face masks and practise social distancing or staying one metre apart from each other. The owner/businesses are responsible for controlling the number of visitors in supermarkets, grocery stores, restaurants and public and private markets at a time to ensure social distance. The mayor warned that such places will be closed down under the Local Government Act 1976 if the order is not complied with.",2020-03-22,2020-03-22,2020-03-31,Malaysia,MYS,MY,Provincial,1,Kuala Lumpur,,Restriction and Regulation of Businesses,Other Businesses,,"This type of business  (""Other Businesses"") is allowed to open with conditions",Malaysia,,,Kuala Lumpur,,,All Residents (Citizen Residents + Foreign Residents),,,Mandatory (Other; please list other enforcement mechanisms in the text entry),Provincial/State Government,50.2568571445642,46.2015377983767,42.1594243134148,1,https://www.malaymail.com/news/malaysia/2020/03/22/kl-mayor-says-24-hour-restaurants-can-go-back-to-operating-24-hours/1849038 ; https://www.mstar.com.my/lokal/viral/2020/03/24/doktor-say-face-mask-pasaraya,2020-12-19,2020-12-19T08:55:13Z
R_xgZvunpGPw2IirvEi,4400782,update,original,End of Policy,,"March 24 - Kuala Lumpur City Hall (DBKL) today cancelled an order from two days ago that made it compulsory for face masks to be used by everyone including customers in supermarkets and restaurants here. The KL mayor instead said today that the practice of wearing face masks was now “encouraged” in such premises.

The mayor however said such premises in Kuala Lumpur, Malaysia still have to make sure everyone practises social distancing or staying apart one metre from each other.

“All licensees, employees, visitors, customers and suppliers who wish to enter supermarkets, grocery stores, restaurants, public and private markets until this March 31, 2020 must: 1. adhere to social distancing of one metre, 2. Shop owners/ operators/ associations/ traders are responsible for controlling the number of visitors in supermarkets, grocery stores, restaurants, public and private markets at any one time to ensure social distancing of one metre,” the new notice today said.",2020-03-24,2020-03-24,2020-03-31,Malaysia,MYS,MY,Provincial,0,Kuala Lumpur,,Restriction and Regulation of Businesses,Restaurants,,"This type of business  (""Restaurants"") is allowed to open with conditions",Malaysia,,,Kuala Lumpur,,,All Residents (Citizen Residents + Foreign Residents),,,Mandatory (Other; please list other enforcement mechanisms in the text entry),Provincial/State Government,51.0275400246002,46.2321246584111,41.4557765810081,1,"NA ; https://www.freemalaysiatoday.com/category/nation/2020/03/24/dbkl-eases-up-on-masks-sanitiser-requirement-for-supermarkets-restaurants/ ; Free Malaysia Today ; DBKL eases up on masks, sanitiser requirement for supermarkets, restaurants",2020-12-21,2020-12-21T05:44:42Z
R_xgZvunpGPw2IirvEt,4400782,update,original,End of Policy,,"March 24 - Kuala Lumpur City Hall (DBKL) today cancelled an order from two days ago that made it compulsory for face masks to be used by everyone including customers in supermarkets and restaurants here. The KL mayor instead said today that the practice of wearing face masks was now “encouraged” in such premises.

The mayor however said such premises in Kuala Lumpur, Malaysia still have to make sure everyone practises social distancing or staying apart one metre from each other.

“All licensees, employees, visitors, customers and suppliers who wish to enter supermarkets, grocery stores, restaurants, public and private markets until this March 31, 2020 must: 1. adhere to social distancing of one metre, 2. Shop owners/ operators/ associations/ traders are responsible for controlling the number of visitors in supermarkets, grocery stores, restaurants, public and private markets at any one time to ensure social distancing of one metre,” the new notice today said.",2020-03-24,2020-03-24,2020-03-31,Malaysia,MYS,MY,Provincial,0,Kuala Lumpur,,Restriction and Regulation of Businesses,Supermarkets/grocery stores,,"This type of business  (""Supermarkets/grocery stores"") is allowed to open with conditions",Malaysia,,,Kuala Lumpur,,,All Residents (Citizen Residents + Foreign Residents),,,Mandatory (Other; please list other enforcement mechanisms in the text entry),Provincial/State Government,51.0275400246002,46.2321246584111,41.4557765810081,1,"NA ; https://www.freemalaysiatoday.com/category/nation/2020/03/24/dbkl-eases-up-on-masks-sanitiser-requirement-for-supermarkets-restaurants/ ; Free Malaysia Today ; DBKL eases up on masks, sanitiser requirement for supermarkets, restaurants",2020-12-21,2020-12-21T05:44:42Z
R_xgZvunpGPw2IirvCu,4400782,update,original,End of Policy,,"March 24 - Kuala Lumpur City Hall (DBKL) today cancelled an order from two days ago that made it compulsory for face masks to be used by everyone including customers in supermarkets and restaurants here. The KL mayor instead said today that the practice of wearing face masks was now “encouraged” in such premises.

The mayor however said such premises in Kuala Lumpur, Malaysia still have to make sure everyone practises social distancing or staying apart one metre from each other.

“All licensees, employees, visitors, customers and suppliers who wish to enter supermarkets, grocery stores, restaurants, public and private markets until this March 31, 2020 must: 1. adhere to social distancing of one metre, 2. Shop owners/ operators/ associations/ traders are responsible for controlling the number of visitors in supermarkets, grocery stores, restaurants, public and private markets at any one time to ensure social distancing of one metre,” the new notice today said.",2020-03-24,2020-03-24,2020-03-31,Malaysia,MYS,MY,Provincial,0,Kuala Lumpur,,Restriction and Regulation of Businesses,Other Businesses,,"This type of business  (""Other Businesses"") is allowed to open with conditions",Malaysia,,,Kuala Lumpur,,,All Residents (Citizen Residents + Foreign Residents),,,Mandatory (Other; please list other enforcement mechanisms in the text entry),Provincial/State Government,51.0275400246002,46.2321246584111,41.4557765810081,1,"NA ; https://www.freemalaysiatoday.com/category/nation/2020/03/24/dbkl-eases-up-on-masks-sanitiser-requirement-for-supermarkets-restaurants/ ; Free Malaysia Today ; DBKL eases up on masks, sanitiser requirement for supermarkets, restaurants",2020-12-21,2020-12-21T05:44:42Z
R_9oxTqV8ECIxnlbrEs,8072178,new_entry,original,,,"In Malaysia, spas and massage centres can resume their operations beginning next month while trying out clothes before purchase at shopping complexes is now allowed, said senior minister Ismail Sabri Yaakob.",2020-06-26,2020-07-01,,Malaysia,MYS,MY,National,1,,,Restriction and Regulation of Businesses,Shopping Centers,,"This type of business (""Shopping Centers"") is allowed to open with no conditions attached",Malaysia,,,,,,All Residents (Citizen Residents + Foreign Residents),,,Mandatory (Unspecified/Implied),"National Government,Ministry/Department of Health",,,,,https://www.malaysiakini.com/news/531878,2020-06-28,2020-06-28T16:32:09Z
R_9oxTqV8ECIxnlbrDj,8072178,new_entry,original,,,"In Malaysia, spas and massage centres can resume their operations beginning next month while trying out clothes before purchase at shopping complexes is now allowed, said senior minister Ismail Sabri Yaakob.",2020-06-26,2020-07-01,,Malaysia,MYS,MY,National,1,,,Restriction and Regulation of Businesses,Personal Grooming Businesses (e.g. hair salons),,"This type of business (""Personal Grooming Businesses"") is allowed to open with no conditions attached",Malaysia,,,,,,All Residents (Citizen Residents + Foreign Residents),,,Mandatory (Unspecified/Implied),"National Government,Ministry/Department of Health",,,,,https://www.malaysiakini.com/news/531878,2020-06-28,2020-06-28T16:32:09Z
R_2Y5GJhLSWiYqNReCb,599014,new_entry,original,,,"March 15 — Effective immediately, all counters at Malaysia My Second Home (MM2H) centre on level two and 10 at the Ministry of Tourism, Arts and Culture here are closed until April 30 as part of the Covid-19 preventive measures. 

Tourism, Arts and Culture Minister Datuk Seri Nancy Shukri in a statement today said the decision was made after taking into account that most of the visitors to the centre were foreigners from various countries. “This measure is also important in reducing the probability of MM2H personnel being infected with the virus by foreign visitors,” she said.",2020-03-15,2020-03-15,2020-04-30,Malaysia,MYS,MY,National,1,,,Restriction and Regulation of Government Services,Issuing of permits/certificates and/or processing of government documents,,This service provided by the government is provided with conditions atttached,Malaysia,,,,,,All Residents (Citizen Residents + Foreign Residents),,,Mandatory (Unspecified/Implied),Other (Please specify in the text box),49.3827333275864,46.7134218983335,42.8869838665028,3,https://www.malaymail.com/news/malaysia/2020/03/15/covid-19-mm2h-counters-to-close-until-april-30/1846753 ; https://www.tourism.gov.my/media/view/temporary-closure-all-of-mm2h-counters-until-30th-april-2020,2020-12-21,2020-12-21T22:26:42Z
R_6VkGGUoLyWxdFPbCb,4121069,new_entry,original,,,"March 16 — Members of the public who have dealings with Immigration offices nationwide will be subjected to body temperature screenings in a bid to stem the Covid-19 outbreak.

Immigration Department director-general Datuk Khairul Dzaimee Daud said the screenings will be conducted at the main lobby of the offices as the other entrances will be closed.

“For now, the operating hours for Immigration counters will remain the same, but we will limit the number of people allowed in,” he said.",2020-03-16,2020-03-16,,Malaysia,MYS,MY,National,1,,,Restriction and Regulation of Government Services,Issuing of permits/certificates and/or processing of government documents,,This service provided by the government is provided with conditions atttached,Malaysia,,,,,,All Residents (Citizen Residents + Foreign Residents),,,Mandatory (Unspecified/Implied),Other (Please specify in the text box),49.2341531141848,46.7346561211786,42.8072977790968,2,https://www.malaymail.com/news/malaysia/2020/03/16/covid-19-temperature-screening-a-must-at-all-immigration-offices/1847144 ; https://www.bernama.com/bm/am/news_covid-19.php?id=1821794,2020-12-19,2020-12-19T14:37:21Z
R_UooEQ5AUNzucrvzNA,4803845,new_entry,original,,,The Government will be banning public gatherings of over 250 people in a bid to contain the spread of the COVID-19 coronavirus.,2020-03-12,2020-03-12,,Malaysia,MYS,MY,National,1,,,Restrictions of Mass Gatherings,,,"",Malaysia,,,,,,All Residents (Citizen Residents + Foreign Residents),,,Mandatory (Unspecified/Implied),"National Government,Other (Please specify in the text box)",50.052069131577,46.5924123228078,42.4653666699701,1,https://www.theedgemarkets.com/article/malaysia-bans-public-gatherings-over-250-people-curb-covid19-spread,2020-09-21,2020-09-21T20:05:33Z
R_1Kr2idVUGrQfLPRNA,4905688,new_entry,original,,,"Prime Minister Tan Sri Muhyiddin Yassin said the prohibition of movement and mass assembly nationwide would include all religious, sports, social and cultural activities. Muhyiddin added that all religious activities in mosques and surau will be suspended in line with the Special Muzakarah Council's decision on Sunday (March 15). He said that this includes Friday prayers.",2020-03-16,2020-03-18,2020-03-31,Malaysia,MYS,MY,National,1,,,Restrictions of Mass Gatherings,,,"",Malaysia,,,,,,All Residents (Citizen Residents + Foreign Residents),,,Mandatory (Unspecified/Implied),National Government,49.6801917407872,46.6666744309057,42.7471979209896,2,https://www.thestar.com.my/news/nation/2020/03/16/malaysia-announces-restricted-movement-measure-after-spike-in-covid-19-cases?utm_source=outbreak.my,2020-09-21,2020-09-21T20:27:33Z
R_1mlbGxPa2Y6SER5Ak,5633032,new_entry,original,,,"From May 4, Malaysia's economic sectors involving mass gatherings will continue to be closed. Individuals are prohibited from joining group activities and sports involving physical contact such as football, rugby, night clubs, entertainment outlets, swimming at public pools, religious mass gatherings, exhibitions, and Ramadan food bazaars. Activities involving ten individuals or fewer, such as tennis, jogging, cycling, golf, and running will be permitted.",2020-05-10,2020-05-04,2020-06-09,Malaysia,MYS,MY,National,1,,,Restrictions of Mass Gatherings,Annually recurring event allowed to occur with certain conditions,,"",Malaysia,,,,,,All Residents (Citizen Residents + Foreign Residents),,,Mandatory (Unspecified/Implied),National Government,,,,,https://www.garda.com/crisis24/news-alerts/340661/malaysia-authorities-extend-covid-19-business-and-movement-restrictions-until-june-9-update-20,2020-09-23,2020-09-23T15:33:29Z
R_1mlbGxPa2Y6SER5Ar,5633032,new_entry,original,,,"From May 4, Malaysia's economic sectors involving mass gatherings will continue to be closed. Individuals are prohibited from joining group activities and sports involving physical contact such as football, rugby, night clubs, entertainment outlets, swimming at public pools, religious mass gatherings, exhibitions, and Ramadan food bazaars. Activities involving ten individuals or fewer, such as tennis, jogging, cycling, golf, and running will be permitted.",2020-05-10,2020-05-04,2020-06-09,Malaysia,MYS,MY,National,1,,,Restrictions of Mass Gatherings,Cancellation of a recreational or commercial event,,"",Malaysia,,,,,,All Residents (Citizen Residents + Foreign Residents),,,Mandatory (Unspecified/Implied),National Government,,,,,https://www.garda.com/crisis24/news-alerts/340661/malaysia-authorities-extend-covid-19-business-and-movement-restrictions-until-june-9-update-20,2020-09-23,2020-09-23T15:33:29Z
R_1mlbGxPa2Y6SER5Al,5633032,new_entry,original,,,"From May 4, Malaysia's economic sectors involving mass gatherings will continue to be closed. Individuals are prohibited from joining group activities and sports involving physical contact such as football, rugby, night clubs, entertainment outlets, swimming at public pools, religious mass gatherings, exhibitions, and Ramadan food bazaars. Activities involving ten individuals or fewer, such as tennis, jogging, cycling, golf, and running will be permitted.",2020-05-10,2020-05-04,2020-06-09,Malaysia,MYS,MY,National,1,,,Restrictions of Mass Gatherings,Attendance at religious services restricted (e.g. mosque/church closings),,"",Malaysia,,,,,,All Residents (Citizen Residents + Foreign Residents),,,Mandatory (Unspecified/Implied),National Government,,,,,https://www.garda.com/crisis24/news-alerts/340661/malaysia-authorities-extend-covid-19-business-and-movement-restrictions-until-june-9-update-20,2020-09-23,2020-09-23T15:33:29Z
R_1mlbGxPa2Y6SER5Dd,5633032,new_entry,original,,,"From May 4, Malaysia's economic sectors involving mass gatherings will continue to be closed. Individuals are prohibited from joining group activities and sports involving physical contact such as football, rugby, night clubs, entertainment outlets, swimming at public pools, religious mass gatherings, exhibitions, and Ramadan food bazaars. Activities involving ten individuals or fewer, such as tennis, jogging, cycling, golf, and running will be permitted.",2020-05-10,2020-05-04,2020-06-09,Malaysia,MYS,MY,National,1,,,Restrictions of Mass Gatherings,Other mass gatherings not specified above restricted,,"",Malaysia,,,,,,All Residents (Citizen Residents + Foreign Residents),,,Mandatory (Unspecified/Implied),National Government,,,,,https://www.garda.com/crisis24/news-alerts/340661/malaysia-authorities-extend-covid-19-business-and-movement-restrictions-until-june-9-update-20,2020-09-23,2020-09-23T15:33:29Z
R_1mectmofmJrAsDUCc,9923601,new_entry,original,,,Avoid close contact with others by distancing yourself at least two metres away from another person.,2020-03-13,2020-03-13,,Malaysia,MYS,MY,Provincial,1,Sabah,,Social Distancing,Keep a distance of some other distance not listed above. Please note the distance in meters in the text entry.,,"",Malaysia,,,Sabah,,,All Residents (Citizen Residents + Foreign Residents),,,Mandatory (Unspecified/Implied),Provincial/State Government,49.5963560095573,46.5705018022034,42.4789347715437,2,https://www.thestar.com.my/news/nation/2020/03/13/sabah-comes-up-with-steps-to-curb-spread-of-covid-19,2020-09-19,2020-09-19T00:03:37Z
