"","record_id","policy_id","entry_type","correct_type","update_type","update_level","description","date_announced","date_start","date_end","country","ISO_A3","ISO_A2","init_country_level","domestic_policy","province","city","type","type_sub_cat","type_text","school_status","target_country","target_geog_level","target_region","target_province","target_city","target_other","target_who_what","target_direction","travel_mechanism","compliance","enforcer","index_high_est","index_med_est","index_low_est","index_country_rank","link","date_updated","recorded_date"
"36","R_1CpS12Jg2tMyJSzNA",8353772,"new_entry","original","NA",NA,"As of 17 March Tanzania banned all public gathering,closed schools from Kindergarden to form 6 and suspended all sports activities for 30 days",2020-03-17,2020-03-17,2020-04-15,"Tanzania","TZA","TZ","National",1,NA,NA,"Restrictions of Mass Gatherings",NA,NA,"","Tanzania",NA,NA,NA,NA,NA,"All Residents (Citizen Residents + Foreign Residents)",NA,NA,"Mandatory (Unspecified/Implied)","National Government",53.0402911105294,52.0840635944004,51.2254403622644,127,"www.thecitizen.co.tz/news/1840340-5494476-agwmfd/index.html",2020-04-02,"2020-04-02 12:37:36"
"37","R_3gO6KD05XUdFHGQNA",4590228,"new_entry","original","NA",NA,"Tanzania government banned sports activities, political rallies and all forms of public gatherings, calling upon the public to observe the caution as part of plan to prevent the epidemic",2020-03-18,2020-03-19,2020-04-20,"Tanzania","TZA","TZ","National",1,NA,NA,"Restrictions of Mass Gatherings",NA,NA,"","Tanzania",NA,NA,NA,NA,NA,"All Residents (Citizen Residents + Foreign Residents)",NA,NA,"Mandatory with Legal Penalties (Jail Time),Mandatory (Unspecified/Implied)","National Government",53.5820087456672,52.1000898867809,50.4396666501015,121,"https://allafrica.com/stories/202003171108.html",2020-04-02,"2020-04-02 13:20:28"
"38","R_O2yv1fmS7c4ptGpAo",9010845,"new_entry","original","NA",NA,"Tanzania Cancels its National Holiday Celebration as COVID Rate Rises on April 16.",2020-04-16,2020-04-16,NA,"Tanzania","TZA","TZ","National",1,NA,NA,"Restrictions of Mass Gatherings","Cancellation of an annually recurring event",NA,"","Tanzania",NA,NA,NA,NA,NA,"All Residents (Citizen Residents + Foreign Residents)",NA,NA,"Mandatory (Unspecified/Implied)","National Government",58.828251955864,51.7224984528324,47.6886359573746,46,"https://www.voanews.com/africa/tanzania-cancels-its-national-holiday-celebration-covid-rate-rises",2020-05-03,"2020-05-03 19:31:48"
"39","R_2SencHwXiFBFg4fNA",91787,"new_entry","original","NA",NA,"All BRT buses will be required to carry passengers according to their operating license (nobody is allowed to be standing in DalaDalas etc.)",2020-03-19,2020-03-20,NA,"Tanzania","TZA","TZ","National",1,NA,NA,"Social Distancing",NA,NA,"","Tanzania",NA,NA,NA,NA,NA,"All Residents (Citizen Residents + Foreign Residents)",NA,NA,"Mandatory (Unspecified/Implied)","National Government",53.0335864097017,51.9327413622775,51.0184332066396,102,"https://www.thecitizen.co.tz/news/-New-guidelines-on-public-transport-to-curb-Covid-19/1840340-5498184-15s9glez/index.html",2020-04-02,"2020-04-02 11:49:19"
"40","R_3nvpoSM19cUNDsUNA",9236027,"new_entry","original","NA",NA,"All primary and secondary schools in Tanzania closed",2020-03-17,2020-04-17,2020-04-17,"Tanzania","TZA","TZ","National",1,NA,NA,"Social Distancing",NA,NA,"","Tanzania",NA,NA,NA,NA,NA,"All Residents (Citizen Residents + Foreign Residents)",NA,NA,"Mandatory with Legal Penalties (Jail Time)","National Government",58.5504679539298,51.8728293849839,47.6317866829786,49,"https://www.thecitizen.co.tz/news/-Tanzania-extends-school-closure-to-universities-due-to-virus-/1840340-5495352-qgiccoz/index.html",2020-04-02,"2020-04-02 11:16:53"
