"","record_id","policy_id","entry_type","correct_type","update_type","update_level","description","date_announced","date_start","date_end","country","ISO_A3","ISO_A2","init_country_level","domestic_policy","province","city","type","type_sub_cat","type_text","school_status","target_country","target_geog_level","target_region","target_province","target_city","target_other","target_who_what","target_direction","travel_mechanism","compliance","enforcer","index_high_est","index_med_est","index_low_est","index_country_rank","link","date_updated","recorded_date"
"51","R_3ERX45SsotAZMwZCk","7389166","new_entry","original","NA",NA,"Belgium is starting Phase 4 as of July 1st. The public capacity for one-off events has expanded to a 200 person indoor capacity and 400 person outdoor capacity based on permits given out by local authoriteis",2020-06-24,2020-07-01,NA,"Belgium","BEL","BE","National",1,NA,NA,"Restrictions of Mass Gatherings","Other mass gatherings not specified above restricted",NA,"","Belgium",NA,NA,NA,NA,NA,"All Residents (Citizen Residents + Foreign Residents)",NA,NA,"Mandatory with Fines,Mandatory (Unspecified/Implied)","National Government,Municipal Government",NA,NA,NA,NA,"https://www.info-coronavirus.be/en/news/nsc-25-06/",2020-09-25,2020-09-25 17:14:31
"52","R_2bZyXcS1CebUpHoNA","6085115","new_entry","original","NA",NA,"12th of March: Belgium encourages citizens to work from home.
The instructions are as follows:
Keep working, but work from home as much as possible. Postpone meetings or organise them online. When at work, keep a distance from each other and follow the hygiene prescriptions. If possible, change working hours so that less people are at work at the same time.",2020-03-12,2020-03-13,2020-05-03,"Belgium","BEL","BE","National",1,NA,NA,"Social Distancing",NA,NA,"","Belgium",NA,NA,NA,NA,NA,"All Residents (Citizen Residents + Foreign Residents)",NA,NA,"Mandatory with Legal Penalties (Jail Time)","National Government,Police",52.201751878945,46.5661228808334,41.496924680428,1,"https://werk.belgie.be/nl/nieuws/coronavirus-terug-aan-het-werk",2020-03-31,2020-03-31 16:06:52
"53","R_10CobfKQtxHo1PbNA","6085115","update","original","NA",NA,"Teleworking/working from home will be prolonged until April 19th.",2020-04-01,2020-04-01,2020-05-03,"Belgium","BEL","BE","National",1,NA,NA,"Social Distancing",NA,NA,"","Belgium",NA,NA,NA,NA,NA,"All Residents (Citizen Residents + Foreign Residents)",NA,NA,"Mandatory with Legal Penalties (Jail Time),Mandatory with Fines","National Government,Police",49.9134900550758,46.9106040479291,43.9397519089149,4,"https://www.vrt.be/vrtnws/nl/2020/03/13/coronavirus-antwoord-op-uw-vragen/",2020-04-03,2020-04-03 12:20:46
"54","R_3ekoGcvTOyleVQ2NA","6085115","update","correction","NA","Strengthening","Teleworking/working from home will be prolonged until April 19th.",2020-04-01,2020-04-01,2020-05-03,"Belgium","BEL","BE","National",0,NA,NA,"Social Distancing",NA,NA,"","Belgium",NA,NA,NA,NA,NA,"All Residents (Citizen Residents + Foreign Residents)",NA,NA,"Mandatory with Legal Penalties (Jail Time),Mandatory with Fines","National Government,Police",49.9134900550758,46.9106040479291,43.9397519089149,4,"https://www.vrt.be/vrtnws/nl/2020/03/13/coronavirus-antwoord-op-uw-vragen/",2020-04-27,2020-04-27 21:37:07
"55","R_22y9D3IBshMcpvfNA","6085115","update","original","NA","Strengthening","15th of April: Belgium encourages citizens to work from home.
The instructions are as follows:
Keep working, but work from home as much as possible. Postpone meetings or organise them online. When at work, keep a distance from each other and follow the hygiene prescriptions. If possible, change working hours so that less people are at work at the same time.

This advice is set to last until May 3rd.",2020-04-15,2020-04-15,2020-05-03,"Belgium","BEL","BE","National",0,NA,NA,"Social Distancing",NA,NA,"","Belgium",NA,NA,NA,NA,NA,"All Residents (Citizen Residents + Foreign Residents)",NA,NA,"Mandatory with Legal Penalties (Jail Time)","National Government,Police",52.2371336442796,46.7274319990701,41.2103518318142,3,"https://werk.belgie.be/nl/nieuws/coronavirus-terug-aan-het-werk",2020-04-20,2020-04-20 16:20:17
"56","R_1LUWGFSkYT3OubzNA","1945118","update","original","NA","Relaxing","April 24th Belgium allows the exrcise of sports that do not require physical contact in open air from May 4th onward The policy applies to the entire country",2020-04-24,2020-05-04,2020-07-31,"Belgium","BEL","BE",NA,1,NA,NA,"Social Distancing",NA,NA,"",NA,NA,NA,NA,NA,NA,"All Residents (Citizen Residents + Foreign Residents)",NA,NA,NA,NA,NA,NA,NA,NA,"https://www.info-coronavirus.be/nl/news/nvr-24-04/",2020-04-26,2020-04-26 12:54:41
"57","R_1NYL1ZQpUfLXVZfNA","1945118","update","original","Change of Policy","Both Strengthening and Relaxing","18th of March Belgium places a ban on all gatherings until April 5th at least",2020-05-06,2020-05-06,2020-07-31,"Belgium","BEL","BE",NA,0,NA,NA,"Social Distancing",NA,NA,"",NA,NA,NA,NA,NA,NA,"All Residents (Citizen Residents + Foreign Residents)",NA,NA,NA,NA,NA,NA,NA,NA,"https://www.info-coronavirus.be/nl/news/nvr-24-04/",2020-05-12,2020-05-12 14:38:36
"58","R_31tn3OEMA5NSTbDBp","167404","new_entry","original","NA",NA,"Belgium is starting Phase 3 of the phase-out plan starting on June 8th 2020. The hospitality industry will be allowed to open partially (gaming halls, banqueting and reception halls will not be allowed to reopen until 1 July).  Banqueting and reception halls will be allowed to operate with a maximum of 50 people present. Nightclubs are not allowed to open before the end of August, as no safety distance can be ensured.

In addition to these exceptions, all other hospitality establishments such as cafes, bars and restaurants will reopen according to a very precise protocol. The main features of this protocol include:

    A distance of 1.50 metres between the tables;
    A maximum of 10 persons per table;
    Each customer must remain seated at their own table;
    Waiters have to wear masks;
    All hospitality establishments are allowed to remain open until one o’clock in the morning, just like the night shops",2020-06-03,2020-06-08,NA,"Belgium","BEL","BE","National",1,NA,NA,"Social Distancing","Keeping a distance of at least 6 feet or 1.5 meters apart",NA,"","Belgium",NA,NA,NA,NA,NA,"All Residents (Citizen Residents + Foreign Residents)",NA,NA,"Mandatory (Unspecified/Implied)","National Government",NA,NA,NA,NA,"https://www.info-coronavirus.be/en/news/nsc-0306/",2020-06-14,2020-06-14 17:46:48
"59","R_31tn3OEMA5NSTbDCj","167404","new_entry","original","NA",NA,"Belgium is starting Phase 3 of the phase-out plan starting on June 8th 2020. The hospitality industry will be allowed to open partially (gaming halls, banqueting and reception halls will not be allowed to reopen until 1 July).  Banqueting and reception halls will be allowed to operate with a maximum of 50 people present. Nightclubs are not allowed to open before the end of August, as no safety distance can be ensured.

In addition to these exceptions, all other hospitality establishments such as cafes, bars and restaurants will reopen according to a very precise protocol. The main features of this protocol include:

    A distance of 1.50 metres between the tables;
    A maximum of 10 persons per table;
    Each customer must remain seated at their own table;
    Waiters have to wear masks;
    All hospitality establishments are allowed to remain open until one o’clock in the morning, just like the night shops",2020-06-03,2020-06-08,NA,"Belgium","BEL","BE","National",1,NA,NA,"Social Distancing","Other Mask Wearing Policy",NA,"","Belgium",NA,NA,NA,NA,NA,"All Residents (Citizen Residents + Foreign Residents)",NA,NA,"Mandatory (Unspecified/Implied)","National Government",NA,NA,NA,NA,"https://www.info-coronavirus.be/en/news/nsc-0306/",2020-06-14,2020-06-14 17:46:48
"60","R_2Y9Rcej4G9BdRKsBp","2744006","new_entry","original","NA",NA,"n Belgium as of June 8th, religious ceremonies may be resumed subject to the following: 

-Safety distances must be observed with a maximum of 100 persons;
-As of July, this number will be increased to 200, just like in the cultural and sports industries;
-Rituals with physical contact are still not allowed.
",2020-06-03,2020-06-08,NA,"Belgium","BEL","BE","National",1,NA,NA,"Social Distancing","Keeping a distance of at least 6 feet or 1.5 meters apart",NA,"","Belgium",NA,NA,NA,NA,NA,"All Residents (Citizen Residents + Foreign Residents)",NA,NA,"Mandatory (Unspecified/Implied)","National Government",NA,NA,NA,NA,"https://www.info-coronavirus.be/en/news/nsc-0306/",2020-06-14,2020-06-14 18:22:21
"61","R_1EZFv49JyOw69maBp","3038122","new_entry","original","NA",NA,"In Belgium as of June 8th 2020, sporting events (organized and supervised by a person in charge) are limited to 20 people in June and 50 people in July, subject to safety distances.

From 8 June, non-contact sports activities can be resumed, both indoor and outdoor, amateur or professional, league and training. Gyms and fitness rooms may also be reopened, subject to protocol.

However:

    Contact sports (e.g. judo, boxing, football, etc.) should always be limited to “contactless” training;
    As far as sports facilities are concerned, the protocols will also have to be followed. Changing rooms and showers will still not be accessible;
    Swimming pools, saunas and wellness centres have to remain closed at this stage.

As far as sports are concerned, everything will be allowed again from 1 July, provided that the protocols are respected.

In both the cultural and sports industries, from 1 July, a seated audience of up to 200 people - regardless of the size of the venue - will be allowed, subject to safety distances and always in strict compliance with protocols.",2020-06-03,2020-06-08,NA,"Belgium","BEL","BE","National",1,NA,NA,"Social Distancing","Keeping a distance of at least 6 feet or 1.5 meters apart",NA,"","Belgium",NA,NA,NA,NA,NA,"All Residents (Citizen Residents + Foreign Residents)",NA,NA,"Mandatory (Unspecified/Implied)","National Government",NA,NA,NA,NA,"https://www.info-coronavirus.be/en/news/nsc-0306/",2020-06-14,2020-06-14 18:17:17
"62","R_2fwJwu8OXm3V7pSCj","3277295","new_entry","original","NA",NA,"In Belgium as of June 8th, leisure and free-time activities will be permitted.

Cultural and leisure activities have to be organised in such a way as to avoid large gatherings. Wearing a mask is recommended at all times. Gatherings (e.g. village fairs, village festivals, etc.) are prohibited until 1 August and may then be resumed gradually. Large-scale mass events, on the other hand, will remain prohibited until 31 August, as previously announced.",2020-06-03,2020-06-08,NA,"Belgium","BEL","BE","National",1,NA,NA,"Social Distancing","Other Mask Wearing Policy",NA,"","Belgium",NA,NA,NA,NA,NA,"All Residents (Citizen Residents + Foreign Residents)",NA,NA,"Voluntary/Recommended but No Penalties","National Government",NA,NA,NA,NA,"https://www.info-coronavirus.be/en/news/nsc-0306/",2020-06-14,2020-06-14 18:41:24
"63","R_2zT5o523ubBeGXABp","6241282","new_entry","original","NA",NA,"In Belgium from 8 June, cultural activities may resume without an audience present.  Performances with an audience - including cinemas - can be resumed from 1 July, but only subject to specific rules regarding crowd management, such as respecting the safety distance in the audience and a maximum of 200 attendees.

Activities should be organised in such a way as to avoid gatherings of too many people, e.g. outside the venue.  When people take part in cultural and leisure activities, wearing a mask is recommended at all times.  Cultural events would be limited to 20 people in June and 50 people in July, subject to safety restritions.",2020-06-03,2020-06-08,NA,"Belgium","BEL","BE","National",1,NA,NA,"Social Distancing","Keeping a distance of at least 6 feet or 1.5 meters apart",NA,"","Belgium",NA,NA,NA,NA,NA,"All Residents (Citizen Residents + Foreign Residents)",NA,NA,"Mandatory (Unspecified/Implied)","National Government",NA,NA,NA,NA,"https://www.info-coronavirus.be/en/news/nsc-0306/",2020-06-14,2020-06-14 18:02:24
