"","record_id","policy_id","entry_type","correct_type","update_type","update_level","description","date_announced","date_start","date_end","country","ISO_A3","ISO_A2","init_country_level","domestic_policy","province","city","type","type_sub_cat","type_text","institution_status","target_country","target_geog_level","target_region","target_province","target_city","target_other","target_who_what","target_direction","travel_mechanism","compliance","enforcer","index_high_est","index_med_est","index_low_est","index_country_rank","link","date_updated","recorded_date"
"43","R_1ig65SysnN0uM9dBj","5016072","new_entry","original",NA,NA,"Rwanda to follow regulations put in place by IATA as it plans to reopen its Airports for International Commercial Flights beginning 1 August 2020",2020-07-04,2020-08-01,NA,"Rwanda","RWA","RW","National",0,NA,NA,"Hygiene","Hygiene measures for public areas",NA,"","Rwanda",NA,NA,NA,NA,NA,NA,NA,NA,"Mandatory (Unspecified/Implied)","Other (Please specify in the text box)",NA,NA,NA,NA,"https://www.newtimes.co.rw/news/commercial-flights-resume-august",2020-07-21,2020-07-21 13:41:49
"44","R_2PiA8IjsVZFM6YcNA","7521855","new_entry","original",NA,NA,"City of Kigali imposes hefty fines for violation of Covid-19 guidelines",2020-09-03,2020-09-03,NA,"Rwanda","RWA","RW","National",0,NA,NA,"Hygiene",NA,NA,"","Rwanda",NA,NA,NA,NA,NA,NA,NA,NA,"Mandatory with Legal Penalties (Jail Time),Mandatory with Fines","National Government,Provincial/State Government,Police",NA,NA,NA,NA,"https://www.newtimes.co.rw/news/city-kigali-imposes-hefty-fines-violation-covid-19-guidelines",2020-09-08,2020-09-08 03:35:07
"45","R_3fAWvqNUweapJOdNA","8720905","new_entry","original",NA,NA,"The Prime Minister of Rwanda announces restrictions of travel across the different provinces of Rwanda on 20 March",2020-03-20,2020-03-21,NA,"Rwanda","RWA","RW","National",1,NA,NA,"Internal Border Restrictions",NA,NA,"","Rwanda","One or more geographical or administrative units within one or more countries",NA,"all the towns",NA,NA,"All Residents (Citizen Residents + Foreign Residents)",NA,NA,"Mandatory with Legal Penalties (Jail Time),Mandatory with Fines","National Government,Police",52.9966594626556,52.0866643700494,51.1839619569313,106,"https://www.newtimes.co.rw/news/covid-19-rwanda-lockdown-essential-services-remain-available",2020-04-06,2020-04-06 23:59:22
"46","R_3QMpcgrD8zYwwBrNA","507565","new_entry","original",NA,NA,"The Government of Rwanda has set up a new facility in Rusumo near the Rwanda-Tanzania border to handle all customs clearing processes as part of the move to contain the rising cases of the new coronavirus.",2020-04-24,2020-04-27,NA,"Rwanda","RWA","RW","National",1,NA,NA,"Internal Border Restrictions",NA,NA,"","Rwanda","All countries",NA,NA,NA,NA,"All Residents (Citizen Residents + Foreign Residents)",NA,NA,"Mandatory (Unspecified/Implied)","National Government,Ministry/Department of Health,Police",55.8660779651582,54.3129231497756,52.9508002125156,160,"https://www.ktpress.rw/2020/04/covid-19-rwanda-takes-new-measures-on-cross-border-trucks/",2020-05-01,2020-05-01 14:59:08
"47","R_3qe4eVWSo3DspaTNA","2042518","new_entry","original",NA,NA,"Private transport resumes in Rwanda on 04-05-2020 but restricted within the same city.",2020-04-30,2020-05-04,NA,"Rwanda","RWA","RW","National",1,NA,NA,"Internal Border Restrictions",NA,NA,"","Rwanda","All countries",NA,NA,NA,NA,"All Residents (Citizen Residents + Foreign Residents)",NA,NA,"Mandatory (Unspecified/Implied)","National Government,Police",NA,NA,NA,NA,"https://www.newtimes.co.rw/covid-19/rwanda-eases-covid-19-lockdown-here-are-10-guidelines-follow",2020-05-01,2020-05-01 14:20:32
"48","R_2aQvOpIU90Yh1rBNA","7017885","new_entry","original",NA,NA,"Rwandan Govt okays inter-provincial travel, taxi-moto operations except into and out of Rusizi and Rubavu districts as from 03-06-2020",2020-06-02,2020-06-03,2020-06-18,"Rwanda","RWA","RW","National",1,NA,NA,"Internal Border Restrictions",NA,NA,"","Rwanda","One or more geographical or administrative units within one or more countries",NA,NA,NA,NA,"All Residents (Citizen Residents + Foreign Residents)",NA,NA,"Mandatory (Unspecified/Implied)","National Government,Police",NA,NA,NA,NA,"https://www.newtimes.co.rw/news/govt-okays-inter-provincial-travel-taxi-moto-operations",2020-06-03,2020-06-03 05:32:25
"49","R_3DeB1NdOTYMdHHjNA","7454082","new_entry","original",NA,NA,"Public Transport Between Kigali And Other Districts Prohibited as from 27 August 2020",2020-08-27,2020-08-27,NA,"Rwanda","RWA","RW","National",1,NA,NA,"Internal Border Restrictions",NA,NA,"","Rwanda",NA,NA,NA,NA,NA,"All Residents (Citizen Residents + Foreign Residents)",NA,NA,"Mandatory (Unspecified/Implied)","National Government,Provincial/State Government,Police",NA,NA,NA,NA,"https://www.ktpress.rw/2020/08/public-transport-between-kigali-and-other-districts-prohibited-curfew-from-7pm/",2020-09-08,2020-09-08 03:44:40
"50","R_29c3kG9vB0qlRTMNA","7760322","new_entry","correction",NA,NA,"Rwanda imposes first Africa's first lockdown in response to Corona virus spread.",2020-03-22,2020-03-22,NA,"Rwanda","RWA","RW","National",0,NA,NA,"Lockdown",NA,NA,"","Rwanda","All countries",NA,NA,NA,NA,"All Residents (Citizen Residents + Foreign Residents)",NA,NA,"Mandatory with Legal Penalties (Jail Time)","National Government",53.1296414318448,52.2385582304022,51.4168732444489,108,"https://www.outlookindia.com/newsscroll/rwanda-imposes-shutdown-suspends-unnecessary-movements-govt/1775819",2020-07-13,2020-07-13 13:37:58
"51","R_BJ6AzybGh8RYe2dNA","4233361","new_entry","original",NA,NA,"Rwanda sets up a response team to asses the preparedness of the country to the Corona Virus Pandemic after its outbreak in Wuhan",2020-01-31,2020-01-31,NA,"Rwanda","RWA","RW","National",1,NA,NA,"New Task Force, Bureau or Administrative Configuration",NA,NA,"","Rwanda",NA,NA,NA,NA,NA,"All Residents (Citizen Residents + Foreign Residents)",NA,NA,"Mandatory (Unspecified/Implied)","National Government",51.653709595882,48.6609911664766,44.7836924390178,168,"http://www.anews.com.tr/world/2020/03/22/rwanda-steps-up-efforts-to-beat-coronavirus",2020-04-06,2020-04-06 22:42:37
"52","R_C3pA8KTlCkluzFnNA","6297912","new_entry","original",NA,NA,"Govt introduces online clearance pass for people seeking essential services",2020-04-26,2020-04-26,NA,"Rwanda","RWA","RW","National",1,NA,NA,"New Task Force, Bureau or Administrative Configuration",NA,NA,"","Rwanda",NA,NA,NA,NA,NA,"All Residents (Citizen Residents + Foreign Residents)",NA,NA,"Mandatory with Fines","National Government",55.8471451658603,54.357947129302,53.0850205380506,162,"https://www.newtimes.co.rw/news/govt-introduces-online-clearance-pass-people-seeking-essential-services",2020-05-03,2020-05-03 18:15:28
"53","R_3NJtUA1Rpi8elMuNA","7546088","new_entry","original",NA,NA,"The Rwandan government on Saturday, March 28, kick started a support initiative aimed at vulnerable families adversely affected by the ongoing COVID-19 lockdown.",2020-03-27,2020-03-28,NA,"Rwanda","RWA","RW","National",0,NA,NA,"Other Policy Not Listed Above",NA,"The Rwandan government on Saturday, March 28, kick started a support initiative aimed at vulnerable families adversely affected by the ongoing COVID-19 lockdown","",NA,NA,NA,NA,NA,NA,NA,NA,NA,"Mandatory with Exceptions (Please list exceptions in the text entry)","National Government",53.5148643547767,52.3828035042253,51.4276053511021,91,"https://www.africanews.com/2020/03/29/coronavirus-hub-impact-of-outbreak-across-africa/",2020-03-30,2020-03-30 12:24:16
"54","R_2mHHUCxVdjGMf73NA","1986173","new_entry","original",NA,NA,"Public Officials in Rwanda forfeit their April salaries to support Rwandans in lock down in a show of Solidarity",2020-04-06,2020-04-06,NA,"Rwanda","RWA","RW","National",0,NA,NA,"Other Policy Not Listed Above",NA,"This is a move that will raise money that will go a long way to  support the government's food distribution policy to Rwandans under lockdown.It is a show of solidarity by the officials to their fellow rwandan citizens","",NA,NA,NA,NA,NA,NA,NA,NA,NA,"Mandatory (Unspecified/Implied)","National Government",53.6980575499377,52.6331570680127,51.599199952651,85,"http://www.china.org.cn/world/Off_the_Wire/2020-04/07/content_75902552.htm",2020-04-07,2020-04-07 12:09:34
"55","R_3j9DvBw3PBnI5xyNA","843024","new_entry","original",NA,NA,"Rwanda Education Board  identifies more than 100 radio scripts from around the world focusing on basic literacy and numeracy that could be adapted to align with Rwanda’s school curriculum to ensure continued learning as schools remain closed till September.",2020-04-29,2020-04-29,NA,"Rwanda","RWA","RW","National",0,NA,NA,"Other Policy Not Listed Above",NA,"The scripts for children class lessons are broadcast on FM stations including Rwanda Broadcasting Agency, KT Radio, Radio Maria Rwanda, and Radio Inkoramutima to reach many children around the country.","","Rwanda",NA,NA,NA,NA,NA,NA,NA,NA,"Voluntary/Recommended but No Penalties","National Government,Other (Please specify in the text box)",56.2481357839505,54.3406485313411,52.716101831184,164,"https://www.ktpress.rw/2020/04/the-online-platforms-keeping-your-child-focused-on-class-work/",2020-05-01,2020-05-01 15:06:45
"56","R_VVDu4AFx5tHQD2FNA","2252913","new_entry","original",NA,NA,"Construction projects and manufacturing has been given the go-ahead to resume works in Rwanda",2020-04-30,2020-04-30,NA,"Rwanda","RWA","RW","National",0,NA,NA,"Other Policy Not Listed Above",NA,"Construction projects and manufacturing has been given the go-ahead to resume works. However, with only essential staff and ensuring the protection of workers","","All countries","All countries",NA,NA,NA,NA,"All (Travelers + Residents)","Inbound/Outbound","Not Applicable","Voluntary/Recommended but No Penalties","National Government,Police",NA,NA,NA,NA,"https://www.newtimes.co.rw/covid-19/rwanda-eases-covid-19-lockdown-here-are-10-guidelines-follow",2020-05-01,2020-05-01 14:50:25
"57","R_2cnEFIaqMewew9kNA","9477277","new_entry","original",NA,NA,"In Rwanda as from 04 May 2020, Individual sporting activities allowed, gyms to remain closed",2020-04-30,2020-05-04,NA,"Rwanda","RWA","RW","National",0,NA,NA,"Other Policy Not Listed Above",NA,"Fitness enthusiasts will from Monday, May 4, have the liberty to carry out individual sporting activities in open spaces between  5 a.m., and 8 p.m. However, gyms and other recreation/sporting facilities will remain closed.","","Rwanda",NA,NA,NA,NA,NA,NA,NA,NA,"Mandatory (Unspecified/Implied)","National Government,Police",NA,NA,NA,NA,"https://www.newtimes.co.rw/covid-19/rwanda-eases-covid-19-lockdown-here-are-10-guidelines-follow",2020-05-01,2020-05-01 14:38:30
"58","R_3g7QWXwmrGrdajsNA","3580078","new_entry","original",NA,NA,"A team of Rwandan developers backed by investors from the UK and US have developed an electronic learning platform,Homeskul ,that seeks to connect teachers and students",2020-06-02,2020-06-02,NA,"Rwanda","RWA","RW","National",0,NA,NA,"Other Policy Not Listed Above",NA,"Homeskul is an e-learning portal that connects experienced teachers to parents who are busy to homeschool their children.The platform was developed to respond to the learning needs of students and teachers who have been left with nowhere to go with schools now closed in Rwanda","","Rwanda",NA,NA,NA,NA,NA,NA,NA,NA,"Voluntary/Recommended but No Penalties","National Government",NA,NA,NA,NA,"https://www.newtimes.co.rw/news/new-platform-help-boost-e-learning",2020-06-03,2020-06-03 07:09:30
"59","R_rcZpguUuJgsTKXDNA","2650782","new_entry","original",NA,NA,"Public transport between Kigali and other regions resume as from 26/09/2020",2020-09-26,2020-09-26,NA,"Rwanda","RWA","RW","Provincial",0,"Kigali",NA,"Other Policy Not Listed Above",NA,"The Pblic transport between Kigali and Other regions which had been suspended in March has resumed with conditions to the","","Rwanda",NA,NA,"Kigali",NA,NA,NA,NA,NA,"Voluntary/Recommended but No Penalties","National Government,Provincial/State Government",NA,NA,NA,NA,"https://allafrica.com/stories/202009260011.html",2020-09-30,2020-09-30 18:09:12
"60","R_2upR7APR8i4ejZSNA","3821469","new_entry","original",NA,NA,"President Kagame encourages citizens not to fear,observe regulations and follow prescriptions by the Ministry of Health after confirmation of first case of Corona Virus on March 14",2020-03-14,2020-03-14,NA,"Rwanda","RWA","RW","National",0,NA,NA,"Public Awareness Measures",NA,NA,"",NA,NA,NA,NA,NA,NA,NA,NA,NA,"Voluntary/Recommended but No Penalties","National Government,Ministry/Department of Health",52.6882601019945,51.4882491062127,50.4158568158062,127,"https://www.newtimes.co.rw/news/kagame-first-coronavirus-case",2020-04-07,2020-04-07 00:18:23
"61","R_1dEsPwGFotG1i5VNA","2628091","new_entry","original",NA,NA,"The President of the Rwanda joins the washing hands challenge",2020-03-15,2020-03-15,NA,"Rwanda","RWA","RW","National",0,NA,NA,"Public Awareness Measures",NA,NA,"",NA,NA,NA,NA,NA,NA,NA,NA,NA,"Voluntary/Recommended but No Penalties","National Government,Ministry/Department of Health,Police",52.6894111222646,51.5532361673483,50.4651485710364,117,"https://www.francetvinfo.fr/monde/afrique/societe-africaine/coronavirus-au-rwanda-operation-mains-propres-pour-le-president-kagame_3871405.html",2020-04-06,2020-04-06 22:03:35
"62","R_2rSJsxVjN1AlQnONA","7394874","new_entry","original",NA,NA,"Coronavirus: Rwandan radio stars spread hygiene message",2020-04-16,2020-04-16,NA,"Rwanda","RWA","RW","National",0,NA,NA,"Public Awareness Measures",NA,NA,"",NA,NA,NA,NA,NA,NA,NA,NA,NA,"Voluntary/Recommended but No Penalties","Other (Please specify in the text box)",54.0956460836723,53.0856355395238,51.9479426405124,98,"https://www.bbc.com/news/in-pictures-52292618?intlink_from_url=https://www.bbc.com/news/topics/cwlw3xz0zdet/rwanda&link_location=live-reporting-story",2020-04-22,2020-04-22 18:58:54
"63","R_WvPzTigUryvYa2ZNA","1598257","new_entry","original",NA,NA,"Medical Students Association of Rwanda organises Awareness week to sensitize rwandans on the Corona Virus",2020-03-20,2020-04-20,2020-04-24,"Rwanda","RWA","RW","National",0,NA,NA,"Public Awareness Measures",NA,NA,"",NA,NA,NA,NA,NA,NA,NA,NA,NA,"Voluntary/Recommended but No Penalties","Other (Please specify in the text box)",54.2976791557793,53.2608342514357,52.4560062484562,108,"https://www.newtimes.co.rw/news/medical-students-conclude-sensitization-drive-against-coronavirus",2020-04-06,2020-04-06 23:38:57
"64","R_3M9IO4UY0PqZAk3NA","3358757","new_entry","original",NA,NA,"Rwanda announces that wearing of masks is a must in all public places",2020-04-19,2020-04-20,NA,"Rwanda","RWA","RW","National",0,NA,NA,"Public Awareness Measures",NA,NA,"",NA,NA,NA,NA,NA,NA,NA,NA,NA,"Mandatory with Fines","National Government,Police",54.2976791557793,53.2608342514357,52.4560062484562,108,"http://www.rfi.fr/fr/afrique/20200420-rwanda-coronavirus-port-masque-obligatoire",2020-04-22,2020-04-22 18:29:48
"65","R_32Wvwk1G1fFACjwAr","1097542","new_entry","original",NA,NA,"Rwandan government urges traders to accept digital payment as alternative form of payment in a bid to reduce infections",2020-06-02,2020-06-03,NA,"Rwanda","RWA","RW","National",0,NA,NA,"Public Awareness Measures","Disseminating information related to COVID-19 to the public that is reliable and factually accurate",NA,"",NA,NA,NA,NA,NA,NA,NA,NA,NA,"Voluntary/Recommended but No Penalties","National Government",NA,NA,NA,NA,"https://www.newtimes.co.rw/news/govt-okays-inter-provincial-travel-taxi-moto-operations",2020-06-03,2020-06-03 05:41:12
"66","R_30nJGwMIOfmSbbOAz","5332777","new_entry","original",NA,NA,"Rwandans coming back to the country put under mandatory 14 Day quarantine.",NA,2020-03-19,NA,"Rwanda","RWA","RW","National",0,NA,NA,"Quarantine","Government Quarantine (i.e. quarantine at a government hotel or facility)",NA,"","All countries","All countries",NA,NA,NA,NA,"All Travelers (Citizen Travelers + Foreign Travelers )","Inbound","All kinds of transport","Mandatory with Fines","National Government,Military,Police",52.7140638800728,51.8541521631917,50.9894305633785,105,"https://www.theeastafrican.co.ke/news/ea/Rwanda-begins-14-day-complete-lockdown/4552908-5506784-lqvynk/index.html",2020-03-30,2020-03-30 12:49:22
"67","R_30nJGwMIOfmSbbODf","5332777","new_entry","original",NA,NA,"Rwandans coming back to the country put under mandatory 14 Day quarantine.",NA,2020-03-19,NA,"Rwanda","RWA","RW","National",0,NA,NA,"Quarantine","Quarantine outside the home or government facility (i.e. quarantine in a hotel)",NA,"","All countries","All countries",NA,NA,NA,NA,"All Travelers (Citizen Travelers + Foreign Travelers )","Inbound","All kinds of transport","Mandatory with Fines","National Government,Military,Police",52.7140638800728,51.8541521631917,50.9894305633785,105,"https://www.theeastafrican.co.ke/news/ea/Rwanda-begins-14-day-complete-lockdown/4552908-5506784-lqvynk/index.html",2020-03-30,2020-03-30 12:49:22
"68","R_sdsOlIGo8hP9KVzDs","1329037","new_entry","original",NA,NA,"Borders remain closed except for Cargo,returning residents and legal residents but must undergo quarantine at a place of own choosing and own cost",2020-08-27,2020-08-27,NA,"Rwanda","RWA","RW","National",0,NA,NA,"Quarantine","Self-Quarantine (i.e. quarantine at home)",NA,"","Rwanda",NA,NA,NA,NA,NA,NA,NA,NA,"Mandatory (Unspecified/Implied)","National Government,Military,Police",NA,NA,NA,NA,"https://www.ktpress.rw/2020/08/public-transport-between-kigali-and-other-districts-prohibited-curfew-from-7pm/",2020-09-08,2020-09-08 04:00:36
"69","R_sdsOlIGo8hP9KVzAz","1329037","new_entry","original",NA,NA,"Borders remain closed except for Cargo,returning residents and legal residents but must undergo quarantine at a place of own choosing and own cost",2020-08-27,2020-08-27,NA,"Rwanda","RWA","RW","National",0,NA,NA,"Quarantine","Government Quarantine (i.e. quarantine at a government hotel or facility)",NA,"","Rwanda",NA,NA,NA,NA,NA,NA,NA,NA,"Mandatory (Unspecified/Implied)","National Government,Military,Police",NA,NA,NA,NA,"https://www.ktpress.rw/2020/08/public-transport-between-kigali-and-other-districts-prohibited-curfew-from-7pm/",2020-09-08,2020-09-08 04:00:36
"70","R_sdsOlIGo8hP9KVzDf","1329037","new_entry","original",NA,NA,"Borders remain closed except for Cargo,returning residents and legal residents but must undergo quarantine at a place of own choosing and own cost",2020-08-27,2020-08-27,NA,"Rwanda","RWA","RW","National",0,NA,NA,"Quarantine","Quarantine outside the home or government facility (i.e. quarantine in a hotel)",NA,"","Rwanda",NA,NA,NA,NA,NA,NA,NA,NA,"Mandatory (Unspecified/Implied)","National Government,Military,Police",NA,NA,NA,NA,"https://www.ktpress.rw/2020/08/public-transport-between-kigali-and-other-districts-prohibited-curfew-from-7pm/",2020-09-08,2020-09-08 04:00:36
"71","R_2e27TYCvlBCbjIYDq","2991482","new_entry","original",NA,NA,"Rwanda bans non essential activities in a move to curb the epread of Coroan virus",2020-03-20,2020-04-21,NA,"Rwanda","RWA","RW","National",1,NA,NA,"Restriction and Regulation of Businesses","Retail Businesses",NA,"This type of business  (""Retail Businesses"") is closed/locked down","Rwanda",NA,NA,NA,NA,NA,"All Residents (Citizen Residents + Foreign Residents)",NA,NA,"Mandatory with Legal Penalties (Jail Time),Mandatory with Fines","National Government,Police",54.5440898575327,53.6864462771673,52.8803716146647,129,"https://www.newtimes.co.rw/news/how-kigali-has-responded-coronavirus-lockdown",2020-04-06,2020-04-06 23:48:20
"72","R_2e27TYCvlBCbjIYBy","2991482","new_entry","original",NA,NA,"Rwanda bans non essential activities in a move to curb the epread of Coroan virus",2020-03-20,2020-04-21,NA,"Rwanda","RWA","RW","National",1,NA,NA,"Restriction and Regulation of Businesses","Non-Essential Commercial Businesses",NA,"This type of business  (""Non-Essential Commercial Businesses"") is closed/locked down","Rwanda",NA,NA,NA,NA,NA,"All Residents (Citizen Residents + Foreign Residents)",NA,NA,"Mandatory with Legal Penalties (Jail Time),Mandatory with Fines","National Government,Police",54.5440898575327,53.6864462771673,52.8803716146647,129,"https://www.newtimes.co.rw/news/how-kigali-has-responded-coronavirus-lockdown",2020-04-06,2020-04-06 23:48:20
"73","R_2e27TYCvlBCbjIYCq","2991482","new_entry","original",NA,NA,"Rwanda bans non essential activities in a move to curb the epread of Coroan virus",2020-03-20,2020-04-21,NA,"Rwanda","RWA","RW","National",1,NA,NA,"Restriction and Regulation of Businesses","Personal Grooming Businesses (e.g. hair salons)",NA,"This type of business  (""Personal Grooming Businesses (e.g. hair salons)"") is closed/locked down","Rwanda",NA,NA,NA,NA,NA,"All Residents (Citizen Residents + Foreign Residents)",NA,NA,"Mandatory with Legal Penalties (Jail Time),Mandatory with Fines","National Government,Police",54.5440898575327,53.6864462771673,52.8803716146647,129,"https://www.newtimes.co.rw/news/how-kigali-has-responded-coronavirus-lockdown",2020-04-06,2020-04-06 23:48:20
"74","R_PvyfsSFfFbzxDCpCl","2634416","new_entry","original",NA,NA,"The government has said customs clearance, which was previously conducted in Kigali, has been extended to border points as part of the efforts to stop the spread of coronavirus and continue facilitating regional trade.",2020-04-23,2020-04-23,NA,"Rwanda","RWA","RW","National",1,NA,NA,"Restriction and Regulation of Businesses","Other Non-Essential Businesses",NA,"This type of business  (""Other Non-Essential Businesses"") is closed/locked down","Rwanda",NA,NA,NA,NA,NA,"All Residents (Citizen Residents + Foreign Residents)",NA,NA,"Mandatory (Unspecified/Implied)","National Government,Police",55.1099958215744,54.0570190723102,53.2093761486504,153,"https://www.newtimes.co.rw/news/customs-clearance-taken-border-posts-control-cargo-truck-drivers",2020-04-26,2020-04-26 18:23:00
"75","R_Ua5UHLRgD8fKaoVDk","9996031","new_entry","original",NA,NA,"Rwanda opens restaurants but they must be closed by 7pm but bars remain closed till further notice",2020-04-30,2020-05-04,NA,"Rwanda","RWA","RW","National",1,NA,NA,"Restriction and Regulation of Businesses","Restaurants",NA,"","Rwanda",NA,NA,NA,NA,NA,"All Residents (Citizen Residents + Foreign Residents)",NA,NA,"Mandatory with Legal Penalties (Jail Time),Mandatory with Fines","National Government,Police",NA,NA,NA,NA,"https://www.newtimes.co.rw/covid-19/rwanda-eases-covid-19-lockdown-here-are-10-guidelines-follow",2020-05-01,2020-05-01 14:05:28
"76","R_1lbomx9CYu11hXQAi","3396146","new_entry","original",NA,NA,"Up until June 3,Bars in Rwanda will remain closed",2020-06-02,2020-06-03,NA,"Rwanda","RWA","RW","National",1,NA,NA,"Restriction and Regulation of Businesses","Bars",NA,"This type of business  (""Bars"") is closed/locked down","Rwanda",NA,NA,NA,NA,NA,"All Residents (Citizen Residents + Foreign Residents)",NA,NA,"Mandatory with Fines","Police",NA,NA,NA,NA,"https://www.newtimes.co.rw/news/govt-okays-inter-provincial-travel-taxi-moto-operations",2020-06-03,2020-06-03 06:06:43
"77","R_1irCsChgNVXXS2FAd","4349980","new_entry","original",NA,NA,"Two Rwandan city markets closed over an increase of COVID-19 cases on 17 August,2020",2020-08-17,2020-08-27,NA,"Rwanda","RWA","RW","National",1,NA,NA,"Restriction and Regulation of Businesses","All or unspecified essential businesses",NA,"This type of business  (""All or unspecified essential businesses"") is closed/locked down","Rwanda",NA,NA,NA,NA,NA,"All Residents (Citizen Residents + Foreign Residents)",NA,NA,"Mandatory (Unspecified/Implied)","National Government,Provincial/State Government,Police",NA,NA,NA,NA,"https://africa.cgtn.com/2020/08/17/two-rwandan-city-markets-closed-over-an-increase-of-covid-19-cases/",2020-09-08,2020-09-08 04:10:40
"78","R_1nZOdyYkykUIhikNA","1443658","new_entry","original",NA,NA,"Rwanda turns to trial by video in the courts,a move announced on 09 April 2020 hence a show of continuance of essential government services",2020-04-09,2020-04-09,NA,"Rwanda","RWA","RW","National",1,NA,NA,"Restriction and Regulation of Government Services",NA,NA,"This service is no longer provided by the government","Rwanda",NA,NA,NA,NA,NA,"All Residents (Citizen Residents + Foreign Residents)",NA,NA,"Mandatory (Unspecified/Implied)","National Government,Police",53.644240305527,52.7694158895141,51.9399470409205,90,"https://www.bbc.com/news/topics/cwlw3xz0zdet/rwanda",2020-04-15,2020-04-15 01:40:16
"79","R_Uiixl94BFYXF37bBn","1309196","new_entry","original",NA,NA,"Civil marriages to continue in Rwanda per government's announcements of 02-06-2020",2020-06-02,2020-06-02,NA,"Rwanda","RWA","RW","National",1,NA,NA,"Restriction and Regulation of Government Services","Issuing of permits/certificates and/or processing of government documents",NA,"This service provided by the government is provided with no conditions attached","Rwanda",NA,NA,NA,NA,NA,"All Residents (Citizen Residents + Foreign Residents)",NA,NA,"Voluntary/Recommended but No Penalties","National Government",NA,NA,NA,NA,"https://www.newtimes.co.rw/news/govt-okays-inter-provincial-travel-taxi-moto-operations",2020-06-03,2020-06-03 06:44:58
"80","R_1OZwQoshArEImOoNA","6292154","new_entry","original",NA,NA,"Number of Bus passengers cut by half to reduce over crowding hence reduction of contracting the Corona Virus",2020-03-16,2020-03-16,NA,"Rwanda","RWA","RW","National",1,NA,NA,"Restrictions of Mass Gatherings",NA,NA,"","Rwanda",NA,NA,NA,NA,NA,"All Residents (Citizen Residents + Foreign Residents)",NA,NA,"Mandatory with Legal Penalties (Jail Time),Mandatory with Fines","National Government,Police",52.5340733058206,51.6620926343804,50.7057534324305,111,"https://www.newtimes.co.rw/news/coronavirus-students-return-home-bus-passenger-numbers-cut-half",2020-04-07,2020-04-07 00:10:10
