record_id,policy_id,entry_type,correct_type,update_type,update_level,description,date_announced,date_start,date_end,country,ISO_A3,ISO_A2,init_country_level,domestic_policy,province,ISO_L2,city,type,type_sub_cat,type_text,institution_status,target_country,target_geog_level,target_region,target_province,target_city,target_other,target_who_what,target_direction,travel_mechanism,compliance,enforcer,index_high_est,index_med_est,index_low_est,index_country_rank,link,date_updated,recorded_date,confirmed_cases,deaths,recovered,new_tests,total_tests,total_tests_per_thousand,tests_units,total_vaccinations,daily_vaccinations,total_vaccinations_per_hundred,daily_vaccinations_per_million,Rank_FP,Score_FP,state_IDC,muni_IDC,dispersive_IDC,constraining_IDC,inclusive_IDC,sfi_SFI,ti_cpi_TI,pop_WDI_PW,gdp_WDI_PW,gdppc_WDI_PW,growth_WDI_PW,lnpop_WDI_PW,lngdp_WDI_PW,lngdppc_WDI_PW,disap_FA,polpris_FA,latentmean_FA,transparencyindex_HR,EmigrantStock_EMS,v2x_polyarchy_VDEM
R_ANTRXn7aJ33M2VbNA,1759305,new_entry,original,,,"Equatorial Guinea announced on 3 April 2020 measures ""to protect the jobs of nationals and expatriates in the hydrocarbons sector, during the period of confinement due to COVID-19.""",2020-04-03,2020-04-03,,Equatorial Guinea,GNQ,GQ,National,1,,,,Health Resources,,,,Equatorial Guinea,"One or more countries, but not all countries",,,,,All Residents (Citizen Residents + Foreign Residents),,Not Applicable,Mandatory (Unspecified/Implied),"National Government,Ministry/Department of Health,Other (Please specify in the text box)",55.3682158307425,52.4690038777011,49.4912492635929,83,https://www.guineaecuatorialpress.com/noticia.php?id=15224,2020-04-18,2020-04-18T14:36:31Z,16,0,1,,,,,,,,,171,6647,0,0,-0.82478433,0.563846171,-0.20141026,12,19,845060,16422276374,19433.2667,-8.28496885,13.6471629,23.5219045,9.87474165,1,0,0.01833944,,119125,0.22333172
R_2laWbsbkoCQeAExNA,4296480,new_entry,original,,,"Equatorial Guinea enforces restrictions ""to movement by citizens and residents within national territory, except for justified reasons"" as of 15 March 2020.",2020-03-13,2020-03-15,2020-04-15,Equatorial Guinea,GNQ,GQ,National,1,,,,Internal Border Restrictions,,,,Equatorial Guinea,"One or more countries, but not all countries",,,,,All Residents (Citizen Residents + Foreign Residents),,,Mandatory (Unspecified/Implied),"National Government,Ministry/Department of Health,Other (Please specify in the text box)",53.0741973521892,52.1312960851704,51.1508336603194,140,https://www.guineaecuatorialpress.com/noticia.php?id=15098&lang=en,2020-04-07,2020-04-07T21:57:38Z,1,0,0,,,,,,,,,171,6647,0,0,-0.82478433,0.563846171,-0.20141026,12,19,845060,16422276374,19433.2667,-8.28496885,13.6471629,23.5219045,9.87474165,1,0,0.01833944,,119125,0.22333172
R_xDCYoB43HPkZv33NA,4296480,update,original,,Strengthening,"Equatorial Guinea enforces, as of 31 March 2020, ""the suspension, until 15th April, of the circulation of vehicles and persons between districts. In other words, all districts in the Continental Region are being placed in quarantine, prohibiting the circulation or flow of persons or vehicles from one district to another."" UPDATE: The original limitations to movement within the country have been extended: ""The suspension, until 15th April, of the circulation of vehicles and persons between districts. In other words, all districts in the Continental Region are being placed in quarantine, prohibiting the circulation or flow of persons or vehicles from one district to another.""",2020-03-31,2020-03-31,2020-04-15,Equatorial Guinea,GNQ,GQ,National,1,,,,Internal Border Restrictions,,,,Equatorial Guinea,"One or more countries, but not all countries",,,,,All Residents (Citizen Residents + Foreign Residents),,,Mandatory (Unspecified/Implied),"National Government,Ministry/Department of Health,Other (Please specify in the text box)",54.3903642684818,52.4285001092332,49.2602816502744,85,https://www.guineaecuatorialpress.com/noticia.php?id=15208,2020-04-18,2020-04-18T14:13:48Z,12,0,1,,,,,,,,,171,6647,0,0,-0.82478433,0.563846171,-0.20141026,12,19,845060,16422276374,19433.2667,-8.28496885,13.6471629,23.5219045,9.87474165,1,0,0.01833944,,119125,0.22333172
R_2wLeD2IsrThPZ3VNA,7447773,new_entry,original,,,"Equatorial Guinea has implemented internal movement restriction except for justified cases. No specific information of such ""justified cases""",2020-04-03,2020-04-03,2020-04-15,Equatorial Guinea,GNQ,GQ,Provincial,1,,,,Internal Border Restrictions,,,,,All countries,,,,,All Residents (Citizen Residents + Foreign Residents),,,Mandatory with Exceptions (Please list exceptions in the text entry),"National Government,Military,Provincial/State Government,Municipal Government,Police",55.3682158307425,52.4690038777011,49.4912492635929,83,https://www.worldaware.com/covid-19-alert-african-countries-continue-enforcing-travel-restrictions-health-screenings-april-10 ; https://pandemic.internationalsos.com/2019-ncov/ncov-travel-restrictions-flight-operations-and-screening#MYS,2020-04-11,2020-04-11T11:03:11Z,16,0,1,,,,,,,,,171,6647,0,0,-0.82478433,0.563846171,-0.20141026,12,19,845060,16422276374,19433.2667,-8.28496885,13.6471629,23.5219045,9.87474165,1,0,0.01833944,,119125,0.22333172
R_2pJhkGIWYRI8JAJCl,2482838,new_entry,original,,,"Equatorial Guinea creates a ""Response and Vigilance Technical Committee for the New Coronavirus""",2020-04-03,2020-03-31,2020-04-30,Equatorial Guinea,GNQ,GQ,National,1,,,,"New Task Force, Bureau or Administrative Configuration",New Task Force or Bureau (i.e. establishment of a temporary body),,,Equatorial Guinea,,,,,,All Residents (Citizen Residents + Foreign Residents),,,Mandatory (Unspecified/Implied),National Government,54.3903642684818,52.4285001092332,49.2602816502744,85,https://www.guineaecuatorialpress.com/noticia.php?id=15226&lang=en,2020-05-03,2020-05-03T18:52:24Z,12,0,1,,,,,,,,,171,6647,0,0,-0.82478433,0.563846171,-0.20141026,12,19,845060,16422276374,19433.2667,-8.28496885,13.6471629,23.5219045,9.87474165,1,0,0.01833944,,119125,0.22333172
R_bOsOmF5OJOsBnDbNA,1057745,new_entry,original,,,"Equatorial Guinea has ruled that ""the use of masks will be obligatory at all times"" as of 15 March 2020.",2020-03-13,2020-03-15,2020-04-13,Equatorial Guinea,GNQ,GQ,National,1,,,,Other Policy Not Listed Above,,The policy makes it mandatory to wear a mask.,,Equatorial Guinea,,,,,,All Residents (Citizen Residents + Foreign Residents),,,Mandatory (Unspecified/Implied),"National Government,Ministry/Department of Health,Other (Please specify in the text box)",53.0741973521892,52.1312960851704,51.1508336603194,140,https://www.guineaecuatorialpress.com/noticia.php?id=15098&lang=en,2020-04-08,2020-04-08T22:36:03Z,1,0,0,,,,,,,,,171,6647,0,0,-0.82478433,0.563846171,-0.20141026,12,19,845060,16422276374,19433.2667,-8.28496885,13.6471629,23.5219045,9.87474165,1,0,0.01833944,,119125,0.22333172
R_3NDmIbrtDSeOofaDd,5670944,new_entry,original,,,"Equatorial Guinea obliged, as of 15 March 2020, ""all travellers from affected countries, both nationals and expatriates, presenting symptoms on arrival, must remain in quarantine for a period of fourteen days. Likewise those travellers not presenting symptoms of any nature must, in any event, remain in quarantine for the same period of time; and thus they may not leave the indicated place, except with [an] authorisation.""",2020-03-13,2020-03-15,2020-04-13,Equatorial Guinea,GNQ,GQ,National,0,,,,Quarantine,Other Quarantine,,,All countries,All countries,,,,,All Travelers (Citizen Travelers + Foreign Travelers ),Inbound,All kinds of transport,Mandatory (Unspecified/Implied),"National Government,Ministry/Department of Health,Other (Please specify in the text box)",53.0741973521892,52.1312960851704,51.1508336603194,140,https://www.guineaecuatorialpress.com/noticia.php?id=15098&lang=en,2020-04-07,2020-04-07T22:32:48Z,1,0,0,,,,,,,,,171,6647,0,0,-0.82478433,0.563846171,-0.20141026,12,19,845060,16422276374,19433.2667,-8.28496885,13.6471629,23.5219045,9.87474165,1,0,0.01833944,,119125,0.22333172
R_3fqp9eAYlQyr8ytNA,8836496,new_entry,original,,,"Equatorial Guinea rules the ""temporary suspension of all religious celebrations. ""The advice is to avoid gatherings of more than ten people at the same place.
Public transport via bus is prohibited.
Excluded from this concentration are restaurants and bars, provided they intensify cleaning and hygiene measures, and constantly disinfect floors, furniture and utensils. However, they may not hold or celebrate parties or large gatherings.
All parties, birthdays, baptisms, communions, marriages, consuetudinary matrimony, large traditional gatherings, wakes and funerals with a large gathering of people are prohibited, together with activities in leisure and games rooms, both day and night, fairs, discotheques, pubs, casinos, parks, public pools, etc.""",2020-03-15,2020-03-15,2020-04-30,Equatorial Guinea,GNQ,GQ,National,1,,,,Restrictions of Mass Gatherings,,,,Equatorial Guinea,,,,,,All Residents (Citizen Residents + Foreign Residents),,,"Mandatory (Unspecified/Implied),Voluntary/Recommended but No Penalties","National Government,Ministry/Department of Health,Other (Please specify in the text box)",53.0741973521892,52.1312960851704,51.1508336603194,140,https://www.guineaecuatorialpress.com/noticia.php?id=15109,2020-04-08,2020-04-08T22:53:33Z,1,0,0,,,,,,,,,171,6647,0,0,-0.82478433,0.563846171,-0.20141026,12,19,845060,16422276374,19433.2667,-8.28496885,13.6471629,23.5219045,9.87474165,1,0,0.01833944,,119125,0.22333172
R_3ndsRpPjGF5OhbkNA,8836496,update,original,,Strengthening,"As of 31 March 2020 in Equatorial Guinea ""it is stressed that all stores selling clothes, various materials, supermarkets, general stores, pharmacies, hair salons, and stores selling electrical goods, electrical goods, household goods and utensils must remain open in a timetable that may not extend beyond 20:00h. [...] Restaurants and dining rooms which provide prepared food services must close at 21:00h."" UPDATE: Equatorial Guine clarifies the regime of closure of shops.",2020-03-31,2020-03-31,2020-04-30,Equatorial Guinea,GNQ,GQ,National,1,,,,Restrictions of Mass Gatherings,,,,Equatorial Guinea,,,,,,All Residents (Citizen Residents + Foreign Residents),,,"Mandatory (Unspecified/Implied),Voluntary/Recommended but No Penalties","National Government,Ministry/Department of Health,Other (Please specify in the text box)",54.3903642684818,52.4285001092332,49.2602816502744,85,https://www.guineaecuatorialpress.com/noticia.php?id=15208,2020-04-18,2020-04-18T14:25:30Z,12,0,1,,,,,,,,,171,6647,0,0,-0.82478433,0.563846171,-0.20141026,12,19,845060,16422276374,19433.2667,-8.28496885,13.6471629,23.5219045,9.87474165,1,0,0.01833944,,119125,0.22333172
R_SCqsipvypTsMcUhNA,8836496,update,original,Change of Policy,Strengthening,"As of 31st of March (?) in Equatorial Guinea ""In order to prevent possible contagion and the spread of the virus, there is a temporary suspension of all types of demonstration or gathering of over TEN (10) people in the same place, together with the celebration of parties, traditional weddings, wakes or funerals, burials, gaming rooms, beleles, parks, fairs and other similar events. Excluded from this concentration are restaurants, provided they apply personal distancing and cleaning and hygiene measures, and constantly disinfect floors, furniture and utensils. However, they may not hold or celebrate parties or large gatherings."" UPDATE: Speficiations on the number of people that can gather.",2020-04-03,2020-03-31,2020-04-30,Equatorial Guinea,GNQ,GQ,National,1,,,,Restrictions of Mass Gatherings,,,,Equatorial Guinea,,,,,,All Residents (Citizen Residents + Foreign Residents),,,"Mandatory (Unspecified/Implied),Voluntary/Recommended but No Penalties","National Government,Ministry/Department of Health,Other (Please specify in the text box)",54.3903642684818,52.4285001092332,49.2602816502744,85,https://www.guineaecuatorialpress.com/noticia.php?id=15226&lang=en,2020-05-03,2020-05-03T18:38:34Z,12,0,1,,,,,,,,,171,6647,0,0,-0.82478433,0.563846171,-0.20141026,12,19,845060,16422276374,19433.2667,-8.28496885,13.6471629,23.5219045,9.87474165,1,0,0.01833944,,119125,0.22333172
R_2YleSuWv7VWeld2NA,8836496,update,original,Change of Policy,Strengthening,In Equatorial Guinea as part of the Health State of Alarm all collective transport is prohibited and taxis can only carry one person. UPDATE: Extension of the prohibition of all collective transport and limitation of travellers in taxis to 1.,2020-04-03,2020-03-31,2020-04-30,Equatorial Guinea,GNQ,GQ,National,1,,,,Restrictions of Mass Gatherings,,,,Equatorial Guinea,,,,,,All Residents (Citizen Residents + Foreign Residents),,,"Mandatory (Unspecified/Implied),Voluntary/Recommended but No Penalties","National Government,Ministry/Department of Health,Other (Please specify in the text box)",54.3903642684818,52.4285001092332,49.2602816502744,85,https://www.guineaecuatorialpress.com/noticia.php?id=15226&lang=en,2020-05-03,2020-05-03T18:49:08Z,12,0,1,,,,,,,,,171,6647,0,0,-0.82478433,0.563846171,-0.20141026,12,19,845060,16422276374,19433.2667,-8.28496885,13.6471629,23.5219045,9.87474165,1,0,0.01833944,,119125,0.22333172
R_6RnAok4XN3yEu77NA,8836496,update,correction,,Strengthening,In Equatorial Guinea as part of the Health State of Alarm all collective transport is prohibited and taxis can only carry one person.,2020-04-03,2020-03-31,2020-04-30,Equatorial Guinea,GNQ,GQ,National,1,,,,Restrictions of Mass Gatherings,,,,Equatorial Guinea,,,,,,All Residents (Citizen Residents + Foreign Residents),,,Mandatory (Unspecified/Implied),"National Government,Ministry/Department of Health,Other (Please specify in the text box)",54.3903642684818,52.4285001092332,49.2602816502744,85,https://www.guineaecuatorialpress.com/noticia.php?id=15226&lang=en,2020-07-20,2020-07-20T12:47:24Z,12,0,1,,,,,,,,,171,6647,0,0,-0.82478433,0.563846171,-0.20141026,12,19,845060,16422276374,19433.2667,-8.28496885,13.6471629,23.5219045,9.87474165,1,0,0.01833944,,119125,0.22333172
