"","record_id","policy_id","entry_type","correct_type","update_type","update_level","description","date_announced","date_start","date_end","country","ISO_A3","ISO_A2","init_country_level","domestic_policy","province","city","type","type_sub_cat","type_text","school_status","target_country","target_geog_level","target_region","target_province","target_city","target_other","target_who_what","target_direction","travel_mechanism","compliance","enforcer","index_high_est","index_med_est","index_low_est","index_country_rank","link","date_updated","recorded_date"
"1","R_3Q9mX5IMjuYps09NA",815450,"new_entry","original","NA",NA,"In Tanzania IMA World Health has been able to work quickly with Tanzania's Ministry of Health to set up a call center that will provide essential health information about COVID-19 as well as counter misinformation about the coronavirus on March 30.",2020-03-30,2020-03-30,NA,"Tanzania","TZA","TZ","National",0,NA,NA,"Anti-Disinformation Measures",NA,NA,"",NA,NA,NA,NA,NA,NA,NA,NA,NA,"Mandatory (Unspecified/Implied)","National Government",55.87406052222,52.2255811045403,48.8420903409579,72,"https://reliefweb.int/report/united-republic-tanzania/ima-world-health-launches-coronavirus-health-information-initiative",2020-05-03,"2020-05-03 19:36:54"
"2","R_1CIVY4SqMLDWgSHCv",3536772,"new_entry","original","NA",NA,"Tanzanian Prime Minister Kassim Majaliwa announced the closure of all schools (extending this to universities the following day) on March 17.",2020-03-17,2020-03-17,NA,"Tanzania","TZA","TZ","National",1,NA,NA,"Closure and Regulation of Schools","Preschool or childcare facilities (generally for children ages 5 and below)",NA,"Preschool or childcare facilities closed/locked down","Tanzania",NA,NA,NA,NA,NA,"All Residents (Citizen Residents + Foreign Residents)",NA,NA,"Mandatory (Unspecified/Implied)","National Government",53.0402911105294,52.0840635944004,51.2254403622644,127,"https://www.thenewhumanitarian.org/news/2020/03/24/coronavirus-tanzania-africa",2020-04-02,"2020-04-02 18:19:16"
"3","R_1CIVY4SqMLDWgSHCw",3536772,"new_entry","original","NA",NA,"Tanzanian Prime Minister Kassim Majaliwa announced the closure of all schools (extending this to universities the following day) on March 17.",2020-03-17,2020-03-17,NA,"Tanzania","TZA","TZ","National",1,NA,NA,"Closure and Regulation of Schools","Primary Schools (generally for children ages 10 and below)",NA,"Primary Schools closed/locked down","Tanzania",NA,NA,NA,NA,NA,"All Residents (Citizen Residents + Foreign Residents)",NA,NA,"Mandatory (Unspecified/Implied)","National Government",53.0402911105294,52.0840635944004,51.2254403622644,127,"https://www.thenewhumanitarian.org/news/2020/03/24/coronavirus-tanzania-africa",2020-04-02,"2020-04-02 18:19:16"
"4","R_1CIVY4SqMLDWgSHDr",3536772,"new_entry","original","NA",NA,"Tanzanian Prime Minister Kassim Majaliwa announced the closure of all schools (extending this to universities the following day) on March 17.",2020-03-17,2020-03-17,NA,"Tanzania","TZA","TZ","National",1,NA,NA,"Closure and Regulation of Schools","Secondary Schools (generally for children ages 10 to 18)",NA,"Secondary Schools closed/locked down","Tanzania",NA,NA,NA,NA,NA,"All Residents (Citizen Residents + Foreign Residents)",NA,NA,"Mandatory (Unspecified/Implied)","National Government",53.0402911105294,52.0840635944004,51.2254403622644,127,"https://www.thenewhumanitarian.org/news/2020/03/24/coronavirus-tanzania-africa",2020-04-02,"2020-04-02 18:19:16"
"5","R_1CIVY4SqMLDWgSHBg",3536772,"new_entry","original","NA",NA,"Tanzanian Prime Minister Kassim Majaliwa announced the closure of all schools (extending this to universities the following day) on March 17.",2020-03-17,2020-03-17,NA,"Tanzania","TZA","TZ","National",1,NA,NA,"Closure and Regulation of Schools","Higher education institutions (i.e. degree granting institutions)",NA,"Higher education institutions closed/locked down","Tanzania",NA,NA,NA,NA,NA,"All Residents (Citizen Residents + Foreign Residents)",NA,NA,"Mandatory (Unspecified/Implied)","National Government",53.0402911105294,52.0840635944004,51.2254403622644,127,"https://www.thenewhumanitarian.org/news/2020/03/24/coronavirus-tanzania-africa",2020-04-02,"2020-04-02 18:19:16"
"6","R_29uYiEwrae8j6P0Cv",6605799,"new_entry","original","NA",NA,"As from 16 March 2020 the government of Tanzania shut down schools for 30 days.",2020-03-16,2020-03-17,2020-04-15,"Tanzania","TZA","TZ","National",1,NA,NA,"Closure and Regulation of Schools","Preschool or childcare facilities (generally for children ages 5 and below)",NA,"Preschool or childcare facilities closed/locked down","Tanzania",NA,NA,NA,NA,NA,"All Residents (Citizen Residents + Foreign Residents)",NA,NA,"Mandatory (Unspecified/Implied)","National Government,Ministry/Department of Health",53.0402911105294,52.0840635944004,51.2254403622644,127,"http://www.xinhuanet.com/english/2020-03/17/c_138888678.htm",2020-04-03,"2020-04-03 19:45:23"
"7","R_29uYiEwrae8j6P0Cw",6605799,"new_entry","original","NA",NA,"As from 16 March 2020 the government of Tanzania shut down schools for 30 days.",2020-03-16,2020-03-17,2020-04-15,"Tanzania","TZA","TZ","National",1,NA,NA,"Closure and Regulation of Schools","Primary Schools (generally for children ages 10 and below)",NA,"Primary Schools closed/locked down","Tanzania",NA,NA,NA,NA,NA,"All Residents (Citizen Residents + Foreign Residents)",NA,NA,"Mandatory (Unspecified/Implied)","National Government,Ministry/Department of Health",53.0402911105294,52.0840635944004,51.2254403622644,127,"http://www.xinhuanet.com/english/2020-03/17/c_138888678.htm",2020-04-03,"2020-04-03 19:45:23"
"8","R_29uYiEwrae8j6P0Dr",6605799,"new_entry","original","NA",NA,"As from 16 March 2020 the government of Tanzania shut down schools for 30 days.",2020-03-16,2020-03-17,2020-04-15,"Tanzania","TZA","TZ","National",1,NA,NA,"Closure and Regulation of Schools","Secondary Schools (generally for children ages 10 to 18)",NA,"Secondary Schools closed/locked down","Tanzania",NA,NA,NA,NA,NA,"All Residents (Citizen Residents + Foreign Residents)",NA,NA,"Mandatory (Unspecified/Implied)","National Government,Ministry/Department of Health",53.0402911105294,52.0840635944004,51.2254403622644,127,"http://www.xinhuanet.com/english/2020-03/17/c_138888678.htm",2020-04-03,"2020-04-03 19:45:23"
"9","R_29uYiEwrae8j6P0Bg",6605799,"new_entry","original","NA",NA,"As from 16 March 2020 the government of Tanzania shut down schools for 30 days.",2020-03-16,2020-03-17,2020-04-15,"Tanzania","TZA","TZ","National",1,NA,NA,"Closure and Regulation of Schools","Higher education institutions (i.e. degree granting institutions)",NA,"Higher education institutions closed/locked down","Tanzania",NA,NA,NA,NA,NA,"All Residents (Citizen Residents + Foreign Residents)",NA,NA,"Mandatory (Unspecified/Implied)","National Government,Ministry/Department of Health",53.0402911105294,52.0840635944004,51.2254403622644,127,"http://www.xinhuanet.com/english/2020-03/17/c_138888678.htm",2020-04-03,"2020-04-03 19:45:23"
"10","R_295GPTQcNVvg75MBg",5628427,"new_entry","correction","NA",NA,"On 20 April, All universities and colleges across Tanzania to be closed.",2020-03-18,2020-04-20,2020-04-20,"Tanzania","TZA","TZ","National",0,NA,NA,"Closure and Regulation of Schools","Higher education institutions (i.e. degree granting institutions)",NA,"","Tanzania",NA,NA,NA,NA,NA,"All Residents (Citizen Residents + Foreign Residents)",NA,NA,"Mandatory (Unspecified/Implied)","National Government,Provincial/State Government,Police",60.0826880693877,51.9312443110177,45.8091014992457,51,"https://www.youtube.com/watch?v=0YVAnn0lTaI",2020-06-10,"2020-06-10 11:12:10"
"11","R_2CwSHgxTlfB1wRABb",2071733,"new_entry","original","NA",NA,"Passengers should fill in Health Surveillance Form in the plane, or any other transport means and submit them to Port Health Authorities upon arrival.",2020-03-23,2020-03-23,NA,"Tanzania","TZA","TZ","National",0,NA,NA,"External Border Restrictions","Health Certificates",NA,"","All countries","All countries",NA,NA,NA,NA,"All Travelers (Citizen Travelers + Foreign Travelers )","Inbound","All kinds of transport","Mandatory (Unspecified/Implied)","National Government",53.3327788569766,52.2582520944327,51.219172807112,103,"https://www.africanews.com/2020/03/24/coronavirus-tanzania-travel-advisory-no1-of-23032020-update-on-covid-19-in-tanzania//",2020-04-02,"2020-04-02 13:44:56"
"12","R_3fwtXaZ0o608hBuBe",9843241,"new_entry","original","NA",NA,"In Tanzania all travellers will be subjected to an intensive screening and where necessary COVID-19 rapid testing.",2020-03-23,2020-03-23,NA,"Tanzania","TZA","TZ","National",0,NA,NA,"External Border Restrictions","Health Screenings (e.g. temperature checks)",NA,"","All countries","All countries",NA,NA,NA,NA,"All (Travelers + Residents)","Inbound","All kinds of transport","Mandatory (Unspecified/Implied)","National Government",53.3327788569766,52.2582520944327,51.219172807112,103,"https://www.africanews.com/2020/03/24/coronavirus-tanzania-travel-advisory-no1-of-23032020-update-on-covid-19-in-tanzania/",2020-04-04,"2020-04-04 11:50:27"
"13","R_bgBmJC3jAN8vyVPNA",7099487,"new_entry","original","NA",NA,"People residing in Tanzania are advised to avoid non-essential travels to COVID-19 affected countries",2020-03-23,2020-03-24,NA,"Tanzania","TZA","TZ","National",0,NA,NA,"External Border Restrictions",NA,NA,"","All countries","All countries",NA,NA,NA,NA,"All Residents (Citizen Residents +Foreign Residents)","Outbound","All kinds of transport","Voluntary/Recommended but No Penalties","National Government",54.3093447966509,52.3619194259407,50.4897894683725,107,"https://www.africanews.com/2020/03/24/coronavirus-tanzania-travel-advisory-no1-of-23032020-update-on-covid-19-in-tanzania//",2020-04-02,"2020-04-02 14:06:59"
"14","R_1gI9Hjwy9MCs0VtEc",4580931,"new_entry","original","NA",NA,"In Tanzania authorities announce further travel restrictions on April 4.",2020-04-07,2020-04-04,NA,"Tanzania","TZA","TZ","National",0,NA,NA,"External Border Restrictions","Travel History Form (e.g. documents where traveler has recently been)",NA,"","All countries","All countries",NA,NA,NA,NA,NA,NA,NA,"Mandatory (Unspecified/Implied)","National Government",56.4209387303778,52.190523347839,48.47611150162,65,"https://www.garda.com/crisis24/news-alerts/329896/tanzania-authorities-announce-further-travel-restrictions-april-4-update-3",2020-05-02,"2020-05-02 23:03:32"
"15","R_1QhKxEhW1ihOZOiCe",6019258,"new_entry","original","NA",NA,"Tanzania suspends all international passenger flights on April 12 due to COVID-19.",2020-04-12,2020-04-12,NA,"Tanzania","TZA","TZ","National",0,NA,NA,"External Border Restrictions","Other External Border Restriction",NA,"","All countries","All countries",NA,NA,NA,NA,NA,NA,NA,"Mandatory (Unspecified/Implied)","National Government",58.3100285715419,52.0243636269304,47.7637320476325,56,"https://www.garda.com/crisis24/news-alerts/331816/tanzania-international-passenger-flights-suspended-on-april-12-update-4",2020-05-02,"2020-05-02 23:07:11"
"16","R_1o7IPWVknd71RUWNA",1794116,"new_entry","original","NA",NA,"In Tanzania after 14 days quarantine, passengers who have not developed symptoms of COVID-19 may leave the facilities and will be required to register personal information for future possible tracking purpose after March 23.",2020-03-23,2020-03-23,NA,"Tanzania","TZA","TZ","National",0,NA,NA,"Health Monitoring",NA,NA,"","All countries","All countries",NA,NA,NA,NA,"All (Travelers + Residents)","Inbound","All kinds of transport","Mandatory (Unspecified/Implied)","National Government",53.3327788569766,52.2582520944327,51.219172807112,103,"https://www.africanews.com/2020/03/24/coronavirus-tanzania-travel-advisory-no1-of-23032020-update-on-covid-19-in-tanzania/",2020-04-04,"2020-04-04 11:57:05"
"17","R_9T8pJKfrDkX1vzjDc",9877018,"new_entry","original","NA",NA,"Tanzania sets up of the African Community’s Mobile Lab Community Lab project in Arusha for testing suspected coronavirus infections.",2020-03-26,2020-03-26,NA,"Tanzania","TZA","TZ","National",0,NA,NA,"Health Resources","Public Testing Facilities (e.g. drive-in testing for COVID-19)",NA,"","Burundi,Kenya,Rwanda,South Sudan,Tanzania,Uganda","One or more countries, but not all countries",NA,NA,NA,NA,"All (Travelers + Residents)","Inbound/Outbound","Not Applicable","Voluntary/Recommended but No Penalties","National Government,Other (Please specify in the text box)",55.2459079999896,52.1704681305311,49.727800921427,82,"https://www.africanews.com/2020/03/26/covid-19-east-african-community-eac-deploys-mobile-labs//",2020-04-02,"2020-04-02 14:51:28"
"18","R_2rBLzZxwTZvbDShCh",4064066,"new_entry","original","NA",NA,"In Tanzania Turkey helps Tanzania fight coronavirus, drill water wells, rescue albinos.",2020-03-31,2020-03-31,NA,"Tanzania","TZA","TZ","National",1,NA,NA,"Health Resources","Other Health Materials",NA,"","Tanzania","One or more countries, but not all countries",NA,NA,NA,NA,"All Residents (Citizen Residents + Foreign Residents)","Inbound/Outbound","Not Applicable","Voluntary/Recommended but No Penalties","Other (Please specify in the text box)",56.9611803972935,52.3264099668007,48.6222896300591,79,"https://www.dailysabah.com/turkey/mama-turkey-helps-tanzania-fight-coronavirus-drill-water-wells-rescue-albinos/news",2020-04-03,"2020-04-03 23:48:52"
"19","R_sMgoak7JB8VYD5LBh",7118561,"new_entry","original","NA",NA,"The Tanzanian government has ordered that each hospital prepare a separate ward to treat patients with COVID-19 on April 6.",2020-04-06,2020-04-06,NA,"Tanzania","TZA","TZ","National",0,NA,NA,"Health Resources","Hospitals",NA,"","Tanzania",NA,NA,NA,NA,NA,NA,NA,NA,"Mandatory (Unspecified/Implied)","National Government",57.6119729799386,52.201566566822,48.2850230113721,66,"http://mennoworld.org/2020/04/06/news/support-sought-as-tanzania-hospital-prepares-for-spread-of-coronavirus/",2020-05-03,"2020-05-03 19:17:07"
"20","R_1EYcGbSzHzDiFSXEk",2401352,"new_entry","original","NA",NA,"Tanzania's partners on Wednesday donated medical supplies, technological gadgets and cash amounting to 6.226 billion Tanzanian shillings (about 2.7 million U.S. dollars) to assist the country in combating and containing the Covid-19 pandemic on April 8.",2020-04-08,2020-04-08,NA,"Tanzania","TZA","TZ","National",0,NA,NA,"Health Resources","Ventilators",NA,"","Tanzania",NA,NA,NA,NA,NA,NA,NA,NA,"Mandatory (Unspecified/Implied)","National Government",57.8403710139845,52.2003187130864,48.3624808767729,67,"http://www.xinhuanet.com/english/2020-04/08/c_138958620.htm",2020-05-03,"2020-05-03 19:40:55"
"21","R_1EYcGbSzHzDiFSXCh",2401352,"new_entry","original","NA",NA,"Tanzania's partners on Wednesday donated medical supplies, technological gadgets and cash amounting to 6.226 billion Tanzanian shillings (about 2.7 million U.S. dollars) to assist the country in combating and containing the Covid-19 pandemic on April 8.",2020-04-08,2020-04-08,NA,"Tanzania","TZA","TZ","National",0,NA,NA,"Health Resources","Other Health Materials",NA,"","Tanzania",NA,NA,NA,NA,NA,NA,NA,NA,"Mandatory (Unspecified/Implied)","National Government",57.8403710139845,52.2003187130864,48.3624808767729,67,"http://www.xinhuanet.com/english/2020-04/08/c_138958620.htm",2020-05-03,"2020-05-03 19:40:55"
"22","R_9zXe9DfsjYHXhgRCr",2204719,"new_entry","original","NA",NA,"Tanzanian authorities on Tuesday pledged to protect all health workers who are taking care of COVID-19 patients on April 28.",2020-04-28,2020-04-28,NA,"Tanzania","TZA","TZ","National",0,NA,NA,"Health Resources","Personal Protective Equipment",NA,"","Tanzania",NA,NA,NA,NA,NA,NA,NA,NA,"Mandatory (Unspecified/Implied)","National Government",62.9893406013172,52.3700170828883,44.4589338668385,68,"http://www.xinhuanet.com/english/2020-04/29/c_139016134.htm",2020-05-02,"2020-05-02 23:32:26"
"23","R_31Ktgim5TorhDXHCh",7101299,"new_entry","original","NA",NA,"In Tanzania Jumeme, a mini-network operator, co-financed by the European Commission, is launching a """"Covid-19 aid programme"""" to support the Tanzanian government. The programme will provide free electricity for three months to 10 health care centres on the islands of Lake Victoria in Tanzania. The electricity will come from the company's local mini-hybrid solar grids on April 30.",2020-04-30,2020-04-30,NA,"Tanzania","TZA","TZ","National",0,NA,NA,"Health Resources","Other Health Materials",NA,"","Tanzania",NA,NA,NA,NA,NA,NA,NA,NA,"Mandatory (Unspecified/Implied)","National Government",NA,NA,NA,NA,"https://www.afrik21.africa/en/tanzania-covid-19-jumeme-to-provide-free-electricity-to-health-centres/",2020-05-02,"2020-05-02 23:22:27"
"24","R_3fwMXw26sc92av1NA",3589638,"new_entry","original","NA",NA,"All Ports of entry (airports and border crossings) in Tanzania  are conducting screening and travelers with a fever are diverted to secondary for further examination",2020-02-25,2020-02-25,NA,"Tanzania","TZA","TZ","National",0,NA,NA,"Health Testing",NA,NA,"","All countries","All countries",NA,NA,NA,NA,"All (Travelers + Residents)","Inbound/Outbound","Flights,Land Border,Trains,Buses,Seaports,Cruises,Ferries","Mandatory with Legal Penalties (Jail Time)","National Government,Ministry/Department of Health,Military,Provincial/State Government,Police",49.7282733141057,47.3587231647457,43.6802153870514,23,"https://tz.usembassy.gov/covid-19-information/?_ga=2.22071867.1601748976.1584185584-1155192847.1584185584",2020-04-02,"2020-04-02 10:46:01"
"25","R_1Qn1EdIFT9Hvj9nNA",2532653,"new_entry","original","NA",NA,"In Tanzania passengers should fill in Health Surveillance Form in the plane, or any other transport means and submit them to Port Health Authorities upon arrival after March 23.",2020-03-23,2020-03-23,NA,"Tanzania","TZA","TZ","National",0,NA,NA,"Health Testing",NA,NA,"","All countries","All countries",NA,NA,NA,NA,"All (Travelers + Residents)","Inbound/Outbound","All kinds of transport","Mandatory (Unspecified/Implied)","National Government",53.3327788569766,52.2582520944327,51.219172807112,103,"https://www.africanews.com/2020/03/24/coronavirus-tanzania-travel-advisory-no1-of-23032020-update-on-covid-19-in-tanzania/",2020-04-04,"2020-04-04 11:44:15"
"26","R_2rdV51ZzrTARVzrNA",6278572,"new_entry","original","NA",NA,"All travelers will be subjected to an intensive screening and where necessary COVID-19 rapid testing.",2020-03-23,2020-03-23,NA,"Tanzania","TZA","TZ","National",0,NA,NA,"Health Testing",NA,NA,"","All countries","All countries",NA,NA,NA,NA,"All Travelers (Citizen Travelers + Foreign Travelers )","Inbound","All kinds of transport","Mandatory (Unspecified/Implied)","National Government",53.3327788569766,52.2582520944327,51.219172807112,103,"https://www.africanews.com/2020/03/24/coronavirus-tanzania-travel-advisory-no1-of-23032020-update-on-covid-19-in-tanzania//",2020-04-02,"2020-04-02 13:58:26"
"27","R_1HcLH281Rsk8Iu3NA",9037818,"new_entry","original","NA",NA,"As of 23 March 2020,the government of Tanzania issued a directive to the effect that all travellers arriving in Tanzania were to be subjected to intensive screening where necessary Covid- 19 rapid testing.",2020-03-23,2020-03-23,NA,"Tanzania","TZA","TZ","National",0,NA,NA,"Health Testing",NA,NA,"","All countries","All countries",NA,NA,NA,NA,"All Travelers (Citizen Travelers + Foreign Travelers )","Inbound","All kinds of transport","Mandatory (Unspecified/Implied)","National Government,Ministry/Department of Health",53.3327788569766,52.2582520944327,51.219172807112,103,"https://www.africanews.com/2020/03/24/coronavirus-tanzania-travel-advisory-no1-of-23032020-update-on-covid-19-in-tanzania/",2020-04-03,"2020-04-03 20:10:35"
"28","R_1lmgSmmWA0qBw39NA",5494076,"new_entry","original","NA",NA,"In Tanzania Barrick Gold (TSX: ABX) (NYSE: GOLD), the world’s second-largest gold miner, announced that Twiga Minerals Corporation, its joint venture with the Tanzanian government, launched a support program to assist the east African country in combating and containing the covid-19 pandemic on April 9.",2020-04-09,2020-04-09,NA,"Tanzania","TZA","TZ","National",0,NA,NA,"Other Policy Not Listed Above",NA,"economic support","","Tanzania",NA,NA,NA,NA,NA,NA,NA,NA,"Mandatory (Unspecified/Implied)","National Government",58.2833070777332,52.2013303240371,48.3178366175084,63,"https://www.mining.com/barrick-launches-covid-19-support-program-in-tanzania/",2020-05-02,"2020-05-02 23:47:20"
"29","R_1KdPZJ74JnEYle3NA",2006848,"new_entry","original","NA",NA,"In Tanzania president John Magufuli made the declaration for nationwide prayer Thursday, urging Tanzanians to pray for God's protection and healing as 53 more people tested positive for the virus, raising the number of infections to 143 and one death Friday.on April 17.",2020-04-17,2020-04-17,NA,"Tanzania","TZA","TZ","National",0,NA,NA,"Other Policy Not Listed Above",NA,"declaration for nationwide prayer","","Tanzania",NA,NA,NA,NA,NA,NA,NA,NA,"Mandatory (Unspecified/Implied)","National Government",58.5504679539298,51.8728293849839,47.6317866829786,49,"https://observer.ug/news/headlines/64327-magufuli-declares-3-days-of-prayer-to-defeat-covid-19-in-tanzania",2020-05-02,"2020-05-02 23:39:04"
"30","R_sMqy7YMs3ooQqL7NA",9238445,"new_entry","original","NA",NA,"Tanzania the Bank of Tanzania (BoT) has accepted more funds above the amount sought to be raised through the government securities auctioned in the last three consecutive trading sessions on April 29.",2020-04-29,2020-04-29,NA,"Tanzania","TZA","TZ","National",0,NA,NA,"Other Policy Not Listed Above",NA,"economic support","","Tanzania",NA,NA,NA,NA,NA,NA,NA,NA,"Mandatory (Unspecified/Implied)","National Government",63.2405961648257,52.4723798528144,44.2400761746659,71,"https://allafrica.com/stories/202004290479.html",2020-05-02,"2020-05-02 23:26:56"
"31","R_2RUF3ZFO88FuVppAy",5367568,"new_entry","original","NA",NA,"In Tanzania City Council Embarks On Programme to Raise Awareness On COVID-19 on April 17.",2020-04-17,2020-04-17,NA,"Tanzania","TZA","TZ","National",0,NA,NA,"Public Awareness Measures","Gathering information related to COVID-19 from the public",NA,"",NA,NA,NA,NA,NA,NA,NA,NA,NA,"Mandatory (Unspecified/Implied)","National Government",58.5504679539298,51.8728293849839,47.6317866829786,49,"https://allafrica.com/stories/202004170551.html",2020-05-02,"2020-05-02 23:41:45"
"32","R_2DTZ7V6KAmVAHksAz",5099602,"new_entry","correction","NA",NA,"Tanzania -- All travelers whether foreigners or returning residents arriving from COVID-19 most affected countries will be subjected to mandatory isolation for 14 days at their own cost at designated facilities identified by the Government.",2020-03-23,2020-03-23,NA,"Tanzania","TZA","TZ","National",0,NA,NA,"Quarantine","Government Quarantine (i.e. quarantine at a government hotel or facility)",NA,"","All countries","All countries",NA,NA,NA,NA,"All (Travelers + Residents)","Inbound/Outbound","All kinds of transport","Mandatory with Legal Penalties (Jail Time)","National Government,Ministry/Department of Health,Police",53.3327788569766,52.2582520944327,51.219172807112,103,"https://www.africanews.com/2020/03/24/coronavirus-tanzania-travel-advisory-no1-of-23032020-update-on-covid-19-in-tanzania//",2020-07-21,"2020-07-21 14:13:43"
"33","R_eJz4KG8xcR2F1QtAz",5271034,"new_entry","original","NA",NA,"In Tanzania all travellers whether foreigners or returning residents arriving from COVID-19 most affected countries, will be subjected to mandatory isolation for 14 days at their own cost at designated facilities identified by the Government from March 24.",2020-03-23,2020-03-23,NA,"Tanzania","TZA","TZ","National",0,NA,NA,"Quarantine","Government Quarantine (i.e. quarantine at a government hotel or facility)",NA,"","All countries","All countries",NA,NA,NA,NA,"All (Travelers + Residents)","Inbound/Outbound","All kinds of transport","Mandatory (Unspecified/Implied)","National Government",53.3327788569766,52.2582520944327,51.219172807112,103,"https://www.africanews.com/2020/03/24/coronavirus-tanzania-travel-advisory-no1-of-23032020-update-on-covid-19-in-tanzania/",2020-04-04,"2020-04-04 11:40:08"
"34","R_1iaEkDEDGRpG65nAz",7143452,"new_entry","original","NA",NA,"As of 23 March 2020, the government of Tanzania declared all travelers arriving from COVID-19 most affected countries be subjected to mandatory isolation at their own cost at designated facilities identified by government.",2020-03-23,2020-04-23,NA,"Tanzania","TZA","TZ","National",0,NA,NA,"Quarantine","Government Quarantine (i.e. quarantine at a government hotel or facility)",NA,"",NA,"One or more countries, but not all countries",NA,NA,NA,NA,"All Travelers (Citizen Travelers + Foreign Travelers )","Inbound","All kinds of transport","Mandatory (Unspecified/Implied)","National Government,Ministry/Department of Health",60.6896561819467,51.9249930549063,45.468812310446,52,"https://tz.usembassy.gov/covid-19-information/",2020-04-03,"2020-04-03 19:12:00"
"35","R_0qWfJfzHgSEWlrzNA",7931835,"new_entry","original","NA",NA,"In Tanzania ll BRT buses will be required to carry passengers according to their operating license (nobody is allowed to be standing in DalaDalas etc.) on March 19.",2020-03-19,2020-03-19,NA,"Tanzania","TZA","TZ","Provincial",1,"Dar es Salaam",NA,"Restriction and Regulation of Government Services",NA,NA,"","Tanzania",NA,NA,"Dar es Salaam",NA,NA,"All Residents (Citizen Residents + Foreign Residents)",NA,NA,"Mandatory (Unspecified/Implied)","Provincial/State Government",53.5820087456672,52.1000898867809,50.4396666501015,121,"https://www.thecitizen.co.tz/news/-New-guidelines-on-public-transport-to-curb-Covid-19/1840340-5498184-15s9glez/index.html",2020-04-04,"2020-04-04 00:12:16"
