record_id,policy_id,entry_type,correct_type,update_type,update_level,description,date_announced,date_start,date_end,country,ISO_A3,ISO_A2,init_country_level,domestic_policy,province,city,type,type_sub_cat,type_text,institution_status,target_country,target_geog_level,target_region,target_province,target_city,target_other,target_who_what,target_direction,travel_mechanism,compliance,enforcer,index_high_est,index_med_est,index_low_est,index_country_rank,link,date_updated,recorded_date
R_3nwoHMSdhwyBJyMNA,8846279,new_entry,original,,,"March 9 - As an anti-disinformation measure, state of Johor police in Malaysia have opened six investigation papers in connection with false reports on the Covid-19 infection after police received six reports on the matter between January and March 7 this year. Four of the cases were being investigated under Sections 203 and 505 of the Penal Code and the other two under Section 233 of the Communications and Multimedia Act 1998 (CMA). Sections 203 and 505 of the Penal Code deal with giving false information and statements conducing to public mischief, while Section 233 of the CMA is regarding improper use of network facilities or network service.

",2020-03-09,2020-03-09,,Malaysia,MYS,MY,Provincial,0,Johor,,Anti-Disinformation Measures,,,"",Malaysia,,,Johor,,,,,,"Mandatory with Legal Penalties (Jail Time),Mandatory with Fines","Provincial/State Government,Police",51.1020509407504,46.3390994803653,42.3008652090692,1,https://www.malaymail.com/news/malaysia/2020/03/09/johor-police-probing-six-cases-of-false-reports-on-covid-19/1844738 ; https://www.astroawani.com/berita-malaysia/polis-johor-siasat-enam-kes-berita-palsu-covid19-232997,2020-12-14,2020-12-14T19:18:23Z
R_2THOiPaIeqQ0ZOmNA,4960503,new_entry,original,,,March 16 - The Malaysia Communications and Multimedia Commission (MCMC) has launched an official Telegram channel for the Sebenarnya.my news portal as part of a measure to curb the spread of fake news regarding Covid-19 on social media. Members of the public can join the Telegram channel through https://t.me/sebenarnyamy and receive the latest and most accurate information about Covid-19 verified by authorities such as the Ministry of Health.,2020-03-16,2020-03-16,,Malaysia,MYS,MY,National,0,,,Anti-Disinformation Measures,,,"",Malaysia,,,,,,,,,Voluntary/Recommended but No Penalties,"National Government,Other (Please specify in the text box)",49.2341531141848,46.7346561211786,42.8072977790968,2,https://www.hmetro.com.my/mutakhir/2020/03/555244/covid-19-sertai-telegram-skmm-tangani-berita-palsu ; https://www.thestar.com.my/tech/tech-news/2020/03/16/covid-19-mcmc-launches-telegram-channel-for-anti-fake-news-portal-sebenarnyamy,2020-12-15,2020-12-15T04:23:04Z
R_eL0h0gTRMkabNuxNA,8177235,new_entry,original,,,"March 23 - The Malaysian Communications and Multimedia Commission (MCMC), with the cooperation of the police, is investigating the cases of individuals alleged to have spread fake news about COVID-19. The commission said the investigations are being conducted under section 233 of the Communications and Multimedia Act 1988 which carries a maximum fine of RM50,000 or one year of imprisonment or both, upon conviction. To date, the MCMC has received 43 reports from members of the public, with 18 suspects identified. Six of them, including a celebrity, have been charged in court under Section 505 (b) of the Penal Code which carries a maximum jail term of two years or a fine or both, if found guilty.",2020-01-25,2020-03-18,,Malaysia,MYS,MY,National,0,,,Anti-Disinformation Measures,,,"",Malaysia,,,,,,,,,"Mandatory with Legal Penalties (Jail Time),Mandatory with Fines","National Government,Police,Other (Please specify in the text box)",49.6801917407872,46.6666744309057,42.7471979209896,2,https://www.mcmc.gov.my/en/media/press-clippings/covid-19-fake-news-mcmc-police-investigating-five ; https://www.malaymail.com/news/malaysia/2020/03/22/communications-ministry-probes-42-cases-of-fake-news-on-covid-19-and-mco/1849028 ; https://www.malaymail.com/news/malaysia/2020/03/18/police-say-already-opened-40-cases-on-covid-19-fake-news-since-january-25/1847756,2020-12-18,2020-12-18T05:49:41Z
R_viqGXijPmp6ytnXNA,7220675,new_entry,original,,,"Malaysian government's Quick Response Team (PRP) was set up on March 24 to counter fake news pertaining to the movement control order (MCO), Bantuan Prihatin Nasional (BPN), Welfare Department aid, and other hotly debated topics in the wake of the Covid-19 pandemic. The focus of PRP is to monitor and clarify suspicious news as well as announcements and to obtain clarification from those involved so as not to cause concern and apprehension among the public. PRP which comprised of department and agency officers under the Ministry of Communications and Multimedia in cooperation with the National Security Council (NSC) would continue to function throughout the MCO.",2020-04-21,2020-03-24,,Malaysia,MYS,MY,National,0,,,Anti-Disinformation Measures,,,"",Malaysia,,,,,,,,,Voluntary/Recommended but No Penalties,"National Government,Other (Please specify in the text box)",51.0275400246002,46.2321246584111,41.4557765810081,1,https://www.malaysiakini.com/news/521875 ; https://www.mcmc.gov.my/en/media/press-clippings/saifuddin-205-fake-news-items-%E2%80%98busted%E2%80%99-by-communic,2020-12-17,2020-12-17T22:59:39Z
R_DFSOK8TwRdvV8HvDo,995151,new_entry,original,,,"Muhyiddin added that all nurseries, government and private schools, including boarding schools, international schools, tahfiz centres as well as primary, secondary and pre-university education institutions will be closed. This also includes all public and private universities as well as vocational training centres.

",2020-03-16,2020-03-18,2020-03-31,Malaysia,MYS,MY,National,1,,,Closure and Regulation of Schools,Preschool or childcare facilities (generally for children ages 5 and below),,Preschool or childcare facilities closed/locked down,Malaysia,,,,,,All Residents (Citizen Residents + Foreign Residents),,,Mandatory (Unspecified/Implied),National Government,49.6801917407872,46.6666744309057,42.7471979209896,2,https://www.thestar.com.my/news/nation/2020/03/16/malaysia-announces-restricted-movement-measure-after-spike-in-covid-19-cases?utm_source=outbreak.my,2020-09-23,2020-09-23T12:59:18Z
R_DFSOK8TwRdvV8HvDq,995151,new_entry,original,,,"Muhyiddin added that all nurseries, government and private schools, including boarding schools, international schools, tahfiz centres as well as primary, secondary and pre-university education institutions will be closed. This also includes all public and private universities as well as vocational training centres.

",2020-03-16,2020-03-18,2020-03-31,Malaysia,MYS,MY,National,1,,,Closure and Regulation of Schools,Primary Schools (generally for children ages 10 and below),,Primary Schools closed/locked down,Malaysia,,,,,,All Residents (Citizen Residents + Foreign Residents),,,Mandatory (Unspecified/Implied),National Government,49.6801917407872,46.6666744309057,42.7471979209896,2,https://www.thestar.com.my/news/nation/2020/03/16/malaysia-announces-restricted-movement-measure-after-spike-in-covid-19-cases?utm_source=outbreak.my,2020-09-23,2020-09-23T12:59:18Z
R_DFSOK8TwRdvV8HvEp,995151,new_entry,original,,,"Muhyiddin added that all nurseries, government and private schools, including boarding schools, international schools, tahfiz centres as well as primary, secondary and pre-university education institutions will be closed. This also includes all public and private universities as well as vocational training centres.

",2020-03-16,2020-03-18,2020-03-31,Malaysia,MYS,MY,National,1,,,Closure and Regulation of Schools,Secondary Schools (generally for children ages 10 to 18),,Secondary Schools closed/locked down,Malaysia,,,,,,All Residents (Citizen Residents + Foreign Residents),,,Mandatory (Unspecified/Implied),National Government,49.6801917407872,46.6666744309057,42.7471979209896,2,https://www.thestar.com.my/news/nation/2020/03/16/malaysia-announces-restricted-movement-measure-after-spike-in-covid-19-cases?utm_source=outbreak.my,2020-09-23,2020-09-23T12:59:18Z
R_DFSOK8TwRdvV8HvBr,995151,new_entry,original,,,"Muhyiddin added that all nurseries, government and private schools, including boarding schools, international schools, tahfiz centres as well as primary, secondary and pre-university education institutions will be closed. This also includes all public and private universities as well as vocational training centres.

",2020-03-16,2020-03-18,2020-03-31,Malaysia,MYS,MY,National,1,,,Closure and Regulation of Schools,Higher education institutions (i.e. degree granting institutions),,Higher education institutions closed/locked down,Malaysia,,,,,,All Residents (Citizen Residents + Foreign Residents),,,Mandatory (Unspecified/Implied),National Government,49.6801917407872,46.6666744309057,42.7471979209896,2,https://www.thestar.com.my/news/nation/2020/03/16/malaysia-announces-restricted-movement-measure-after-spike-in-covid-19-cases?utm_source=outbreak.my,2020-09-23,2020-09-23T12:59:18Z
R_1C7QIkzj9fqgzwFNA,4213225,new_entry,original,,,"Malaysians will be barred from leaving the country and restrictions placed on the entry of all tourists and foreign visitors into Malaysia.
",2020-03-16,2020-03-18,2020-03-31,Malaysia,MYS,MY,National,0,,,External Border Restrictions,,,"",Malaysia,All countries,,,,,All (Travelers + Residents),Inbound/Outbound,All kinds of transport,Mandatory (Unspecified/Implied),National Government,49.6801917407872,46.6666744309057,42.7471979209896,2,https://www.thestar.com.my/news/nation/2020/03/16/malaysia-announces-restricted-movement-measure-after-spike-in-covid-19-cases?utm_source=outbreak.my,2020-09-21,2020-09-21T20:39:45Z
R_QgIen8QiLlizEYxBu,554717,new_entry,original,,,"The Ministry of Health would like to advise all devotees and visitors to always practice good personal hygiene, wash hands frequently with soap and water or sanitisers, wear a face mask, and avoid touching eyes, nose and mouth frequently, to reduce the risk of 2019- nCoV infection during during Thaipusam festival (religious festival).",2020-02-06,2020-02-06,,Malaysia,MYS,MY,National,0,,,Hygiene,Hygiene measures for public areas,,"",Malaysia,,,,,,,,,Voluntary/Recommended but No Penalties,National Government,51.6070112997647,46.0897922167994,40.9693258048221,4,https://www.moh.gov.my/moh/resources/COVID-19/PRESS%20RELEASE/PR_6_Feb.pdf,2020-09-18,2020-09-18T23:46:59Z
R_2QyRQPSRTzXBlBKCt,2782184,new_entry,original,,,"March 13 — Two tabligh homes at a housing estate on the island of Labuan, Malaysia are currently undergoing disinfection exercise by the Labuan Crisis Preparedness and Response Centre (CPRC) after members of a tabligh congregation from Brunei and Tawau, in Sabah were tested positive for Covid-19.",2020-03-13,2020-03-13,,Malaysia,MYS,MY,Provincial,0,Labuan,,Hygiene,Other Areas Hygiene Measures Applied,,"",Malaysia,,,Labuan,,,,,,Mandatory (Unspecified/Implied),"Provincial/State Government,Other (Please specify in the text box)",49.5963560095573,46.5705018022034,42.4789347715437,2,https://www.malaymail.com/news/malaysia/2020/03/13/labuan-tabligh-homes-undergo-disinfection/1846246 ; https://www.sinarharian.com.my/article/73674/KHAS/Covid-19/Premis-kediaman-tabligh-di-Labuan-jalani-proses-disinfeksi,2020-12-18,2020-12-18T18:19:18Z
R_WxOjP8RZrxShVvjBu,9919852,new_entry,original,,,"March 14 — Four ‘tabligh’ (religious outreach) premises in Sabah, Malaysia, namely Kota Kinabalu, Beaufort, Tawau and Sandakan, have been temporarily closed for disinfection. The measure is part of efforts by the Sabah government to curb the spread of Covid-19, besides ensuring virus transmission is minimised following the tabligh gathering at Sri Petaling Mosque in Kuala Lumpur (February 27 to March 1) which was attended by a Sabah tabligh congregation as well.

Mosques and surau (prayer rooms) in Sabah which have been visited by members of the congregation are also closed temporarily for disinfection, coordinated by the state religious department (JHEAINS), state health department and municipal councils.",2020-03-14,2020-03-14,,Malaysia,MYS,MY,Provincial,0,Sabah,,Hygiene,Hygiene measures for public areas,,"",Malaysia,,,Sabah,,,,,,Mandatory (Unspecified/Implied),"Ministry/Department of Health,Provincial/State Government,Municipal Government,Other (Please specify in the text box)",49.6754766610906,46.7912503124899,42.8615820412942,3,https://www.malaymail.com/news/malaysia/2020/03/14/covid-19-four-tabligh-premises-in-sabah-temporarily-closed-says-state-secre/1846643 ; https://www.sinarharian.com.my/article/73859/KHAS/Covid-19/Covid-19-Empat-markas-tabligh-di-Sabah-jalani-proses-disinfeksi,2020-12-18,2020-12-18T18:55:52Z
R_WxOjP8RZrxShVvjCt,9919852,new_entry,original,,,"March 14 — Four ‘tabligh’ (religious outreach) premises in Sabah, Malaysia, namely Kota Kinabalu, Beaufort, Tawau and Sandakan, have been temporarily closed for disinfection. The measure is part of efforts by the Sabah government to curb the spread of Covid-19, besides ensuring virus transmission is minimised following the tabligh gathering at Sri Petaling Mosque in Kuala Lumpur (February 27 to March 1) which was attended by a Sabah tabligh congregation as well.

Mosques and surau (prayer rooms) in Sabah which have been visited by members of the congregation are also closed temporarily for disinfection, coordinated by the state religious department (JHEAINS), state health department and municipal councils.",2020-03-14,2020-03-14,,Malaysia,MYS,MY,Provincial,0,Sabah,,Hygiene,Other Areas Hygiene Measures Applied,,"",Malaysia,,,Sabah,,,,,,Mandatory (Unspecified/Implied),"Ministry/Department of Health,Provincial/State Government,Municipal Government,Other (Please specify in the text box)",49.6754766610906,46.7912503124899,42.8615820412942,3,https://www.malaymail.com/news/malaysia/2020/03/14/covid-19-four-tabligh-premises-in-sabah-temporarily-closed-says-state-secre/1846643 ; https://www.sinarharian.com.my/article/73859/KHAS/Covid-19/Covid-19-Empat-markas-tabligh-di-Sabah-jalani-proses-disinfeksi,2020-12-18,2020-12-18T18:55:52Z
R_3CCzGY5gOI7Y4UIBu,5248702,new_entry,original,,,"March 17 - Darul Hana Mosque in Jalan Tun Salahudin, Kuching, Malaysia was ordered to close after a number of tabligh members who attended a mass tabligh programme at the Sri Petaling Mosque in Kuala Lumpur including those suspected to be infected with Covid-19, had stayed at the Darul Hana Mosque from March 6 to 8. All activities held at the mosque will be stopped immediately including the five obligatory prayers in congregation, Friday prayers, while ‘nikah’ (solemnising) ceremonies will also be postponed. 

As of yesterday, at least seven mosques across Sarawak have been formally instructed to close to give way to cleaning and disinfection works by the State Health Department and the Sarawak Islamic Religious Department.

",2020-03-17,2020-03-17,,Malaysia,MYS,MY,Provincial,0,Sarawak,,Hygiene,Hygiene measures for public areas,,"",Malaysia,,,Sarawak,,,,,,Mandatory (Unspecified/Implied),"Ministry/Department of Health,Provincial/State Government,Other (Please specify in the text box)",49.5007146882187,46.6677275688368,42.8793582066993,3,https://www.malaymail.com/news/malaysia/2020/03/17/covid-19-sarawak-mosques-surau-committees-urged-to-clean-premises-proactive/1847426 ; https://www.freemalaysiatoday.com/category/nation/2020/03/17/sarawak-closes-7-mosques-for-disinfection/,2020-12-19,2020-12-19T00:52:16Z
R_1l3k4tfkvPawAlWBu,5409986,new_entry,original,,,A standard operating procedure is in place to guide authorities who are carrying out disinfection exercises.,2020-04-02,2020-03-27,,Malaysia,MYS,MY,National,0,,,Hygiene,Hygiene measures for public areas,,"",Malaysia,,,,,,,,,Mandatory (Unspecified/Implied),National Government,51.5063726680039,46.2915265658708,41.727624172535,1,https://www.thestar.com.my/news/nation/2020/04/02/disinfection-exercises-have-been-standardised-by-the-health-ministry-says-ismail-sabri,2020-09-19,2020-09-19T18:32:23Z
R_1l3k4tfkvPawAlWCt,5409986,new_entry,original,,,A standard operating procedure is in place to guide authorities who are carrying out disinfection exercises.,2020-04-02,2020-03-27,,Malaysia,MYS,MY,National,0,,,Hygiene,Other Areas Hygiene Measures Applied,,"",Malaysia,,,,,,,,,Mandatory (Unspecified/Implied),National Government,51.5063726680039,46.2915265658708,41.727624172535,1,https://www.thestar.com.my/news/nation/2020/04/02/disinfection-exercises-have-been-standardised-by-the-health-ministry-says-ismail-sabri,2020-09-19,2020-09-19T18:32:23Z
R_2tJ1z5rsNKljbynNA,7220938,new_entry,original,,,"Disinfection operations would be continued in trains, buses and ferries managed by Prasarana including (train) stations, bus hubs and ferry terminals. The body temperature of the staff on duty, particularly bus captains, auxiliary police personnel and station workers would also be checked before they were allowed to commence work.",2020-05-01,2020-05-04,,Malaysia,MYS,MY,National,0,,,Hygiene,,,"",Malaysia,,,,,,,,,Mandatory (Unspecified/Implied),National Government,,,,,https://www.bernama.com/en/general/news_covid-19.php?id=1837643,2020-09-19,2020-09-19T19:01:41Z
R_2zUa3xlrdgtZH9ANA,2239158,new_entry,original,,,"March 17 — The Sabah government has announced an immigration order preventing the entry of non-Sabahans into the state, to be implemented throughout the 14-day period of the Movement Control Order announced by the Malaysian Federal government last night, and which takes effect tomorrow.
Malaysians who are not from Sabah are not allowed entry via air, sea, or land unless with special approval from the state government.
Visitors from Sarawak and the Peninsula wishing to enter Sabah are also required to provide medical certificates from hospitals to prove that they are not infected with Covid-19.

",2020-03-17,2020-03-18,2020-03-31,Malaysia,MYS,MY,Provincial,1,Sabah,,Internal Border Restrictions,,,"",Malaysia,One or more geographical or administrative units within one or more countries,,Sabah,,,All Residents (Citizen Residents + Foreign Residents),,,"Mandatory (Unspecified/Implied),Mandatory with Exceptions (Please list exceptions in the text entry)",Provincial/State Government,49.6801917407872,46.6666744309057,42.7471979209896,2,https://www.malaymail.com/news/malaysia/2020/03/17/covid-19-sabah-issues-temporary-immigration-ban-on-non-sabahans/1847550 ; https://www.nst.com.my/news/nation/2020/03/575489/sabah-govt-imposes-immigration-restriction-order,2020-12-19,2020-12-19T10:16:53Z
R_2vYbW50kZMMPq7mNA,2239158,update,correction,End of Policy,,"March 20 - The Sabah government has made some changes to its Immigration restrictions due to the movement control order (MCO):

State and federal civil servants and officialsas well as staff from the private sector wanting to enter Sabah for essential service duties from now until March 31 must provide a letter from their department heads or employers for the needed work. 

As for staff from the private sector needing to enter Sabah to carry out their essential services duties, he said they must also provide letters from their department chiefs or employers for the needed work.

Non-Sabahans with permanent residency passes, including spouses or children, Sabahan residents with work passes, student passes, long-term social visit passes or any other form of relief orders can enter the state but are required to self-quarantine for 14 days. Spouses who are not from Sabah must produce their marriage certificates as proof for entry.

The previous order stated that anyone who is not a Sabah resident is not allowed into Sabah via land, sea or air unless they have special approval from the state government.They must also provide a medical certificate clearing them of Covid-19.",2020-03-20,2020-03-20,2020-03-31,Malaysia,MYS,MY,Provincial,1,Sabah,,Internal Border Restrictions,,,"",Malaysia,One or more geographical or administrative units within one or more countries,,Sabah,,,All Residents (Citizen Residents + Foreign Residents),,,"Mandatory (Unspecified/Implied),Mandatory with Exceptions (Please list exceptions in the text entry)",Provincial/State Government,50.4106741331236,46.227179928471,42.5323886873101,1,NA ; https://www.bharian.com.my/berita/wilayah/2020/03/667070/covid-19-sabah-perinci-sekatan-perintah-kawalan-pergerakan ; BH Online ; COVID-19: Sabah perinci sekatan Perintah Kawalan Pergerakan,2020-12-21,2020-12-21T08:26:43Z
R_2wELicJIGLAaqCENA,5032639,new_entry,original,,,"March 16 - Malaysia will be under a nationwide movement control order from this Wednesday (March 18) until March 31 due to the Covid-19 outbreak, Prime Minister Tan Sri Muhyiddin Yassin announced today. The prime minister said that the government has decided to implement a ‘restriction of movement order’ under the Prevention and Control of Infectious Diseases Act 1988 and the Police Act 1967. 

Muhyiddin said this means that all business premises have to be shut down, except for outlets such as supermarkets and grocery stores selling daily essentials. He said all government and private premises would be closed during the movement control order, except for essential services such as utilities, telecommunications, transport, banking, health, pharmacies, ports, airports, cleaning and food supplies.

He said that the movement control order also means all Malaysians will be banned from travelling abroad, and that no tourists or foreigners will be allowed to enter the country.

“Malaysian who have returned from abroad have to self-quarantine for 14 days,” he added. Muhyiddin also said that all childcare centres, government and private schools, boarding schools, international schools, tahfiz centres and other secondary, primary and pre-university institutions will also be closed. “All private and public higher learning institutions together with vocational training centres will be closed nationwide,” he said.
",2020-03-16,2020-03-18,2020-03-31,Malaysia,MYS,MY,National,0,,,Lockdown,,,"",Malaysia,,,,,,,,,"Mandatory (Unspecified/Implied),Mandatory with Exceptions (Please list exceptions in the text entry)","National Government,Police",49.6801917407872,46.6666744309057,42.7471979209896,2,https://www.malaymail.com/news/malaysia/2020/03/16/pm-malaysia-in-lockdown-from-wed-until-march-31-all-shops-closed-except-for/1847204 ; https://www.malaymail.com/news/malaysia/2020/03/17/police-to-enforce-movement-control-order-says-armed-forces-chief/1847247 ; https://www.pmo.gov.my/2020/03/perutusan-khas-yab-perdana-menteri-mengenai-covid-19-16-mac-2020/,2020-12-18,2020-12-18T07:02:24Z
R_9tzsq9eyMCkoJoJNA,7769654,new_entry,original,,,Prime Minister Tan Sri Muhyiddin Yassin (pic) has declared that the entire country will be on a movement control order starting from March 18 to 31 to deal with the rise in Covid-19 cases.,2020-03-16,2020-03-18,2020-04-14,Malaysia,MYS,MY,National,0,,,Lockdown,,,"",Malaysia,,,,,,,,,Mandatory (Unspecified/Implied),National Government,49.6801917407872,46.6666744309057,42.7471979209896,2,https://www.thestar.com.my/news/nation/2020/03/16/malaysia-announces-restricted-movement-measure-after-spike-in-covid-19-cases?utm_source=outbreak.my,2020-09-21,2020-09-21T20:13:37Z
R_1FxMEO8giQAIaplNA,3590134,new_entry,original,,,Sarawak adds another level of regulation during this movement control order period by telling Sarawakians that they must be indoors from 7pm to 7am beginning Tuesday (March 24). The regulation will last until March 31.,2020-03-24,2020-03-24,2020-03-31,Malaysia,MYS,MY,Provincial,0,Sarawak,,Lockdown,,,"",Malaysia,,,Sarawak,,,,,,Mandatory (Unspecified/Implied),Provincial/State Government,51.0275400246002,46.2321246584111,41.4557765810081,1,https://www.thestar.com.my/news/nation/2020/03/24/sarawak-begins-curfew-from-7pm-to-7am-daily-in-bid-to-curb-covid-19?utm_source=outbreak.my,2020-09-16,2020-09-16T18:01:22Z
R_2WI6o2jvzGGcT0fNA,7769654,update,original,Change of Policy,Strengthening,"A movement control order in Malaysia was initially from March 18 to 31. However, it has been extended to April 14.",2020-03-25,2020-03-25,2020-04-14,Malaysia,MYS,MY,National,0,,,Lockdown,,,"",Malaysia,,,,,,,,,Mandatory (Unspecified/Implied),National Government,50.7817313452556,46.2179212893549,41.9350108983693,1,NA,2020-09-23,2020-09-23T15:14:23Z
R_3kbnoQ93fkp3KmFNA,3018912,new_entry,original,,,"An enhanced order will be imposed in Hulu Langat, Selangor, where 71 out of 274 individuals from a Tahfiz school test were confirmed to be infected with COVID-19. Residents will not be allowed to leave their homes and no visitors will be allowed to enter the area.",2020-04-01,2020-04-01,2020-04-14,Malaysia,MYS,MY,National,1,,,Lockdown,,,"",Malaysia,One or more geographical or administrative units within one or more countries,,,,,All Residents (Citizen Residents + Foreign Residents),,Not Applicable,Mandatory (Unspecified/Implied),Other (Please specify in the text box),51.4137075525,46.26894988673,40.7160171718505,1,https://www.garda.com/crisis24/news-alerts/327731/malaysia-government-implements-phase-2-of-movement-control-order-april-1-14-update-9,2020-09-16,2020-09-16T17:17:14Z
