"","record_id","policy_id","entry_type","correct_type","update_type","update_level","description","date_announced","date_start","date_end","country","ISO_A3","ISO_A2","init_country_level","domestic_policy","province","city","type","type_sub_cat","type_text","institution_status","target_country","target_geog_level","target_region","target_province","target_city","target_other","target_who_what","target_direction","travel_mechanism","compliance","enforcer","index_high_est","index_med_est","index_low_est","index_country_rank","link","date_updated","recorded_date"
"39","R_vqzE24uSrT8FODvBy","3488321","new_entry","original",NA,NA,"The Ecuadorian Ministry of Works sets the rules of working from home. Every ministry and employer in the private sector has to look for options that employees can work from home (""teletrabajo""). If so, the employer is obliged to provide documents which employees can show to the police in case of questioning. Lost hours are to be made up by the employees. e.g. extra shifts after the crisis.",2020-03-12,2020-03-13,NA,"Ecuador","ECU","EC","National",1,NA,NA,"Restriction and Regulation of Businesses","Non-Essential Commercial Businesses",NA,"This type of business  (""Non-Essential Commercial Businesses"") is closed/locked down","Ecuador",NA,NA,NA,NA,NA,"All Residents (Citizen Residents + Foreign Residents)",NA,NA,"Mandatory (Unspecified/Implied)","Ministry/Department of Health",53.3458477830085,52.1678901942076,51.1629168556473,161,"https://coronavirusecuador.com/acuerdos-ministeriales/",2020-03-31,2020-03-31 07:57:46
"40","R_3CPB6p6MPavSMlWAe","479011","new_entry","original",NA,NA,"On March 15th, Vice President Sonnenholzner of Ecuador announced that public areas such as gyms, cinemas, theaters, and other entertainment venues are subject to restrictions. The Yasuní National Park has also been closed to all tourists.",2020-03-15,2020-03-15,NA,"Ecuador","ECU","EC","National",1,NA,NA,"Restriction and Regulation of Businesses","All or unspecified non-essential businesses",NA,"This type of business  (""All or unspecified non-essential businesses"") is allowed to open with conditions","Ecuador",NA,NA,NA,NA,NA,"All Residents (Citizen Residents + Foreign Residents)",NA,NA,"Mandatory (Unspecified/Implied)","Police",53.4972231689807,52.63993380927,51.615692002145,161,"https://www.garda.com/crisis24/news-alerts/322931/ecuador-government-to-close-all-borders-due-to-covid-19-march-15-16-update-1",2020-09-23,2020-09-23 23:34:28
"41","R_20NbJ8rNgLKHqxkCl","2606503","new_entry","original",NA,NA,"Ecuador is prohibiting the visit to public and private cemeteries from October 30th to November 3rd, excluding mandatory burials, in hopes to prevent further transmission of COVID-19.",2020-10-22,2020-10-30,2020-11-03,"Ecuador","ECU","EC","National",1,NA,NA,"Restriction and Regulation of Businesses","Other Non-Essential Businesses",NA,"This type of business  (""Other Essential Businesses"") is closed/locked down","Ecuador",NA,NA,NA,NA,NA,"All Residents (Citizen Residents + Foreign Residents)",NA,NA,"Mandatory (Unspecified/Implied)","National Government",NA,NA,NA,NA,"https://www.gestionderiesgos.gob.ec/wp-content/uploads/2020/10/Resoluciones-22-de-octubre.pdf",2020-10-29,2020-10-29 06:39:23
"42","R_0obaSha5U5rEYStNA","4124119","new_entry","original",NA,NA,"Ecuador leaves it to the governmental institutions and schools which issues they see as urgent and which deadlines are to be extended.",2020-03-16,2020-03-16,NA,"Ecuador","ECU","EC","National",1,NA,NA,"Restriction and Regulation of Government Services",NA,NA,"This service is no longer provided by the government","Ecuador",NA,NA,NA,NA,NA,"All Residents (Citizen Residents + Foreign Residents)",NA,NA,"Voluntary/Recommended but No Penalties","Ministry/Department of Health",54.2542877286092,52.7200883503632,51.6233829596009,158,"https://coronavirusecuador.com/acuerdos-ministeriales/",2020-04-01,2020-04-01 08:16:48
"43","R_2uOMXJAssgkXc5eNA","8100425","new_entry","original",NA,NA,"Ecuador cuts the salaries of ministers and other government functionals up to 50%. Each ministry can decide if they stick to that law or not.",2020-04-13,2020-04-14,NA,"Ecuador","ECU","EC","National",1,NA,NA,"Restriction and Regulation of Government Services",NA,NA,"This service is no longer provided by the government","Ecuador",NA,NA,NA,NA,NA,"All Residents (Citizen Residents + Foreign Residents)",NA,NA,"Voluntary/Recommended but No Penalties","National Government,Ministry/Department of Health",54.1830490603711,53.0987227505328,51.9669371879328,102,"https://www.elcomercio.com/actualidad/funcion-reduccion-salarios-coronavirus-ecuador.html",2020-04-14,2020-04-14 08:55:57
"44","R_1pQ0pIsPodLv91TNA","6343385","new_entry","original",NA,NA,"Ecuador allows funerals but solely with the close family and without masses and services.",2020-03-16,2020-03-17,NA,"Ecuador","ECU","EC","National",1,NA,NA,"Restrictions of Mass Gatherings",NA,NA,"","Ecuador",NA,NA,NA,NA,NA,"All Residents (Citizen Residents + Foreign Residents)",NA,NA,"Mandatory with Fines","National Government",53.8317965867718,52.9116290477753,52.0643461343088,155,"https://coronavirusecuador.com/acuerdos-ministeriales/",2020-04-01,2020-04-01 08:12:38
"45","R_ZaC4L5ymWpmEw1PNA","0","update","original",NA,"Relaxing","The municipal government of Montevideo has reopened public beaches",2020-04-22,2020-04-22,NA,"Ecuador","ECU","EC",NA,1,NA,NA,"Restrictions of Mass Gatherings",NA,NA,"",NA,NA,NA,NA,NA,NA,"All Residents (Citizen Residents + Foreign Residents)",NA,NA,NA,NA,57.197852477934,53.117487765778,49.2475853694478,99,"https://www.elpais.com.uy/informacion/politica/lacalle-pou-pide-ministros-unidad-mensaje-preparan-retorno-estatales.html ; https://www.republica.com.uy/retiran-vallas-de-las-playas-de-montevideo-id762472/",2020-04-26,2020-04-26 02:48:30
