"","record_id","policy_id","entry_type","correct_type","update_type","update_level","description","date_announced","date_start","date_end","country","ISO_A3","ISO_A2","init_country_level","domestic_policy","province","city","type","type_sub_cat","type_text","institution_status","target_country","target_geog_level","target_region","target_province","target_city","target_other","target_who_what","target_direction","travel_mechanism","compliance","enforcer","index_high_est","index_med_est","index_low_est","index_country_rank","link","date_updated","recorded_date"
"32","R_eQC4wCxefC1xCApCc","8839521","new_entry","original",NA,NA,"The Ministry of Justice of Moldova donated 45,000 protective masks to the Chisinau Emergency Medicine Institute on March 19.",2020-03-19,2020-03-19,2020-03-19,"Moldova","MDA","MD","National",0,NA,NA,"Health Resources","Masks",NA,"","Moldova",NA,NA,NA,NA,NA,NA,NA,NA,"Mandatory (Unspecified/Implied)","National Government",54.9707667939732,52.9445073326114,51.0262218947545,152,"https://www.ipn.md/en/print/masks-made-at-penitentiary-donated-to-emergency-medicine-institute--7967_1072313.html",2020-05-15,2020-05-15 19:19:07
"33","R_1GQ69FxLDfktbzbCc","9732858","new_entry","original",NA,NA,"The National Medical Insurance Company in Moldova will provide 2,000,000 lei for the purchase of 640,000 medical gloves and 250,000 medical masks.",2020-03-19,2020-03-19,NA,"Moldova","MDA","MD","National",0,NA,NA,"Health Resources","Masks",NA,"","Moldova",NA,NA,NA,NA,NA,NA,NA,NA,"Mandatory (Unspecified/Implied)","Ministry/Department of Health",54.9707667939732,52.9445073326114,51.0262218947545,152,"https://stiri.md/article/social/cnam-va-aloca-2-000-000-de-lei-pentru-masti-si-manusi-medicale",2020-05-01,2020-05-01 13:09:57
"34","R_1GQ69FxLDfktbzbDb","9732858","new_entry","original",NA,NA,"The National Medical Insurance Company in Moldova will provide 2,000,000 lei for the purchase of 640,000 medical gloves and 250,000 medical masks.",2020-03-19,2020-03-19,NA,"Moldova","MDA","MD","National",0,NA,NA,"Health Resources","Personal Protective Equipment",NA,"","Moldova",NA,NA,NA,NA,NA,NA,NA,NA,"Mandatory (Unspecified/Implied)","Ministry/Department of Health",54.9707667939732,52.9445073326114,51.0262218947545,152,"https://stiri.md/article/social/cnam-va-aloca-2-000-000-de-lei-pentru-masti-si-manusi-medicale",2020-05-01,2020-05-01 13:09:57
"35","R_rcMlCuHNMWmTBZLEl","5590493","new_entry","original",NA,NA,"Moldova received on March 24 another 1,000 COVID-19 test kits from WHO.",2020-03-24,2020-03-24,2020-03-24,"Moldova","MDA","MD","National",0,NA,NA,"Health Resources","Test Kits",NA,"","Moldova",NA,NA,NA,NA,NA,NA,NA,NA,"Mandatory (Unspecified/Implied)","National Government",55.4682113641221,53.0028233770456,50.3553169863035,142,"https://www.ipn.md/en/print/who-offers-another-1000-test-kits-for-covid-19--7967_1072410.html",2020-05-15,2020-05-15 19:52:16
"36","R_0dr8sPqikfIWHfjCc","5673546","new_entry","original",NA,NA,"Doctors and medical assistants from ten districts in Moldova will receive masks, around 100,000 gloves and 760 liters of disinfectant from the Swiss Cooperation Office in the country on between March 25 and March 31.",2020-03-25,2020-03-25,2020-03-31,"Moldova","MDA","MD","Provincial",1,NA,NA,"Health Resources","Masks",NA,"","Moldova","One or more geographical or administrative units within one or more countries",NA,"Fale<U+0219>ti; Ungheni; <U+0218>tefan Voda; Cahul; Orhei; Criuleni; Taraclia; Vulcane<U+0219>ti; Edine<U+021B>; Briceni",NA,NA,"All Residents (Citizen Residents + Foreign Residents)",NA,"Not Applicable","Mandatory (Unspecified/Implied)","Ministry/Department of Health",55.3828738037772,52.9801768335421,50.050408090171,138,"https://www.ipn.md/en/print/health-centers-receive-donation-of-masks-gloves-and-disinfectants--7967_1072451.html",2020-05-15,2020-05-15 20:06:43
"37","R_0dr8sPqikfIWHfjDb","5673546","new_entry","original",NA,NA,"Doctors and medical assistants from ten districts in Moldova will receive masks, around 100,000 gloves and 760 liters of disinfectant from the Swiss Cooperation Office in the country on between March 25 and March 31.",2020-03-25,2020-03-25,2020-03-31,"Moldova","MDA","MD","Provincial",1,NA,NA,"Health Resources","Personal Protective Equipment",NA,"","Moldova","One or more geographical or administrative units within one or more countries",NA,"Fale<U+0219>ti; Ungheni; <U+0218>tefan Voda; Cahul; Orhei; Criuleni; Taraclia; Vulcane<U+0219>ti; Edine<U+021B>; Briceni",NA,NA,"All Residents (Citizen Residents + Foreign Residents)",NA,"Not Applicable","Mandatory (Unspecified/Implied)","Ministry/Department of Health",55.3828738037772,52.9801768335421,50.050408090171,138,"https://www.ipn.md/en/print/health-centers-receive-donation-of-masks-gloves-and-disinfectants--7967_1072451.html",2020-05-15,2020-05-15 20:06:43
"38","R_0dr8sPqikfIWHfjBh","5673546","new_entry","original",NA,NA,"Doctors and medical assistants from ten districts in Moldova will receive masks, around 100,000 gloves and 760 liters of disinfectant from the Swiss Cooperation Office in the country on between March 25 and March 31.",2020-03-25,2020-03-25,2020-03-31,"Moldova","MDA","MD","Provincial",1,NA,NA,"Health Resources","Hand Sanitizer",NA,"","Moldova","One or more geographical or administrative units within one or more countries",NA,"Fale<U+0219>ti; Ungheni; <U+0218>tefan Voda; Cahul; Orhei; Criuleni; Taraclia; Vulcane<U+0219>ti; Edine<U+021B>; Briceni",NA,NA,"All Residents (Citizen Residents + Foreign Residents)",NA,"Not Applicable","Mandatory (Unspecified/Implied)","Ministry/Department of Health",55.3828738037772,52.9801768335421,50.050408090171,138,"https://www.ipn.md/en/print/health-centers-receive-donation-of-masks-gloves-and-disinfectants--7967_1072451.html",2020-05-15,2020-05-15 20:06:43
"39","R_3ozKfYsGxHGbVmWDb","7129292","new_entry","original",NA,NA,"With a decree from March 28, the Moldovan Ministry of Finance will allocate 19.5 million lei to the Ministry of Health for procurement of respirators.",2020-03-28,2020-03-28,NA,"Moldova","MDA","MD","National",0,NA,NA,"Health Resources","Personal Protective Equipment",NA,"","Moldova",NA,NA,NA,NA,NA,NA,NA,NA,"Mandatory (Unspecified/Implied)","Ministry/Department of Health",55.8313190363267,53.0398106740251,49.9133702532145,127,"http://tvrmoldova.md/actualitate/ministerul-finantelor-va-aloca-peste-19-milioane-de-lei-pentru-procurarea-respiratoarelor/",2020-05-01,2020-05-01 14:03:02
"40","R_1P7VexBDCpKqC1HEl","5351803","new_entry","original",NA,NA,"Moldova will purchase 100,000 COVID-19 test kits from China on March 30.",2020-03-30,2020-03-30,2020-03-30,"Moldova","MDA","MD","National",0,NA,NA,"Health Resources","Test Kits",NA,"","China","One or more countries, but not all countries",NA,NA,NA,NA,"Health-Related Supplies","Inbound","Not Applicable","Mandatory (Unspecified/Implied)","National Government",55.5050068084412,53.1749720290493,49.5414375045311,128,"https://www.ipn.md/en/print/authorities-purchase-100000-covid-19-test-kits-from-china--7967_1072541.html",2020-05-15,2020-05-15 20:26:26
"41","R_xr4at4BYS5tGsaRDb","3320442","new_entry","original",NA,NA,"The Ministry of Finance in Moldova announced on March 31 to allocate 
the amount of 5.4 million lei, to the Ministry of Health for procuring protective coveralls.",2020-03-31,2020-03-31,NA,"Moldova","MDA","MD","National",0,NA,NA,"Health Resources","Personal Protective Equipment",NA,"","Moldova",NA,NA,NA,NA,NA,NA,NA,NA,"Mandatory (Unspecified/Implied)","Ministry/Department of Health",55.6419774573143,53.2162726042223,49.0332202461292,128,"http://tvrmoldova.md/economic/ministerul-finantelor-va-aloca-5-8-milioane-de-lei-pentru-procurarea-combinezoanelor-de-protectie-si-acordarea-indemnizatiilor-unice-pentru-cadre-medicale/",2020-05-01,2020-05-01 14:07:21
"42","R_1eRxVPSA8FIYjwBEj","7416239","new_entry","original",NA,NA,"The Chisinau, Moldova, COVID-19 Center in the Exhibitions Center “Moldexpo” will become functional on April 3. At the first stage, this will have a capacity of 300-400 places.",2020-04-02,2020-04-03,NA,"Moldova","MDA","MD","National",1,NA,NA,"Health Resources","Temporary Medical Centers",NA,"","Moldova","One or more geographical or administrative units within one or more countries",NA,NA,"Chisinau",NA,"All Residents (Citizen Residents + Foreign Residents)",NA,"Not Applicable","Mandatory (Unspecified/Implied)","National Government",55.4368509610829,53.3939588744472,49.9052695158782,128,"https://www.ipn.md/en/print/sorting-center-at-moldexpo-to-become-functional-april-3--7967_1072641.html",2020-05-16,2020-05-16 08:53:21
"43","R_3hAAkhsK9RFQgfMEl","2880891","new_entry","original",NA,NA,"On April 3, the Exceptional Situations Commission in Moldova took the decision to purchase tests for COVID-19 infection, worth 35.5 million lei, money allocated by the National Medical Insurance Company.",2020-04-04,2020-04-04,NA,"Moldova","MDA","MD","National",0,NA,NA,"Health Resources","Test Kits",NA,"","Moldova",NA,NA,NA,NA,NA,NA,NA,NA,"Mandatory (Unspecified/Implied)","Ministry/Department of Health",55.898371578964,53.3303554468735,49.9841102662969,125,"https://www.jurnal.md/ro/news/4ac790c919083973/dupa-12-decese-si-752-de-infectati-cnam-achizitioneaza-in-regim-de-urgenta-teste-pentru-depistarea-covid-19.html",2020-05-01,2020-05-01 14:22:22
"44","R_2DMmaQ36tzRQJ7ANA","5560178","new_entry","original",NA,NA,"The authorities in Moldova decided on April 6 to massively test all the doctors in Stefan-Voda and Soroca. The doctors in the rest of the regions, from all the medical institutions, will be tested later, gradually.",2020-04-06,2020-04-06,NA,"Moldova","MDA","MD","National",1,NA,NA,"Health Testing",NA,NA,"","Moldova","One or more geographical or administrative units within one or more countries",NA,NA,"Stefan-Voda; Soroca",NA,"All Residents (Citizen Residents + Foreign Residents)",NA,"Not Applicable","Mandatory (Unspecified/Implied)","National Government,Municipal Government",55.829315346944,53.3256952615839,49.9711601575187,125,"https://www.ipn.md/en/print/persons-with-slight-forms-of-covid-19-will-no-longer-be-hospitalized--7967_1072706.html",2020-05-16,2020-05-16 09:14:51
"45","R_22lT2PWCSOGLN2nCl","4828392","new_entry","original",NA,NA,"Each housing stock manager in Chisinau, Moldova, is obliged to sanitize balustrades, stairs and elevators in apartments twice a day and playgrounds each morning from March 13. The workers are issued with protective face masks and gloves.",2020-03-13,2020-03-13,NA,"Moldova","MDA","MD","Municipal",0,"Chisinau Municipality","Chisinau","Hygiene","Other Areas Hygiene Measures Applied",NA,"",NA,NA,NA,"Chisinau Municipality",NA,NA,NA,NA,NA,"Mandatory (Unspecified/Implied)","Municipal Government",53.2797282184679,52.1188710918156,50.2182361086453,157,"https://www.ipn.md/en/print/disinfection-works-performed-in-blocks-and-on-playgrounds-in-chisinau--7967_1072165.html",2020-05-15,2020-05-15 16:56:31
"46","R_1liASR6RsdL1UgLNA","6407366","new_entry","original",NA,NA,"The managers and owners of passenger transportation companies in Moldiva are to ensure from March 13 the cleaning and disinfection of the motor vehicles after each route.",2020-03-13,2020-03-13,NA,"Moldova","MDA","MD","National",0,NA,NA,"Hygiene",NA,NA,"",NA,NA,NA,NA,NA,NA,NA,NA,NA,"Mandatory (Unspecified/Implied)","National Government",53.2797282184679,52.1188710918156,50.2182361086453,157,"https://www.ipn.md/en/print/covid-19-nationwide-red-alert--7967_1072167.html",2020-05-15,2020-05-15 17:09:40
"47","R_2wsfUs55U4vou5jBr","4067132","new_entry","original",NA,NA,"The new parliamentary elections that will take place in Hince<U+0219>ti, Moldova, on March 15 will be held in conditions of increased protection and sanitation. Antiseptics will be available in polling stations and the members of electoral bureaus will wear medical face masks. The number of voters inside a polling station will be limited.",2020-03-14,2020-03-15,2020-03-15,"Moldova","MDA","MD","Municipal",0,"Hincesti","Hincesti","Hygiene","Hygiene measures for public areas",NA,"",NA,NA,NA,"Hincesti",NA,NA,NA,NA,NA,"Mandatory (Unspecified/Implied)","Municipal Government",54.294968458087,52.7337705714177,51.5657668863039,168,"https://www.ipn.md/en/print/elections-in-hancesti-pens-will-be-disinfected-after-each-voter-while-surfaces-o--8008_1072179.html",2020-05-15,2020-05-15 17:19:48
"48","R_1dGKPuRTsF2mpviNA","4284073","new_entry","original",NA,NA,"The Chisinau City Hall in Moldova said that as of March 20, hand sanitizer dispensers will be available in all the trolleybuses running on routes in the capital city.",2020-03-20,2020-03-20,NA,"Moldova","MDA","MD","Municipal",0,"Chisinau Municipality","Chisinau","Hygiene",NA,NA,"",NA,NA,NA,"Chisinau Municipality",NA,NA,NA,NA,NA,"Mandatory (Unspecified/Implied)","Municipal Government",55.0382765617875,53.0743328056522,51.0518413804496,154,"https://www.ipn.md/en/print/public-transport-in-chisinau-outfitted-with-hand-sanitizer-dispensers--7967_1072320.html",2020-05-15,2020-05-15 19:22:20
"49","R_C3vlO5ZEkudNRgRNA","4896209","new_entry","original",NA,NA,"Transnistria, Moldova, bans from March 17 the entrance of non-residents of the region, except for diplomats and those who transport food products and other essentials.",2020-03-17,2020-03-17,2020-04-05,"Moldova","MDA","MD","Provincial",1,"Transnistria",NA,"Internal Border Restrictions",NA,NA,"","Moldova","One or more countries, but not all countries",NA,"Transnistria",NA,NA,"All Residents (Citizen Residents + Foreign Residents)",NA,NA,"Mandatory (Unspecified/Implied)","Provincial/State Government",54.6459974338456,53.0804162844046,51.7670127544444,165,"https://www.ipn.md/en/print/state-of-emergency-amid-covid-19-pandemic-declared-in-transnistria--7967_1072252.html",2020-05-15,2020-05-15 18:57:37
"50","R_1HdYz1VXacC0msqNA","7562068","new_entry","original",NA,NA,"From March 17, residents of the Transnistrian region in Moldova will be able to leave after filling out a mandatory form.",2020-03-17,2020-03-17,2020-04-05,"Moldova","MDA","MD","Provincial",1,"Transnistria",NA,"Internal Border Restrictions",NA,NA,"","Moldova","One or more countries, but not all countries",NA,"Transnistria",NA,NA,"All Residents (Citizen Residents + Foreign Residents)",NA,NA,"Mandatory (Unspecified/Implied)","Provincial/State Government",54.6459974338456,53.0804162844046,51.7670127544444,165,"https://www.ipn.md/en/print/state-of-emergency-amid-covid-19-pandemic-declared-in-transnistria--7967_1072252.html",2020-05-15,2020-05-15 19:00:44
"51","R_1HhRzOPur6EAZymNA","4020694","new_entry","original",NA,NA,"On March 21 and 22, the public transport in the municipality of Chisinau, Moldova will run on routes from 7am until 10am and then from 4pm until 7:30pm only.",2020-03-21,2020-03-21,2020-03-22,"Moldova","MDA","MD","Municipal",1,"Chisinau Municipality","Chisinau","Internal Border Restrictions",NA,NA,"","Moldova","One or more geographical or administrative units within one or more countries",NA,"Chisinau Municipality","Chisinau",NA,"All Residents (Citizen Residents + Foreign Residents)",NA,NA,"Mandatory (Unspecified/Implied)","Municipal Government",55.2127386238189,53.089880783901,50.9496249008773,153,"https://www.ipn.md/en/print/public-transport-in-chisinau-limited-on-weekend--7967_1072347.html",2020-05-15,2020-05-15 19:28:19
"52","R_2BgHGiph80Paf6aNA","4461628","new_entry","original",NA,NA,"The transit transport in Chisinau, Moldova, has a new work program as of March 23. The trolleybuses and buses will run from 5:30am until 10:00am and then from 4:00pm until 8:00pm.",2020-03-23,2020-03-23,NA,"Moldova","MDA","MD","Municipal",1,"Chisinau Municipality","Chisinau","Internal Border Restrictions",NA,NA,"","Moldova","One or more geographical or administrative units within one or more countries",NA,"Chisinau Municipality","Chisinau",NA,"All Residents (Citizen Residents + Foreign Residents)",NA,NA,"Mandatory (Unspecified/Implied)","Municipal Government",55.8482177763301,53.1038488959799,50.1784382668369,146,"https://www.ipn.md/en/print/public-transport-in-chisinau-will-run-according-to-new-program--7967_1072366.html",2020-05-15,2020-05-15 19:43:42
"53","R_1i3xUvnEaUS0f4DNA","1364959","new_entry","original",NA,NA,"The Commission for Exceptional Situations in Moldova decided that public transport in the municipalities of Chisinau and Bal<U+021B>i will not run on April 11 and 12.",2020-04-09,2020-04-11,2020-04-12,"Moldova","MDA","MD","National",1,NA,NA,"Internal Border Restrictions",NA,NA,"","Moldova","One or more geographical or administrative units within one or more countries",NA,NA,"Chisinau; Bal<U+021B>i",NA,"All Residents (Citizen Residents + Foreign Residents)",NA,NA,"Mandatory (Unspecified/Implied)","Municipal Government",55.5380136130316,53.5403851115486,50.9149797156094,129,"https://www.ipn.md/en/print/public-transport-in-chisinau-and-balti-suspended-on-weekend--7967_1072783.html",2020-05-16,2020-05-16 09:23:55
"54","R_OpWSxrGT9DiqMPDNA","9163497","new_entry","original",NA,NA,"From 8 am on April 14th, Moldova placed the town of Glodeni into quarantine. This is on top of quarantines placed on Soroca municipality, Boghiceni village of Hânce<U+0219>ti district, <U+0218>tefan Voda town, Carahasani and Talmaza villages of <U+0218>tefan Voda district.",2020-04-13,2020-04-14,NA,"Moldova","MDA","MD","National",1,NA,NA,"Internal Border Restrictions",NA,NA,"","Moldova","One or more geographical or administrative units within one or more countries",NA,NA,"Glodeni; Karakhasani; Soroca; Stefan Voda; Talmaza",NA,"All Residents (Citizen Residents + Foreign Residents)",NA,NA,"Mandatory (Unspecified/Implied)","National Government,Municipal Government,Police",54.371019133726,53.4522692368092,52.4209888941118,117,"https://www.ipn.md/en/glodeni-to-be-in-quarantine-from-april-14-7967_1072865.html",2020-04-25,2020-04-25 17:20:44
"55","R_2awwRpPDoQYgFbREe","5176689","new_entry","correction",NA,NA,"The town Sângerei in Moldova will be in lockdown from March 21 until April 1.",2020-03-21,2020-03-21,2020-04-01,"Moldova","MDA","MD","Municipal",0,"Singerei","Singerei","Lockdown",NA,NA,"","Moldova",NA,NA,"Singerei","Singerei",NA,NA,NA,NA,"Mandatory (Unspecified/Implied)","Military,Municipal Government,Police",55.2127386238189,53.089880783901,50.9496249008773,153,"NA",2020-07-22,2020-07-22 14:03:15
"56","R_umPfTcvpN1Y6NXPNA","8442614","new_entry","original",NA,NA,"Access through the town of Sângerei, Moldova, is restricted between March 21 and April 1. Only the persons who need to make purchases and need the services of the Public Services Agency are an exception.",2020-03-21,2020-03-21,2020-04-01,"Moldova","MDA","MD","Municipal",0,"Singerei","Singerei","Lockdown",NA,NA,"",NA,NA,NA,"Singerei",NA,NA,NA,NA,NA,"Mandatory (Unspecified/Implied)","Military,Municipal Government,Police",55.2127386238189,53.089880783901,50.9496249008773,153,"https://www.ipn.md/en/print/sangerei-town-placed-under-quarantine--7967_1072353.html",2020-05-15,2020-05-15 19:36:57
"57","R_3D7SkN8sLMH9QucNA","1886789","new_entry","original",NA,NA,"The government of the Transnistria region in Moldova have suspended the operation of all public transport beginning March 24.",2020-03-23,2020-03-24,2020-06-27,"Moldova","MDA","MD","Provincial",0,"Transnistria",NA,"Lockdown",NA,NA,"","Moldova",NA,NA,"Transnistria",NA,NA,NA,NA,NA,"Mandatory (Unspecified/Implied)","New (COVID-19 specific) Task Force",55.4682113641221,53.0028233770456,50.3553169863035,142,"https://novostipmr.com/ru/news/20-03-23/obshchestvennyy-transport-vremenno-prekrashchaet-svoyu-rabotu",2020-08-12,2020-08-12 08:57:42
"58","R_2TMGIOCxQef6dXoNA","1886789","update","original","End of Policy",NA,"The government of the Transnistria region in Moldova have suspended the operation of all public transport beginning March 24. 

As part of the gradual easing of lockdown restrictions, public transport will be permitted to operate freely within the Transnistrian region beginning June 27th.",2020-03-23,2020-03-24,2020-06-27,"Moldova","MDA","MD","Provincial",0,"Transnistria",NA,"Lockdown",NA,NA,"","Moldova",NA,NA,"Transnistria",NA,NA,NA,NA,NA,"Mandatory (Unspecified/Implied)","New (COVID-19 specific) Task Force",55.4682113641221,53.0028233770456,50.3553169863035,142,"NA",2020-08-20,2020-08-20 06:52:57
"59","R_3EtHVkIaKd2l60GEe","8327559","new_entry","correction",NA,NA,"From March 25 it is forbidden to persons over 63 years of age in Moldova to be away from home and in public spaces without urgent need except for medicine and grocery shopping.",2020-03-23,2020-03-25,NA,"Moldova","MDA","MD","National",0,NA,NA,"Lockdown",NA,NA,"","Moldova",NA,NA,NA,NA,NA,"All Residents (Citizen Residents +Foreign Residents)",NA,NA,"Mandatory (Unspecified/Implied)","National Government,Ministry/Department of Health,Provincial/State Government,Municipal Government,Police",55.3828738037772,52.9801768335421,50.050408090171,138,"https://www.moldova.org/in-r-moldova-se-limiteaza-accesul-in-locurile-publice-persoanele-de-peste-63-ani-obligate-sa-stea-acasa/",2020-07-14,2020-07-14 13:02:08
"60","R_2QzHIuubqaEfgqNNA","1164047","new_entry","original",NA,NA,"The clients and employees of hypermarkets, supermarkets and quarter stores in Chisinau, Moldova, will have their body temperature checked on entry from April 6. If the temperature is higher than 37°C, the person will be banned access to the store.",2020-04-06,2020-04-06,NA,"Moldova","MDA","MD","Municipal",0,"Chisinau Municipality","Chisinau","Other Policy Not Listed Above",NA,"All customers and employees of supermarkets will have their temperature checked before they can enter the shop.","","Moldova",NA,NA,"Chisinau Municipality","Chisinau",NA,NA,NA,NA,"Mandatory (Unspecified/Implied)","Municipal Government",55.829315346944,53.3256952615839,49.9711601575187,125,"https://www.ipn.md/en/those-with-temperature-higher-than-370c-will-not-be-7967_1072702.html",2020-05-16,2020-05-16 09:11:09
"61","R_3LaO7AqfjkfndZjNA","5763558","new_entry","original",NA,NA,"In Moldova on March 20, a new on-line platform allowing real-time monitoring of COVID-19 cases in the Republic of Moldova was launched by the Ministry of Health, Labour and Social Protection.",2020-03-20,2020-03-20,NA,"Moldova","MDA","MD","National",0,NA,NA,"Public Awareness Measures",NA,NA,"",NA,NA,NA,NA,NA,NA,NA,NA,NA,"Voluntary/Recommended but No Penalties","Ministry/Department of Health",55.0382765617875,53.0743328056522,51.0518413804496,154,"https://msmps.gov.md/en/node/11175",2020-04-01,2020-04-01 17:39:45
"62","R_2QEUP9MFrsOJrq3Am","5942469","new_entry","original",NA,NA,"A platform was released for reporting violations related to the state of emergency in Moldova as of April 3. It contains free standard forms that ensure juridical guidance for those who want to inform the responsible authorities about particular abuses and web accessible resources concerning organizations who provide COVID-19 related assistance.",2020-04-03,2020-04-03,NA,"Moldova","MDA","MD","National",0,NA,NA,"Public Awareness Measures","Both Disseminating and Gathering information related to COVID-19",NA,"",NA,NA,NA,NA,NA,NA,NA,NA,NA,"Mandatory (Unspecified/Implied)","National Government",55.4368509610829,53.3939588744472,49.9052695158782,128,"https://www.ipn.md/en/print/citizens-can-report-violations-related-to-state-of-emergency-on-wwwmonitormd--7967_1072669.html",2020-05-16,2020-05-16 09:03:45
"63","R_2fy21MJBYZ7bOZcEe","2150579","new_entry","correction","End of Policy",NA,"The health authorities of Moldova called on the population on March 10 who returned from countries affected by COVID-19 to remain at home for 14 days and not to go to health facilities, if they do not have health problems.",2020-03-10,2020-03-10,2020-05-27,"Moldova","MDA","MD","National",0,NA,NA,"Quarantine","Self-Quarantine (i.e. quarantine at home)",NA,"","Moldova",NA,NA,NA,NA,NA,"All Travelers (Citizen Travelers + Foreign Travelers )",NA,NA,"Voluntary/Recommended but No Penalties","Ministry/Department of Health",52.8745172807267,51.4694118383068,50.0655951202504,156,"https://www.ipn.md/en/two-more-cases-of-covid-19-confirmed-by-lab-tests-7967_1072079.html",2020-07-12,2020-07-12 12:38:58
"64","R_AKSSHrwhnUinXIREe","2150579","update","original","End of Policy",NA,"The health authorities of Moldova called on the population on March 10 who returned from countries affected by COVID-19 to remain at home for 14 days and not to go to health facilities, if they do not have health problems. From May 27, this is no longer valid for people transporting goods, students, and people traveling for professional or health interests.",2020-03-10,2020-03-10,2020-05-27,"Moldova","MDA","MD","National",0,NA,NA,"Quarantine","Self-Quarantine (i.e. quarantine at home)",NA,"","Moldova",NA,NA,NA,NA,NA,NA,NA,NA,"Voluntary/Recommended but No Penalties","Ministry/Department of Health",52.8745172807267,51.4694118383068,50.0655951202504,156,"NA",2020-05-27,2020-05-27 09:24:32
"65","R_3sdlIBzwB9rb9euEe","3788904","new_entry","correction","Change of Policy","Strengthening","The Moldova Border Police will step up control measures at border crossing points and will identify mechanisms for immediately placing the persons who return from areas affected by COVID-19 in quarantine from March 11.",2020-03-11,2020-03-11,NA,"Moldova","MDA","MD","National",0,NA,NA,"Quarantine","Self-Quarantine (i.e. quarantine at home)",NA,"","All countries","All countries",NA,NA,NA,NA,"All Travelers (Citizen Travelers + Foreign Travelers )","Inbound","Land Border","Mandatory (Unspecified/Implied)","National Government,Police",52.8035795203018,51.4591188778672,50.4033218251476,152,"https://www.ipn.md/en/all-persons-who-return-from-infection-risk-zones-could-be-7967_1072099.html",2020-07-13,2020-07-13 22:12:47
