"","record_id","policy_id","entry_type","correct_type","update_type","update_level","description","date_announced","date_start","date_end","country","ISO_A3","ISO_A2","init_country_level","domestic_policy","province","city","type","type_sub_cat","type_text","school_status","target_country","target_geog_level","target_region","target_province","target_city","target_other","target_who_what","target_direction","travel_mechanism","compliance","enforcer","index_high_est","index_med_est","index_low_est","index_country_rank","link","date_updated","recorded_date"
"1","R_2rgUnpUXevc9frjDo",4673259,"new_entry","correction","NA",NA,"Classes in all levels in Metro Manila will be suspended from Tuesday, March 10, to Saturday, March 14, President Rodrigo Duterte announced Monday night, March 9.","2020-03-09","2020-03-10",2020-03-14,"Philippines","PHL","PH","National",0,NA,NA,"Closure and Regulation of Schools","Primary Schools (generally for children ages 10 and below)",NA,"","Philippines",NA,NA,NA,NA,NA,"All Residents (Citizen Residents + Foreign Residents)",NA,NA,"Mandatory (Unspecified/Implied)","National Government",51.1558705955209,49.5657404008057,47.453757788194,70,"https://www.rappler.com/nation/253912-walang-pasok-duterte-declares-class-suspensions-metro-manila-coronavirus-threat-march-10-14-2020","2020-08-06","2020-08-06 09:32:30"
"2","R_2rgUnpUXevc9frjEm",4673259,"new_entry","correction","NA",NA,"Classes in all levels in Metro Manila will be suspended from Tuesday, March 10, to Saturday, March 14, President Rodrigo Duterte announced Monday night, March 9.","2020-03-09","2020-03-10",2020-03-14,"Philippines","PHL","PH","National",0,NA,NA,"Closure and Regulation of Schools","Secondary Schools (generally for children ages 10 to 18)",NA,"","Philippines",NA,NA,NA,NA,NA,"All Residents (Citizen Residents + Foreign Residents)",NA,NA,"Mandatory (Unspecified/Implied)","National Government",51.1558705955209,49.5657404008057,47.453757788194,70,"https://www.rappler.com/nation/253912-walang-pasok-duterte-declares-class-suspensions-metro-manila-coronavirus-threat-march-10-14-2020","2020-08-06","2020-08-06 09:32:30"
"3","R_3gNSojc1ofbBNxYDo",7956164,"new_entry","original","NA",NA,"Duterte suspends classes in Metro Manila until April 12. (announced on Mar. 12 and effective on Mar. 15)","2020-03-12","2020-03-15",2020-04-12,"Philippines","PHL","PH","National",1,NA,NA,"Closure and Regulation of Schools","Primary Schools (generally for children ages 10 and below)",NA,"Primary Schools closed/locked down","Philippines",NA,NA,NA,NA,NA,"All Residents (Citizen Residents + Foreign Residents)",NA,NA,"Mandatory (Unspecified/Implied)","National Government",52.7142490904114,51.5915727123289,50.4636941339325,123,"https://www.rappler.com/nation/254278-duterte-suspends-classes-government-offices-metro-manila-until-april-12-2020-coronavirus-threat","2020-04-04","2020-04-04 03:54:31"
"4","R_3gNSojc1ofbBNxYEm",7956164,"new_entry","original","NA",NA,"Duterte suspends classes in Metro Manila until April 12. (announced on Mar. 12 and effective on Mar. 15)","2020-03-12","2020-03-15",2020-04-12,"Philippines","PHL","PH","National",1,NA,NA,"Closure and Regulation of Schools","Secondary Schools (generally for children ages 10 to 18)",NA,"Secondary Schools closed/locked down","Philippines",NA,NA,NA,NA,NA,"All Residents (Citizen Residents + Foreign Residents)",NA,NA,"Mandatory (Unspecified/Implied)","National Government",52.7142490904114,51.5915727123289,50.4636941339325,123,"https://www.rappler.com/nation/254278-duterte-suspends-classes-government-offices-metro-manila-until-april-12-2020-coronavirus-threat","2020-04-04","2020-04-04 03:54:31"
"5","R_33y9MXiHU4QIxn7En",2464738,"new_entry","original","NA",NA,"The Philippines Bacolod City also ordered the implementation of a curfew here from 10 p.m. to 4 a.m. (announced and effective on Mar. 17)","2020-03-17","2020-03-17",2020-04-14,"Philippines","PHL","PH","Municipal",1,NA,"Bacolod City","Curfew",NA,NA,"","Philippines",NA,NA,NA,"Bacolod City",NA,"All Residents (Citizen Residents + Foreign Residents)",NA,NA,"Mandatory (Unspecified/Implied)","Provincial/State Government,Police",54.1497487764356,51.6219461234824,50.2634087114793,102,"https://dailyguardian.com.ph/bacolod-on-lockdown-curfew-imposed/","2020-04-03","2020-04-03 09:14:06"
"6","R_Ulq8qllBy51QAp3En",2464738,"update","original","NA",NA,"The Philippines Bacolod City Mayor Evelio Leonardia, in a late afternoon news conference at the Government Center here, announced that he had signed Executive Order No. 26 that places the city under an Enhanced Community Quarantine from 30 March to 14 April 2020. A 24-hour curfew will be observed by the general public, except for identified holders of Home Quarantine Pass who will be allowed to leave for provisions from 4 am to 10 pm.","2020-03-27","2020-03-27",2020-04-14,"Philippines","PHL","PH","Municipal",1,NA,"Bacolod City","Curfew",NA,NA,"","Philippines","A geographical or administrative unit within a country",NA,NA,"Bacolod City",NA,"All Residents (Citizen Residents + Foreign Residents)","Inbound","Not Applicable","Mandatory with Legal Penalties (Jail Time)","Municipal Government,Police",55.7409460040674,52.3273498151032,49.0330054833909,88,"http://www.dnx.news/covid19/martial-law-by-necessity-bacolod-goes-under-enhanced-community-quarantine/","2020-04-03","2020-04-03 09:22:43"
"7","R_27PBK1slVALj2j5En",2092835,"new_entry","original","NA",NA,"The President of the Philippines declares a state of """"Public Health Emergency"""".","2020-03-08","2020-03-08",NA,"Philippines","PHL","PH","National",1,NA,NA,"Declaration of Emergency",NA,NA,"","Philippines",NA,NA,NA,NA,NA,"All Residents (Citizen Residents + Foreign Residents)",NA,NA,"Mandatory (Unspecified/Implied)","National Government,Ministry/Department of Health,Military,Police",50.5684831173235,49.1417398470424,47.188863601297,58,"https://www.officialgazette.gov.ph/downloads/2020/03mar/20200308-PROC-922-RRD.pdf","2020-04-03","2020-04-03 09:37:28"
"8","R_2ANciNWXudw1GtVEn",6610835,"new_entry","original","NA",NA,"The President of the Philippines declares a state of calamity on March 16.","2020-03-16","2020-03-16",2020-09-15,"Philippines","PHL","PH","National",1,NA,NA,"Declaration of Emergency",NA,NA,"","Philippines",NA,NA,NA,NA,NA,"All Residents (Citizen Residents + Foreign Residents)",NA,NA,"Mandatory (Unspecified/Implied)","National Government,Ministry/Department of Health,Military,Police",53.4736781298117,51.6761395767841,50.2464583587358,112,"https://www.officialgazette.gov.ph/downloads/2020/03mar/20200316-PROC-929-RRD.pdf","2020-04-03","2020-04-03 09:40:44"
"9","R_3M502mcFqYvy3aSFg",8290078,"new_entry","original","NA",NA,"The Philippines suspends visa issuance for travelers from Hubei Province, China over coronavirus scare. (announced and effective on Jan. 28)","2020-01-28","2020-01-28",NA,"Philippines","PHL","PH","National",0,NA,NA,"External Border Restrictions","Visa extensions (e.g. visa validity extended)",NA,"","China","A geographical or administrative unit within a country",NA,"Hubei Province",NA,NA,"Foreign Travelers","Inbound","All kinds of transport","Mandatory (Unspecified/Implied)","Other (Please specify in the text box)",49.4946963359157,46.9052640679352,43.8953077248373,51,"https://www.rappler.com/nation/250465-philippines-suspends-visa-issuance-travelers-hubei-china-coronavirus-scare","2020-04-06","2020-04-06 03:39:25"
"10","R_qVCd3kfdxFCZrARFg",244664,"new_entry","original","NA",NA,"The Philippine Foreign Service Posts are temporarily suspending the issuance of visas, effective immediately, to the following:

1) Foreign nationals directly coming from China and its Special Administrative Regions; and
2) Foreign nationals, who, within fourteen (14) days immediately preceding arrival in the Philippines, have been to China, and its Special Administrative Regions.","2020-02-02","2020-02-02",NA,"Philippines","PHL","PH","National",0,NA,NA,"External Border Restrictions","Visa extensions (e.g. visa validity extended)",NA,"","China,Hong Kong,Macau","One or more countries, but not all countries",NA,NA,NA,NA,"Foreign Travelers","Inbound","All kinds of transport","Mandatory (Unspecified/Implied)","Other (Please specify in the text box)",49.3497147392958,47.1995841341134,44.2000619123186,57,"https://dfa.gov.ph/dfa-news/statements-and-advisoriesupdate/25819-public-advisory-on-the-temporary-suspension-of-visa-issuance-to-travelers-from-china-and-its-special-administrative-regions","2020-04-06","2020-04-06 03:43:26"
"11","R_3R7Rem2AyQcfsaQFg",4747954,"new_entry",NA,"NA",NA,"The Philippine Department of Foreign Affairs: (announced and effective on March 3)

- Temporary travel restriction for all Filipinos traveling into North Gyeongsang Province (including Daegu City and Cheongdo County) of South Korea.

- All Filipinos going to South Korea (with the exception of North Gyeongsang Province including Daegu City and Cheongdo County) are allowed to proceed with their journey provided that they shall execute and sign a declaration signifying their knowledge and understanding of the risks involved in proceeding with their trip. All travelers shall likewise be handed out a health advisory pamphlet upon departure.

- Overseas Filipino Workers (OFWs), students studying in South Korea, and those with Permanent Resident status are not restricted to travel into South Korea.

- OFWs (whether returning or newly-hired) as well as dependents of permanent residents are allowed to return to South Korea but they must also execute a Declaration signifying their knowledge and understanding of the risks involved upon their return to the country.","2020-03-03","2020-03-03",NA,"Philippines","PHL","PH","National",0,NA,NA,"External Border Restrictions","Visa extensions (e.g. visa validity extended)",NA,"","South Korea","A geographical or administrative unit within a country",NA,"North Gyeongsang Province (including Daegu City and Cheongdo County)",NA,NA,"Citizen Residents","Outbound","All kinds of transport","Voluntary/Recommended but No Penalties","Other (Please specify in the text box)",51.0766353345121,48.9302436740947,44.8854702250057,70,"https://dfa.gov.ph/dfa-news/statements-and-advisoriesupdate/26134-travel-advisory-restrictions-to-travelers-to-and-from-south-korea-due-to-covid-20","2020-04-08","2020-04-08 14:07:53"
"12","R_33auPJeE4Sdhr5yFg",7308848,"new_entry","correction","NA",NA,"The Philippine Department of Foreign Affairs: (announced and effective on March 3)

- Temporary ban of entry into the Philippines of any person coming from the North Gyeongsang Province (including Daegu City and Cheongdo County) of South Korea.

- Temporary ban of entry into the Philippines of any person who has been to the North Gyeongsang Province (including Daegu City and Cheongdo County) of South Korea within 14 days immediately preceding their arrival in the Philippines.

Filipino citizens, including their foreign spouses and children, holders of Permanent Resident Visas, and holders of Diplomatic Visas issued by the Philippine Government are exempted from this temporary travel ban but must follow the health protocols of the Department of Health.","2020-03-03","2020-03-03",NA,"Philippines","PHL","PH","National",0,NA,NA,"External Border Restrictions","Visa extensions (e.g. visa validity extended)",NA,"","South Korea","A geographical or administrative unit within a country",NA,"North Gyeongsang Province (including Daegu City and Cheongdo County)",NA,NA,"Foreign Travelers","Inbound","All kinds of transport","Mandatory with Exceptions (Please list exceptions in the text entry)","Ministry/Department of Health,Other (Please specify in the text box)",51.0766353345121,48.9302436740947,44.8854702250057,70,"https://dfa.gov.ph/dfa-news/statements-and-advisoriesupdate/26134-travel-advisory-restrictions-to-travelers-to-and-from-south-korea-due-to-covid-20","2020-06-14","2020-06-14 15:18:37"
"13","R_1l3Tg1sdoal3u6lFg",8048366,"new_entry","original","NA",NA,"Foreign nationals are temporarily barred anew from entering the country after the Department of Foreign Affairs (DFA) suspended its issuance of visas in all foreign service posts all over the world. (announced on Mar. 20 and effective on Mar. 22)

Only OFWs (overseas Filipino workers), repatriating Filipinos, their foreign spouses and children (provided that the foreign spouse and children are traveling with the Filipino national), foreign government and international organization officials accredited to the Philippines, will be allowed to enter the country.","2020-03-20","2020-03-22",NA,"Philippines","PHL","PH","National",0,NA,NA,"External Border Restrictions","Visa extensions (e.g. visa validity extended)",NA,"","All countries","All countries",NA,NA,NA,NA,"Other","Inbound","All kinds of transport","Mandatory (Unspecified/Implied),Mandatory with Exceptions (Please list exceptions in the text entry)","Other (Please specify in the text box)",53.1889122448393,52.0513644055667,50.9726782412548,93,"https://www.pna.gov.ph/articles/1097273","2020-04-03","2020-04-03 17:41:59"
"14","R_3rGNwnwe2c0eSFQEn",5704459,"new_entry","original","NA",NA,"All Ninoy Aquino International Airport (NAIA) terminals have implemented thermal scanning. (announced on Mar. 12)","2020-03-12","2020-03-12",NA,"Philippines","PHL","PH","National",0,NA,NA,"Health Monitoring",NA,NA,"","Bolivia","One or more countries, but not all countries",NA,NA,NA,NA,"All (Travelers + Residents)","Inbound/Outbound","Flights","Mandatory (Unspecified/Implied)","Other (Please specify in the text box)",51.1720548982146,49.9582041050724,48.0226133625142,77,"https://www.pna.gov.ph/articles/1096387","2020-04-04","2020-04-04 04:18:10"
"15","R_1OjhhK46SbWHOWkCx",1640181,"new_entry","original","NA",NA,"The Philippine Navy (PN) is providing ample assets and personnel to aid to its Coast Guard counterparts, ensuring that there would be unauthorized water travel while the 30-day enhanced community quarantine in Luzon is in effect, an official said on Sunday (Mar. 22).","2020-03-22","2020-03-23",2020-04-12,"Philippines","PHL","PH","National",1,NA,NA,"Health Resources","Other Health Infrastructure",NA,"","Philippines","A geographical or administrative unit within a country",NA,"Luzon Area",NA,NA,"All Residents (Citizen Residents + Foreign Residents)","Inbound","Not Applicable","Voluntary/Recommended but No Penalties","Military,Other (Please specify in the text box)",54.0683205903511,52.0024128228163,50.5548020538182,84,"https://www.pna.gov.ph/articles/1097444","2020-04-03","2020-04-03 17:06:55"
"16","R_ahkJ5w4ses0jCPnCx",4113279,"new_entry","original","NA",NA,"The Philippines Department of Health eyes more community quarantine facilities.","2020-03-25","2020-03-25",NA,"Philippines","PHL","PH","National",1,NA,NA,"Health Resources","Other Health Infrastructure",NA,"","Philippines","One or more countries, but not all countries",NA,NA,NA,NA,"All Residents (Citizen Residents + Foreign Residents)","Inbound","Not Applicable","Voluntary/Recommended but No Penalties","Ministry/Department of Health",54.9213691420836,52.0386623665757,49.9292380301881,81,"https://www.pna.gov.ph/articles/1097774","2020-04-03","2020-04-03 08:53:20"
"17","R_21cv19rwxGFSsfIEn",2696120,"new_entry","original","NA",NA,"Metro Manila (National Capital Region) to be placed on lockdown from March 15 to April 14. (announced on March 12)","2020-03-12","2020-03-15",2020-04-14,"Philippines","PHL","PH","National",1,NA,NA,"Internal Border Restrictions",NA,NA,"","Philippines","A geographical or administrative unit within a country",NA,"Metro Manila (National Capital Region)",NA,NA,"All Residents (Citizen Residents + Foreign Residents)",NA,NA,"Mandatory (Unspecified/Implied)","National Government",52.7142490904114,51.5915727123289,50.4636941339325,123,"https://www.rappler.com/nation/254101-metro-manila-placed-on-lockdown-coronavirus-outbreak","2020-04-04","2020-04-04 03:43:53"
"18","R_1CEeGVBf7zFk2hZCi",2464738,"new_entry","correction","NA",NA,"The Philippines Bacolod City Mayor Evelio Leonardia announced on March 27th that he had signed Executive Order No. 26 that places the city under an Enhanced Community Quarantine from 30 March to 14 April 2020. A 24-hour curfew will be observed by the general public, except for identified holders of Home Quarantine Pass who will be allowed to leave for provisions from 4am to 10pm.","2020-03-27","2020-03-30",2020-04-14,"Philippines","PHL","PH","Municipal",0,NA,"Bacolod City","Lockdown","Lockdown only applies to people of certain ages (Please note the age restriction in the text box)",NA,"","Philippines","A geographical or administrative unit within a country",NA,NA,"Bacolod City",NA,"All Residents (Citizen Residents +Foreign Residents)","Inbound","Not Applicable","Mandatory (Unspecified/Implied)","Municipal Government,Police",56.4982840687143,52.1346942595244,48.5467922703277,68,"http://www.dnx.news/covid19/martial-law-by-necessity-bacolod-goes-under-enhanced-community-quarantine/","2020-06-24","2020-06-24 23:56:24"
"19","R_pK0UUp5CtWFec4FEn",9105495,"new_entry","original","NA",NA,"The Philippines President Rodrigo Duterte has signed a law on March 25 that grants him special powers to step up the government’s fight against the coronavirus disease 2019 (Covid-19).

In a text message sent to reporters early Wednesday morning, Senator Christopher Lawrence Go confirmed that Duterte inked Republic Act (RA) 11469 or the """"Bayanihan to Heal as One Act"""".","2020-03-25","2020-03-25",NA,"Philippines","PHL","PH","National",0,NA,NA,"Other Policy Not Listed Above",NA,"The Congress grants the President of the Philippines special powers to tackle COVID-19.","",NA,NA,NA,NA,NA,NA,NA,NA,NA,"Mandatory (Unspecified/Implied)","National Government",54.9213691420836,52.0386623665757,49.9292380301881,81,"https://www.officialgazette.gov.ph/downloads/2020/03mar/20200324-RA-11469-RRD.pdf","2020-04-03","2020-04-03 10:55:01"
"20","R_2cjSN5zPIDmk7adBi",757659,"new_entry","original","NA",NA,"The Philippine Department of Labor and Employment (DOLE) on Wednesday, March 4, issued guidelines that employers should follow when implementing flexible working hours in response to the ongoing 2019 novel coronavirus outbreak.","2020-03-04","2020-03-04",NA,"Philippines","PHL","PH","National",0,NA,NA,"Public Awareness Measures","Disseminating information related to COVID-19 to the public that is reliable and factually accurate",NA,"",NA,NA,NA,NA,NA,NA,NA,NA,NA,"Voluntary/Recommended but No Penalties","Other (Please specify in the text box)",51.0665795650412,48.9676888067319,45.813145374916,65,"https://www.rappler.com/nation/253412-dole-issues-guidelines-employers-amid-coronavirus-outbreak","2020-04-04","2020-04-04 04:08:16"
"21","R_10DyqSbdHIhqzFEEn",1601366,"new_entry","correction","NA",NA,"Cebu imposes 24-hour curfew for students and elders. (announced and effective on Mar. 22)","2020-03-22","2020-03-22",NA,"Philippines","PHL","PH","Provincial",1,"Cebu",NA,"Quarantine","Self-Quarantine (i.e. quarantine at home)",NA,"","Philippines","A geographical or administrative unit within a country",NA,"Cebu Province",NA,NA,"All Residents (Citizen Residents + Foreign Residents)","Inbound","Not Applicable","Mandatory with Exceptions (Please list exceptions in the text entry)","Provincial/State Government",53.1889122448393,52.0513644055667,50.9726782412548,93,"https://www.pna.gov.ph/articles/1097423","2020-04-05","2020-04-05 09:55:07"
"22","R_3nqlIOnRP2qA1hlEn",4755617,"new_entry","original","NA",NA,"The Philippines Government imposes an enhanced community quarantine in high-risk geographic areas (NCR, Region III except Aurora Province, Region IV-A, Benguet Province, Pangasinan Province, Iloilo Province, Cebu Province, Bacolod City and Davao City) from May 01, 2020 to May 15, 2020","2020-04-29","2020-05-01",2020-05-15,"Philippines","PHL","PH","National",1,NA,NA,"Quarantine","Self-Quarantine (i.e. quarantine at home)",NA,"","Philippines","A geographical or administrative unit within a country",NA,NA,"Bacolod (Negros Occidental); Davao (Davao del Sur)",NA,"All Residents (Citizen Residents + Foreign Residents)",NA,"Not Applicable","Mandatory (Unspecified/Implied)","National Government",NA,NA,NA,NA,"https://drive.google.com/file/d/1v5eDd-w0OmyiSoQCGnLc1YXV_IQP3yuc/view","2020-10-02","2020-10-02 13:19:01"
"23","R_2flMLeepx7S2fLrEn",6704368,"new_entry","original","NA",NA,"The Philippines Government imposes an enhanced community quarantine in high-risk geographic areas (NCR, Region III except Aurora Province, Region IV-A, Benguet Province, Pangasinan Province, Iloilo Province, Cebu Province, Bacolad City and Davao City) from May 01, 2020 to May 15, 2020.","2020-04-29","2020-05-01",2020-05-15,"Philippines","PHL","PH","National",1,NA,NA,"Quarantine","Self-Quarantine (i.e. quarantine at home)",NA,"","Philippines","A geographical or administrative unit within a country",NA,NA,NA,NA,"All Residents (Citizen Residents + Foreign Residents)",NA,"Not Applicable","Mandatory (Unspecified/Implied)","National Government",NA,NA,NA,NA,"https://drive.google.com/file/d/1v5eDd-w0OmyiSoQCGnLc1YXV_IQP3yuc/view","2020-10-02","2020-10-02 13:00:09"
"24","R_1mxa13W8GVIfO65En",8937646,"new_entry","original","NA",NA,"The Philippines Government imposes a General Community Quarantine in the Philippines (with the exception of NCR, Region III except Aurora Province, Region IV-A, Benguet Province, Pangasinan Province, Iloilo Province, Cebu Province, Bacolad City and Davao City - all of which will be under enhanced community quarantine) from May 01, 2020 to May 15, 2020
","2020-04-29","2020-05-01",2020-05-15,"Philippines","PHL","PH","National",1,NA,NA,"Quarantine","Self-Quarantine (i.e. quarantine at home)",NA,"","Philippines","A geographical or administrative unit within a country",NA,NA,NA,NA,"All Residents (Citizen Residents + Foreign Residents)",NA,"Not Applicable","Mandatory (Unspecified/Implied)","National Government",NA,NA,NA,NA,"https://drive.google.com/file/d/1v5eDd-w0OmyiSoQCGnLc1YXV_IQP3yuc/view","2020-10-02","2020-10-02 13:10:47"
"25","R_3RmYjuZpWj4Y39CAv",558037,"new_entry","correction","NA",NA,"On March 12, 2020 in Philippines, all private businesses in Metro Manila are encouraged to observe flexible working arrangements.","2020-03-12","2020-03-12",NA,"Philippines","PHL","PH","National",0,NA,NA,"Restriction and Regulation of Businesses","All or unspecified non-essential businesses",NA,"","Philippines",NA,NA,NA,NA,NA,"All Residents (Citizen Residents + Foreign Residents)",NA,NA,"Voluntary/Recommended but No Penalties","National Government",51.1720548982146,49.9582041050724,48.0226133625142,77,"https://www.rappler.com/nation/254278-duterte-suspends-classes-government-offices-metro-manila-until-april-12-2020-coronavirus-threat","2020-07-08","2020-07-08 11:35:35"
"26","R_Z1MoYdpZSZkM7WFAv",8546187,"new_entry","original","NA",NA,"The Philippines' Bacolod City orders closure of internet cafés
","2020-03-25","2020-03-25",NA,"Philippines","PHL","PH","Municipal",1,NA,"Barcolod City","Restriction and Regulation of Businesses","All or unspecified non-essential businesses",NA,"","Philippines",NA,NA,NA,"Barcolod City",NA,"All Residents (Citizen Residents + Foreign Residents)",NA,NA,"Mandatory (Unspecified/Implied)","Municipal Government",54.9213691420836,52.0386623665757,49.9292380301881,81,"https://www.pna.gov.ph/articles/1097773","2020-04-03","2020-04-03 08:46:28"
"27","R_2axkvGH4n5zXk5gEn",7557610,"new_entry","original","NA",NA,"Duterte suspends government work in the executive branch in Metro Manila until April 12. (announced on Mar. 12 and effective on Mar. 15)","2020-03-12","2020-03-15",2020-04-12,"Philippines","PHL","PH","National",1,NA,NA,"Restriction and Regulation of Government Services","Self-Quarantine (i.e. quarantine at home)",NA,"","Philippines",NA,NA,NA,NA,NA,"All Residents (Citizen Residents + Foreign Residents)",NA,NA,"Mandatory (Unspecified/Implied)","National Government",52.7142490904114,51.5915727123289,50.4636941339325,123,"https://www.rappler.com/nation/254278-duterte-suspends-classes-government-offices-metro-manila-until-april-12-2020-coronavirus-threat","2020-04-04","2020-04-04 03:57:20"
"28","R_2axkvGH4n5zXk5gCi",7557610,"new_entry","original","NA",NA,"Duterte suspends government work in the executive branch in Metro Manila until April 12. (announced on Mar. 12 and effective on Mar. 15)","2020-03-12","2020-03-15",2020-04-12,"Philippines","PHL","PH","National",1,NA,NA,"Restriction and Regulation of Government Services","Lockdown only applies to people of certain ages (Please note the age restriction in the text box)",NA,"","Philippines",NA,NA,NA,NA,NA,"All Residents (Citizen Residents + Foreign Residents)",NA,NA,"Mandatory (Unspecified/Implied)","National Government",52.7142490904114,51.5915727123289,50.4636941339325,123,"https://www.rappler.com/nation/254278-duterte-suspends-classes-government-offices-metro-manila-until-april-12-2020-coronavirus-threat","2020-04-04","2020-04-04 03:57:20"
"29","R_2axkvGH4n5zXk5gFg",7557610,"new_entry","original","NA",NA,"Duterte suspends government work in the executive branch in Metro Manila until April 12. (announced on Mar. 12 and effective on Mar. 15)","2020-03-12","2020-03-15",2020-04-12,"Philippines","PHL","PH","National",1,NA,NA,"Restriction and Regulation of Government Services","Visa extensions (e.g. visa validity extended)",NA,"","Philippines",NA,NA,NA,NA,NA,"All Residents (Citizen Residents + Foreign Residents)",NA,NA,"Mandatory (Unspecified/Implied)","National Government",52.7142490904114,51.5915727123289,50.4636941339325,123,"https://www.rappler.com/nation/254278-duterte-suspends-classes-government-offices-metro-manila-until-april-12-2020-coronavirus-threat","2020-04-04","2020-04-04 03:57:20"
