"","record_id","policy_id","entry_type","correct_type","update_type","update_level","description","date_announced","date_start","date_end","country","ISO_A3","ISO_A2","init_country_level","domestic_policy","province","city","type","type_sub_cat","type_text","institution_status","target_country","target_geog_level","target_region","target_province","target_city","target_other","target_who_what","target_direction","travel_mechanism","compliance","enforcer","index_high_est","index_med_est","index_low_est","index_country_rank","link","date_updated","recorded_date"
"33","R_1MMab5eOs5S3IbNEl","460890","new_entry","original",NA,NA,"On March 16th, Panama's Ministry of Health announces the start of the R.O.S.A. program, a virtual clinic to treat and advise people with respiratory problems.",2020-03-16,2020-03-16,NA,"Panama","PAN","PA","National",0,NA,NA,"Health Resources","Unspecified Health Staff",NA,"","Panama",NA,NA,NA,NA,NA,NA,NA,NA,"Voluntary/Recommended but No Penalties","Ministry/Department of Health",52.3442363528375,51.2471486366266,50.1721697746254,93,"https://yomeinformopma.org/info_detail/10",2020-05-13,2020-05-13 11:54:08
"34","R_3horuavk4HJMg1MCg","460890","update","original","Change of Policy","Strengthening","On March 16th, Panama's Ministry of Health announces the start of the R.O.S.A. program, a virtual clinic to treat and advise people with respiratory problems.",2020-03-16,2020-03-16,NA,"Panama","PAN","PA","National",0,NA,NA,"Health Resources","Other Health Infrastructure",NA,"","Panama",NA,NA,NA,NA,NA,NA,NA,NA,"Voluntary/Recommended but No Penalties","Ministry/Department of Health",52.3442363528375,51.2471486366266,50.1721697746254,93,"NA",2020-05-25,2020-05-25 14:58:03
"35","R_3horuavk4HJMg1MEl","460890","update","original","Change of Policy","Strengthening","On March 16th, Panama's Ministry of Health announces the start of the R.O.S.A. program, a virtual clinic to treat and advise people with respiratory problems.",2020-03-16,2020-03-16,NA,"Panama","PAN","PA","National",0,NA,NA,"Health Resources","Unspecified Health Staff",NA,"","Panama",NA,NA,NA,NA,NA,NA,NA,NA,"Voluntary/Recommended but No Penalties","Ministry/Department of Health",52.3442363528375,51.2471486366266,50.1721697746254,93,"NA",2020-05-25,2020-05-25 14:58:03
"36","R_3rFZ1dTEBpUjmvfEk","3741642","new_entry","original",NA,NA,"On the 18th of March, President Cortizo of Panama announced his decision to apply a zero tariff policy to for products related to the recommended health and hygiene measures to face the pandemic.",2020-03-18,2020-03-18,NA,"Panama","PAN","PA","National",0,NA,NA,"Health Resources","Unspecified Health Materials",NA,"","Panama",NA,NA,NA,NA,NA,NA,NA,NA,"Mandatory (Unspecified/Implied)","National Government",53.0817361481479,51.2598412829896,49.9843202167607,83,"https://yomeinformopma.org/info_detail/13",2020-05-25,2020-05-25 15:03:41
"37","R_WAjwflfn6TKQtnbCq","5446690","new_entry","original",NA,NA,"On March 19, Panama's Minister of Health ordered 3,500 units of protective equipment, to be distributed among medical and hospital personnel throughout the province of Veraguas.",2020-03-19,2020-03-19,NA,"Panama","PAN","PA","National",1,NA,NA,"Health Resources","Personal Protective Equipment",NA,"","Panama","One or more geographical or administrative units within one or more countries",NA,"Veraguas",NA,NA,"All Residents (Citizen Residents + Foreign Residents)",NA,"Not Applicable","Mandatory (Unspecified/Implied)","Ministry/Department of Health,Provincial/State Government",52.8559257968926,51.3644828461108,49.7924031543032,78,"https://yomeinformopma.org/info_detail/30",2020-05-18,2020-05-18 15:46:25
"38","R_WAjwflfn6TKQtnbEl","5446690","new_entry","original",NA,NA,"On March 19, Panama's Minister of Health ordered 3,500 units of protective equipment, to be distributed among medical and hospital personnel throughout the province of Veraguas.",2020-03-19,2020-03-19,NA,"Panama","PAN","PA","National",1,NA,NA,"Health Resources","Unspecified Health Staff",NA,"","Panama","One or more geographical or administrative units within one or more countries",NA,"Veraguas",NA,NA,"All Residents (Citizen Residents + Foreign Residents)",NA,"Not Applicable","Mandatory (Unspecified/Implied)","Ministry/Department of Health,Provincial/State Government",52.8559257968926,51.3644828461108,49.7924031543032,78,"https://yomeinformopma.org/info_detail/30",2020-05-18,2020-05-18 15:46:25
"39","R_1IbYC8muGVVTlZPCq","8810343","new_entry","original",NA,NA,"On March 19, Panama's Minister of Health ordered 3,500 units of protective equipment to distribute among medical and hospital personnel in the province of Veraguas.",2020-03-19,2020-03-19,NA,"Panama","PAN","PA","National",1,NA,NA,"Health Resources","Personal Protective Equipment",NA,"","Panama","One or more geographical or administrative units within one or more countries",NA,"Veraguas",NA,NA,"All Residents (Citizen Residents + Foreign Residents)",NA,"Not Applicable","Mandatory (Unspecified/Implied)","Ministry/Department of Health,Provincial/State Government",52.8559257968926,51.3644828461108,49.7924031543032,78,"https://yomeinformopma.org/info_detail/30",2020-05-25,2020-05-25 15:31:46
"40","R_1IbYC8muGVVTlZPEl","8810343","new_entry","original",NA,NA,"On March 19, Panama's Minister of Health ordered 3,500 units of protective equipment to distribute among medical and hospital personnel in the province of Veraguas.",2020-03-19,2020-03-19,NA,"Panama","PAN","PA","National",1,NA,NA,"Health Resources","Unspecified Health Staff",NA,"","Panama","One or more geographical or administrative units within one or more countries",NA,"Veraguas",NA,NA,"All Residents (Citizen Residents + Foreign Residents)",NA,"Not Applicable","Mandatory (Unspecified/Implied)","Ministry/Department of Health,Provincial/State Government",52.8559257968926,51.3644828461108,49.7924031543032,78,"https://yomeinformopma.org/info_detail/30",2020-05-25,2020-05-25 15:31:46
"41","R_OPzkNHB14MfMCc1Ch","2386776","new_entry","original",NA,NA,"The Social Security Fund in Panama has launched a home delivery service for medicines for patients with chronic diseases over the age of 65, to take effect on March 21.",2020-03-21,2020-03-21,NA,"Panama","PAN","PA","National",0,NA,NA,"Health Resources","Other Health Materials",NA,"","Panama",NA,NA,NA,NA,NA,NA,NA,NA,"Voluntary/Recommended but No Penalties","National Government,Ministry/Department of Health",53.2430696905778,51.5666694528601,49.5996387890316,74,"https://yomeinformopma.org/info_detail/18",2020-05-25,2020-05-25 12:30:36
"42","R_OPzkNHB14MfMCc1Cg","2386776","new_entry","original",NA,NA,"The Social Security Fund in Panama has launched a home delivery service for medicines for patients with chronic diseases over the age of 65, to take effect on March 21.",2020-03-21,2020-03-21,NA,"Panama","PAN","PA","National",0,NA,NA,"Health Resources","Other Health Infrastructure",NA,"","Panama",NA,NA,NA,NA,NA,NA,NA,NA,"Voluntary/Recommended but No Penalties","National Government,Ministry/Department of Health",53.2430696905778,51.5666694528601,49.5996387890316,74,"https://yomeinformopma.org/info_detail/18",2020-05-25,2020-05-25 12:30:36
"43","R_OPzkNHB14MfMCc1El","2386776","new_entry","original",NA,NA,"The Social Security Fund in Panama has launched a home delivery service for medicines for patients with chronic diseases over the age of 65, to take effect on March 21.",2020-03-21,2020-03-21,NA,"Panama","PAN","PA","National",0,NA,NA,"Health Resources","Unspecified Health Staff",NA,"","Panama",NA,NA,NA,NA,NA,NA,NA,NA,"Voluntary/Recommended but No Penalties","National Government,Ministry/Department of Health",53.2430696905778,51.5666694528601,49.5996387890316,74,"https://yomeinformopma.org/info_detail/18",2020-05-25,2020-05-25 12:30:36
"44","R_1NCkFvKy1pRh0swEl","8802860","new_entry","original",NA,NA,"The Ministry of Health in Panama has appointed 40 new health professionals to attend to patients in home isolation and with mild symptoms.",2020-03-21,2020-03-21,NA,"Panama","PAN","PA","National",0,NA,NA,"Health Resources","Unspecified Health Staff",NA,"","Panama",NA,NA,NA,NA,NA,NA,NA,NA,"Voluntary/Recommended but No Penalties","Ministry/Department of Health",53.2430696905778,51.5666694528601,49.5996387890316,74,"https://yomeinformopma.org/info_detail/15",2020-05-25,2020-05-25 12:40:10
"45","R_qJjLOgRc3KYndlvDy","5096205","new_entry","original",NA,NA,"On March 23, the Government of Panama announced the acquisition of 4000+ test kits to diagnose potential cases of COVID-19.",2020-03-23,2020-03-23,NA,"Panama","PAN","PA","National",0,NA,NA,"Health Resources","Test Kits",NA,"","Panama",NA,NA,NA,NA,NA,NA,NA,NA,"Voluntary/Recommended but No Penalties","National Government,Ministry/Department of Health",53.9493596840182,51.5656119092873,49.5086219885643,63,"https://yomeinformopma.org/info_detail/17",2020-05-25,2020-05-25 12:53:16
"46","R_1UggWk0KZ0EgAM1Eq","9741185","new_entry","original",NA,NA,"Panama's Social Security Fund acquires 15 new ventilators.",2020-03-27,2020-03-27,NA,"Panama","PAN","PA","National",0,NA,NA,"Health Resources","Ventilators",NA,"","Panama",NA,NA,NA,NA,NA,NA,NA,NA,"Voluntary/Recommended but No Penalties","National Government",53.9901823578983,51.7117053890631,49.766888045326,59,"https://yomeinformopma.org/info_detail/32",2020-05-25,2020-05-25 14:47:29
"47","R_231QXTJadycLfwoCi","9723803","new_entry","original",NA,NA,"On April 1, four intensive care specialists were appointed to continue strengthening the 'Protect Yourself Panama Plan', two for the San Miguel Arcángel Hospital, in San Miguelito, and another two for the Nicolás A. Solano Hospital, in La Chorrera.",2020-04-01,2020-04-01,NA,"Panama","PAN","PA","National",0,NA,NA,"Health Resources","Other Heath Staff",NA,"","Panama",NA,NA,NA,NA,NA,NA,NA,NA,"Mandatory (Unspecified/Implied)","Ministry/Department of Health",53.2127244692167,51.659869083059,50.4922694531576,52,"https://yomeinformopma.org/info_detail/38",2020-06-08,2020-06-08 13:15:37
"48","R_2uU7HQ5pVtFTvtsBv","2899677","new_entry","original",NA,NA,"On April 2, The Panamese Ministry of Health delivered 3000 masks for the users of tram lines 1 and 2 at the San Miguelito Metro station and explained how to use them.",2020-04-02,2020-04-02,NA,"Panama","PAN","PA","National",0,NA,NA,"Health Resources","Masks",NA,"","Panama",NA,NA,NA,NA,NA,NA,NA,NA,"Voluntary/Recommended but No Penalties","Ministry/Department of Health",53.9238927409099,51.6315690847137,49.7104183530106,49,"https://yomeinformopma.org/info_detail/39",2020-06-08,2020-06-08 13:31:28
"49","R_2fwIfmvkBaFWcmNDw","6326968","new_entry","original",NA,NA,"On April 2, the Panamese Ministry of Health announced that a sampling center for COVID-19 came into operation in San Miguelito, where samples are to be taken from people that are referred through the hotline 169. It will operate from 7 in the morning to 6:30 in the afternoon.",2020-04-02,2020-04-02,NA,"Panama","PAN","PA","National",0,NA,NA,"Health Resources","Temporary Medical Centers",NA,"","Panama",NA,NA,NA,NA,NA,NA,NA,NA,"Mandatory (Unspecified/Implied)","Ministry/Department of Health",53.9238927409099,51.6315690847137,49.7104183530106,49,"https://yomeinformopma.org/info_detail/39",2020-06-08,2020-06-08 13:38:36
"50","R_3PbpGcKTkRus3t7Bv","8620287","new_entry","original",NA,NA,"On April 4,The Panamese National Directorate for Health Promotion delivered 4,000 masks to the Arraiján district, to be used primarily by people who are at risk.",2020-04-04,2020-04-04,NA,"Panama","PAN","PA","National",0,NA,NA,"Health Resources","Masks",NA,"","Panama",NA,NA,NA,NA,NA,NA,NA,NA,"Voluntary/Recommended but No Penalties","Ministry/Department of Health",54.168826435881,51.6373171658973,49.6639373157596,48,"https://yomeinformopma.org/info_detail/41",2020-06-08,2020-06-08 14:11:22
"51","R_cMhCuoNtibFQoPDDw","6434035","new_entry","original",NA,NA,"The Panama Ministry of Health has installed a 20-bed mobile hospital in the province of Darién to help alleviate the over-crowded hospitals due to COVID-19 patients.",2020-07-02,2020-07-02,NA,"Panama","PAN","PA","National",0,NA,NA,"Health Resources","Temporary Medical Centers",NA,"","Panama",NA,NA,NA,NA,NA,NA,NA,NA,"Voluntary/Recommended but No Penalties","National Government,Ministry/Department of Health,Provincial/State Government",NA,NA,NA,NA,"https://yomeinformopma.org/info_detail/130",2020-07-12,2020-07-12 13:35:12
"52","R_27CMTtD7G1Eq9wKCq","442553","new_entry","original",NA,NA,"On July 7th, Panama received a donation of medicine and surgical equipment from India to serve as medical support for the fight against COVID-19.",2020-07-07,2020-07-07,NA,"Panama","PAN","PA","National",0,NA,NA,"Health Resources","Personal Protective Equipment",NA,"","Panama",NA,NA,NA,NA,NA,NA,NA,NA,"Voluntary/Recommended but No Penalties","National Government",NA,NA,NA,NA,"https://yomeinformopma.org/info_detail/134",2020-07-12,2020-07-12 14:29:22
"53","R_27CMTtD7G1Eq9wKBw","442553","new_entry","original",NA,NA,"On July 7th, Panama received a donation of medicine and surgical equipment from India to serve as medical support for the fight against COVID-19.",2020-07-07,2020-07-07,NA,"Panama","PAN","PA","National",0,NA,NA,"Health Resources","Medicine/Drugs",NA,"","Panama",NA,NA,NA,NA,NA,NA,NA,NA,"Voluntary/Recommended but No Penalties","National Government",NA,NA,NA,NA,"https://yomeinformopma.org/info_detail/134",2020-07-12,2020-07-12 14:29:22
"54","R_27CMTtD7G1Eq9wKCh","442553","new_entry","original",NA,NA,"On July 7th, Panama received a donation of medicine and surgical equipment from India to serve as medical support for the fight against COVID-19.",2020-07-07,2020-07-07,NA,"Panama","PAN","PA","National",0,NA,NA,"Health Resources","Other Health Materials",NA,"","Panama",NA,NA,NA,NA,NA,NA,NA,NA,"Voluntary/Recommended but No Penalties","National Government",NA,NA,NA,NA,"https://yomeinformopma.org/info_detail/134",2020-07-12,2020-07-12 14:29:22
"55","R_3hg6IPWKKPOPOUTBw","2520873","new_entry","original",NA,NA,"The Panama government announced on July 9th that it will be purchasing Remdesivir as treatment for about 1000 COVID-19 patients.",2020-07-09,2020-07-09,NA,"Panama","PAN","PA","National",0,NA,NA,"Health Resources","Medicine/Drugs",NA,"","Panama",NA,NA,NA,NA,NA,NA,NA,NA,"Voluntary/Recommended but No Penalties","National Government,Ministry/Department of Health",NA,NA,NA,NA,"https://yomeinformopma.org/info_detail/136",2020-07-12,2020-07-12 14:59:05
"56","R_1Fkv2jQS2rqC8WVNA","1394847","new_entry","correction",NA,NA,"The government of Panama has implemented enhanced screening at all points of entry and exit in the state, including all cruise ships, to reduce the spread of COVID-19, starting on the 10th of March.",2020-03-10,2020-03-10,NA,"Panama","PAN","PA","National",0,NA,NA,"Health Testing",NA,NA,"","Panama",NA,NA,NA,NA,NA,NA,NA,NA,"Mandatory (Unspecified/Implied)","National Government",52.2682085909493,50.7970773667469,49.4782216256699,125,"https://yomeinformopma.org/info_detail/2 ; https://pa.usembassy.gov/health-alert-u-s-embassy-panama-city-panama/",2020-07-23,2020-07-23 14:19:57
"57","R_3kk9AMDhk4D4hrBNA","4022501","new_entry","original",NA,NA,"On March 14, the Government of Panama announced the establishment of a national diagnostic network to implement mass testing of COVID-19, with the objective of enabling people with symptoms or a known history of contact with a known case to get tested. In all provinces and the capital these tests will be available in major health facilities. Private hospitals with comparable diagnostic capabilities have been authorised to acquire the necessary test kits and conduct tests.
",2020-03-14,2020-03-14,NA,"Panama","PAN","PA","National",0,NA,NA,"Health Testing",NA,NA,"","Panama",NA,NA,NA,NA,NA,NA,NA,NA,"Voluntary/Recommended but No Penalties","Other (Please specify in the text box)",52.5943379907125,51.0717531669484,49.3268696826188,102,"https://yomeinformopma.org/info_detail/8",2020-05-13,2020-05-13 09:01:46
"58","R_3QDYydAEpnW4XUONA","7540425","new_entry","original",NA,NA,"The Panamese Government announced internal border restrictions between the provinces, Panama, Colon and Panama West, to take effect on March 20. These border restrictions do not apply to the transport of cargo, food, medicines, humanitarian aid, medical supplies and agricultural production.",2020-03-19,2020-03-20,NA,"Panama","PAN","PA","National",1,NA,NA,"Internal Border Restrictions",NA,NA,"","Panama","One or more geographical or administrative units within one or more countries",NA,"Panama, Colon, Panama West",NA,NA,"All Residents (Citizen Residents + Foreign Residents)",NA,NA,"Mandatory with Legal Penalties (Jail Time)","National Government,Ministry/Department of Health,Provincial/State Government",53.0000904424743,51.3738063684076,49.5344049593964,73,"https://yomeinformopma.org/info_detail/14 ; https://yomeinformopma.org/info_detail/20",2020-05-25,2020-05-25 12:01:43
"59","R_1Q60ehl7LoGZrBzNA","8847098","new_entry","original",NA,NA,"MINSA of Panama (health ministry) also announced on June 3 that a health cordon has been declared in the district of Chiriqui Grande, and in the communities of Pantanal and Finca 1 in Changuinola, and Solución in Bocas del Toro.",2020-06-03,2020-06-03,NA,"Panama","PAN","PA","National",1,NA,NA,"Internal Border Restrictions",NA,NA,"","Panama","One or more geographical or administrative units within one or more countries",NA,NA,NA,NA,"All Residents (Citizen Residents + Foreign Residents)",NA,NA,"Mandatory (Unspecified/Implied)","National Government,Ministry/Department of Health,Provincial/State Government,Municipal Government",NA,NA,NA,NA,"https://pa.usembassy.gov/covid-19-information/ ; http://minsa.b-cdn.net/sites/default/files/general/resolucion_no_486_3_junio_2020.pdf",2020-06-26,2020-06-26 16:54:10
"60","R_2qe1yz9PxheSYTNNA","8515833","new_entry","original",NA,NA,"On June 6, the Panama government announced that the provinces of Panama and Panama Oeste will return to movement restrictions based on gender and ID number, starting on June 8.",2020-06-06,2020-06-08,NA,"Panama","PAN","PA","National",1,NA,NA,"Internal Border Restrictions",NA,NA,"","Panama","One or more geographical or administrative units within one or more countries",NA,NA,NA,NA,"All Residents (Citizen Residents + Foreign Residents)",NA,NA,"Mandatory (Unspecified/Implied)","National Government,Ministry/Department of Health,Provincial/State Government,Municipal Government,Police",NA,NA,NA,NA,"https://www.osac.gov/Content/Report/924969ca-a0d3-47f4-a031-18e008dd1d00",2020-06-17,2020-06-17 16:43:13
"61","R_1E6Rad7zXyjq02lNA","6538043","new_entry","correction",NA,NA,"On June 11, the Republic of Panama Ministry of Health declared a sanitary fence in the community of Iber-Gun in the township of Cristóbal, Colón District, Colón Province",2020-06-11,2020-06-11,NA,"Panama","PAN","PA","National",0,NA,NA,"Internal Border Restrictions",NA,NA,"","Panama","One or more geographical or administrative units within one or more countries",NA,NA,NA,NA,"All Residents (Citizen Residents + Foreign Residents)",NA,NA,"Mandatory (Unspecified/Implied)","National Government,Ministry/Department of Health,Provincial/State Government,Municipal Government",NA,NA,NA,NA,"http://minsa.b-cdn.net/sites/default/files/general/resolucion_509_del_11_de_junio_de_2020_minsa.pdf",2020-06-26,2020-06-26 17:22:18
"62","R_DdBWVNLFVCVbxE5Ds","2679210","new_entry","correction","End of Policy",NA,"Panama enacted nationwide movement restrictions, also referred to as quarantine, effective March 25, 2020.",2020-06-01,2020-06-01,NA,"Panama","PAN","PA","National",0,NA,NA,"Lockdown",NA,NA,"","All countries","All countries",NA,NA,NA,NA,"All (Travelers + Residents)","Inbound/Outbound",NA,"Mandatory with Fines","National Government,Police",NA,NA,NA,NA,"https://pa.usembassy.gov/covid-19-information/",2020-07-23,2020-07-23 16:29:59
"63","R_1Cw5L18QZ6aTZhwAq","1373484","new_entry","original",NA,NA,"The national government of Panama developed an instructional guide for governors mayors and representatives of townships informing them of their role and participation in the national plan to address the pandemic",2020-03-13,2020-03-13,NA,"Panama","PAN","PA",NA,1,NA,NA,"New Task Force, Bureau or Administrative Configuration","Cooperation among different jurisdictional entities (e.g. treaties or agreements among countries or provinces)",NA,"",NA,NA,NA,NA,NA,NA,"All Residents (Citizen Residents + Foreign Residents)",NA,NA,"Mandatory (Unspecified/Implied)","National Government,Ministry/Department of Health,Provincial/State Government,Municipal Government",52.589457241713,51.0309018721989,49.337950120138,115,"https://yomeinformopma.org/info_detail/7",2020-05-06,2020-05-06 11:36:06
"64","R_3OqqvqhebTyCAm7NA","5866615","new_entry","original",NA,NA,"Panama is establishing information-hubs in each province to gather information on the spread of Covid-19 on March 16 2020.",2020-03-16,2020-03-16,NA,"Panama","PAN","PA","National",1,NA,NA,"New Task Force, Bureau or Administrative Configuration",NA,NA,"","Panama",NA,NA,NA,NA,NA,"All Residents (Citizen Residents + Foreign Residents)",NA,NA,"Mandatory (Unspecified/Implied)","National Government,Ministry/Department of Health",52.3442363528375,51.2471486366266,50.1721697746254,93,"https://www.gacetaoficial.gob.pa/pdfTemp/28981_C/77835.pdf",2020-04-01,2020-04-01 16:12:35
"65","R_2y0ZAGfX2HJhI1HBy","3256339","new_entry","original",NA,NA,"At the direction of Panama's Health Minister, a ""COVID-19 Committee"", made up of a director, infectologist and nurses, must be established in each health center in the country to supervise the protocols for the care of patients that have contracted COVID-19.",2020-03-19,2020-03-19,NA,"Panama","PAN","PA","National",1,NA,NA,"New Task Force, Bureau or Administrative Configuration","New Task Force or Bureau (i.e. establishment of a temporary body)",NA,"","Panama",NA,NA,NA,NA,NA,"All Residents (Citizen Residents + Foreign Residents)",NA,NA,"Mandatory (Unspecified/Implied)","National Government,Ministry/Department of Health",52.8559257968926,51.3644828461108,49.7924031543032,78,"https://yomeinformopma.org/info_detail/30",2020-05-18,2020-05-18 18:35:28
"66","R_2WBTGTdngIOoyXyBy","5335813","new_entry","original",NA,NA,"On March 19, the Ministry of Health in Panama set up a group of specialists in the province of Veraguas to verify the protocols that attend to COVID-19 in the medical centers in the area.",2020-03-19,2020-03-19,NA,"Panama","PAN","PA","National",1,NA,NA,"New Task Force, Bureau or Administrative Configuration","New Task Force or Bureau (i.e. establishment of a temporary body)",NA,"","Panama",NA,NA,NA,NA,NA,"All Residents (Citizen Residents + Foreign Residents)",NA,NA,"Mandatory (Unspecified/Implied)","Ministry/Department of Health,Provincial/State Government",52.8559257968926,51.3644828461108,49.7924031543032,78,"https://yomeinformopma.org/info_detail/30",2020-05-18,2020-05-18 15:38:33
"67","R_12fjLH3HZgcsO5dNA","8036441","new_entry","original",NA,NA,"Panama establishes new teams to maintain the safety of its waterways on March 26 2020.",2020-03-26,2020-03-26,NA,"Panama","PAN","PA","National",1,NA,NA,"New Task Force, Bureau or Administrative Configuration",NA,NA,"","Panama",NA,NA,NA,NA,NA,"All Residents (Citizen Residents + Foreign Residents)",NA,NA,"Mandatory (Unspecified/Implied)","National Government",53.7822248666999,51.6400199543325,49.8288319592077,61,"https://www.porttechnology.org/news/panama-canal-unveils-new-covid-19-measures/",2020-04-01,2020-04-01 16:24:20
"68","R_eA4xWU34lbk1vR7By","4834723","new_entry","original",NA,NA,"Panama has installed a new Interhospital Control Center to analyze the capacities of different medical centers around the country, and provide real-time information pertaining to the COVID-19 situation.",2020-06-29,2020-06-29,NA,"Panama","PAN","PA","National",1,NA,NA,"New Task Force, Bureau or Administrative Configuration","New Task Force or Bureau (i.e. establishment of a temporary body)",NA,"","Panama",NA,NA,NA,NA,NA,"All Residents (Citizen Residents + Foreign Residents)",NA,NA,"Mandatory (Unspecified/Implied)","National Government,Ministry/Department of Health,New (COVID-19 specific) Task Force,Other (Please specify in the text box)",NA,NA,NA,NA,"https://yomeinformopma.org/info_detail/127",2020-07-12,2020-07-12 01:24:58
"69","R_DwoRRVVmXuIt7ixNA","7655516","new_entry","original",NA,NA,"Panama's Ministery of Health and Ministery of Trade and Industry have coordinated to guarantee that the sale of food and cleaning supplies will be conducted in an overseable manner, to avoid hoarding and panic. This policy is to take effect on March 12.",2020-03-12,2020-03-12,NA,"Panama","PAN","PA","National",0,NA,NA,"Other Policy Not Listed Above",NA,"National coordination to ensure the availability of food and cleaning supplies, with the goal of preventing both hoarding and general panic.","","Panama",NA,NA,NA,NA,NA,NA,NA,NA,"Voluntary/Recommended but No Penalties","National Government",52.3875909823272,50.8099522445249,49.5636143847607,113,"https://yomeinformopma.org/info_detail/5",2020-05-06,2020-05-06 10:14:15
"70","R_269kuHSk5kH7tjzNA","5268036","new_entry","original",NA,NA,"Panama rationed the water usage by prohibiting Car-Washes and playing with water.",2020-03-16,2020-03-16,NA,"Panama","PAN","PA","National",0,NA,NA,"Other Policy Not Listed Above",NA,"Panama is issuing prohibitions on the usage of water for pleasure/nonessential business.","",NA,NA,NA,NA,NA,NA,NA,NA,NA,"Mandatory (Unspecified/Implied)","National Government",52.3442363528375,51.2471486366266,50.1721697746254,93,"https://www.gacetaoficial.gob.pa/pdfTemp/28981_C/77835.pdf",2020-04-01,2020-04-01 16:01:11
