record_id,policy_id,entry_type,correct_type,update_type,update_level,description,date_announced,date_start,date_end,country,ISO_A3,ISO_A2,init_country_level,domestic_policy,province,city,type,type_sub_cat,type_text,institution_status,target_country,target_geog_level,target_region,target_province,target_city,target_other,target_who_what,target_direction,travel_mechanism,compliance,enforcer,index_high_est,index_med_est,index_low_est,index_country_rank,link,date_updated,recorded_date
R_12ms6vYmHEHZJdQNA,6189167,new_entry,original,,,"March 31 - In Malaysia, Pahang police will tighten the state borders from midnight tonight under the second phase of the Movement Control Order (MCO).

Pahang police chief Datuk Abd Jalil Hassan said the roadblocks would not only involve the federal roads but also at ‘rat routes’ to ensure public compliance with the MCO. “In addition, we will set up 42 roadblocks for 24 hours along the major roads statewide. We will also increase the number of officers and personnel involved, depending on the need. “Apart from the major roads, we will also be conducting small scale inspections in areas such as Felda settlements and the villages,” he told reporters.",2020-03-31,2020-04-01,2020-04-14,Malaysia,MYS,MY,Provincial,1,Pahang,,Internal Border Restrictions,,,"",Malaysia,,,Pahang,,,All Residents (Citizen Residents + Foreign Residents),,,"Mandatory with Legal Penalties (Jail Time),Mandatory with Fines","Provincial/State Government,Police",51.4137075525,46.26894988673,40.7160171718505,1,https://bernama.com/en/general/news_covid-19.php?id=1827077 ; https://www.themalaysianinsight.com/bahasa/s/233591,2020-12-26,2020-12-26T08:08:16Z
R_2wELicJIGLAaqCENA,5032639,new_entry,original,,,"March 16 - Malaysia will be under a nationwide movement control order from this Wednesday (March 18) until March 31 due to the Covid-19 outbreak, Prime Minister Tan Sri Muhyiddin Yassin announced today. The prime minister said that the government has decided to implement a ‘restriction of movement order’ under the Prevention and Control of Infectious Diseases Act 1988 and the Police Act 1967. 

Muhyiddin said this means that all business premises have to be shut down, except for outlets such as supermarkets and grocery stores selling daily essentials. He said all government and private premises would be closed during the movement control order, except for essential services such as utilities, telecommunications, transport, banking, health, pharmacies, ports, airports, cleaning and food supplies.

He said that the movement control order also means all Malaysians will be banned from travelling abroad, and that no tourists or foreigners will be allowed to enter the country.

“Malaysian who have returned from abroad have to self-quarantine for 14 days,” he added. Muhyiddin also said that all childcare centres, government and private schools, boarding schools, international schools, tahfiz centres and other secondary, primary and pre-university institutions will also be closed. “All private and public higher learning institutions together with vocational training centres will be closed nationwide,” he said.
",2020-03-16,2020-03-18,2020-04-28,Malaysia,MYS,MY,National,0,,,Lockdown,,,"",Malaysia,,,,,,,,,"Mandatory (Unspecified/Implied),Mandatory with Exceptions (Please list exceptions in the text entry)","National Government,Police",49.6801917407872,46.6666744309057,42.7471979209896,2,https://www.malaymail.com/news/malaysia/2020/03/16/pm-malaysia-in-lockdown-from-wed-until-march-31-all-shops-closed-except-for/1847204 ; https://www.malaymail.com/news/malaysia/2020/03/17/police-to-enforce-movement-control-order-says-armed-forces-chief/1847247 ; https://www.pmo.gov.my/2020/03/perutusan-khas-yab-perdana-menteri-mengenai-covid-19-16-mac-2020/,2020-12-18,2020-12-18T07:02:24Z
R_9tzsq9eyMCkoJoJNA,7769654,new_entry,original,,,Prime Minister Tan Sri Muhyiddin Yassin (pic) has declared that the entire country will be on a movement control order starting from March 18 to 31 to deal with the rise in Covid-19 cases.,2020-03-16,2020-03-18,2020-04-14,Malaysia,MYS,MY,National,0,,,Lockdown,,,"",Malaysia,,,,,,,,,Mandatory (Unspecified/Implied),National Government,49.6801917407872,46.6666744309057,42.7471979209896,2,https://www.thestar.com.my/news/nation/2020/03/16/malaysia-announces-restricted-movement-measure-after-spike-in-covid-19-cases?utm_source=outbreak.my,2020-09-21,2020-09-21T20:13:37Z
R_1jYYIEeCsNNWdOuNA,5032639,update,original,Change of Policy,Strengthening,"Malaysia will deploy its military from Sunday (March 22) to help police enforce the government’s order for people to stay at home amid the coronavirus outbreak.
Defence Minister Ismail Sabri told a news conference on Friday that the decision was made at a national emergency meeting to have the military assist the police with the Restriction of Movement Order.",2020-03-20,2020-03-22,2020-04-28,Malaysia,MYS,MY,National,0,,,Lockdown,,,"",Malaysia,,,,,,,,,"Mandatory (Unspecified/Implied),Mandatory with Exceptions (Please list exceptions in the text entry)","National Government,Military,Police",50.2568571445642,46.2015377983767,42.1594243134148,1,"NA ; https://www.malaymail.com/news/malaysia/2020/03/22/armed-forces-arrive-to-assist-cops-manning-checkpoints-monitor-public-movem/1848975 ; Malay Mail ; Armed Forces arrive to assist cops manning checkpoints, monitor public movement",2020-12-24,2020-12-24T18:25:22Z
R_1FxMEO8giQAIaplNA,3590134,new_entry,original,,,Sarawak adds another level of regulation during this movement control order period by telling Sarawakians that they must be indoors from 7pm to 7am beginning Tuesday (March 24). The regulation will last until March 31.,2020-03-24,2020-03-24,2020-03-31,Malaysia,MYS,MY,Provincial,0,Sarawak,,Lockdown,,,"",Malaysia,,,Sarawak,,,,,,Mandatory (Unspecified/Implied),Provincial/State Government,51.0275400246002,46.2321246584111,41.4557765810081,1,https://www.thestar.com.my/news/nation/2020/03/24/sarawak-begins-curfew-from-7pm-to-7am-daily-in-bid-to-curb-covid-19?utm_source=outbreak.my,2020-09-16,2020-09-16T18:01:22Z
R_2WI6o2jvzGGcT0fNA,7769654,update,original,Change of Policy,Strengthening,"A movement control order in Malaysia was initially from March 18 to 31. However, it has been extended to April 14.",2020-03-25,2020-03-25,2020-04-14,Malaysia,MYS,MY,National,0,,,Lockdown,,,"",Malaysia,,,,,,,,,Mandatory (Unspecified/Implied),National Government,50.7817313452556,46.2179212893549,41.9350108983693,1,NA,2020-09-23,2020-09-23T15:14:23Z
R_3kbnoQ93fkp3KmFNA,3018912,new_entry,original,,,"An enhanced order will be imposed in Hulu Langat, Selangor, where 71 out of 274 individuals from a Tahfiz school test were confirmed to be infected with COVID-19. Residents will not be allowed to leave their homes and no visitors will be allowed to enter the area.",2020-04-01,2020-04-01,2020-04-14,Malaysia,MYS,MY,National,1,,,Lockdown,,,"",Malaysia,One or more geographical or administrative units within one or more countries,,,,,All Residents (Citizen Residents + Foreign Residents),,Not Applicable,Mandatory (Unspecified/Implied),Other (Please specify in the text box),51.4137075525,46.26894988673,40.7160171718505,1,https://www.garda.com/crisis24/news-alerts/327731/malaysia-government-implements-phase-2-of-movement-control-order-april-1-14-update-9,2020-09-16,2020-09-16T17:17:14Z
R_2zpayOd6dDcK87JNA,4992271,new_entry,original,,,"An enhanced order will be imposed in Hulu Langat, Selangor, where 71 out of 274 individuals from a Tahfiz school test were confirmed to be infected with COVID-19. Residents will not be allowed to leave their homes and no visitors will be allowed to enter the area.",2020-04-01,2020-04-01,2020-04-14,Malaysia,MYS,MY,National,1,,,Lockdown,,,"",Malaysia,One or more geographical or administrative units within one or more countries,,,,,All Residents (Citizen Residents + Foreign Residents),,Not Applicable,Mandatory (Unspecified/Implied),Other (Please specify in the text box),51.4137075525,46.26894988673,40.7160171718505,1,https://www.garda.com/crisis24/news-alerts/327731/malaysia-government-implements-phase-2-of-movement-control-order-april-1-14-update-9,2020-09-16,2020-09-16T15:38:53Z
R_1CBVBAP4h1bpf6VCj,8491298,new_entry,original,,,"March 10 — Former Malaysian health minister Datuk Seri Dzulkefly Ahmad has been appointed the chairman of Selangor’s new special action council for the control and prevention of the coronavirus disease (Covid-19). Dzulkefly has agreed to chair the council that will include four health professionals, representatives of the state’s Health department and disaster unit. The council is tasked to find ways to prevent the virus from spreading and threatening the health of the people of the state.
“This is because the state government found that 60 per cent of the 117 positive cases of Covid-19 are those living in Selangor,”.",2020-03-10,2020-03-10,,Malaysia,MYS,MY,Provincial,1,Selangor,,"New Task Force, Bureau or Administrative Configuration",New Task Force or Bureau (i.e. establishment of a temporary body),,"",Malaysia,,,Selangor,,,All Residents (Citizen Residents + Foreign Residents),,,Mandatory (Unspecified/Implied),"Ministry/Department of Health,Provincial/State Government",50.855174212828,46.4089671543927,42.3888242416996,1,https://www.malaymail.com/news/malaysia/2020/03/10/selangor-taps-ex-health-minister-dzulkefly-to-lead-covid-19-special-action/1845062 ; https://www.sinarharian.com.my/article/73245/KHAS/Covid-19/Dr-Dzulkefly-ketuai-Majlis-Tindakan-Khas-Covid-19-Selangor,2020-12-18,2020-12-18T17:44:34Z
R_1rGFE0XY10pRVC3Cj,5277980,new_entry,original,,,"March 13 — A special task force will be formed to monitor Covid-19 infection cases involving Malaysians abroad, Foreign Affairs Minister Datuk Seri Hishammuddin Hussein announced today as concern mounts over the worsening pandemic. “I and the top leadership of the Ministry of Foreign Affairs (Wisma Putra) together with Malaysia’s Foreign Delegations are constantly monitoring the Covid-19 outbreak,” the minister said. Hishammuddin said his deputy, Datuk Kamaruddin Jaafar, will lead the team that will be tasked to provide detailed updates on the situation. The report will be made public “from time to time”,  the minister added.",2020-03-13,2020-03-13,,Malaysia,MYS,MY,National,1,,,"New Task Force, Bureau or Administrative Configuration",New Task Force or Bureau (i.e. establishment of a temporary body),,"",Malaysia,All countries,,,,,All Residents (Citizen Residents + Foreign Residents),,,Mandatory (Unspecified/Implied),"Ministry/Department of Foreign Affairs,Other (Please specify in the text box)",49.5963560095573,46.5705018022034,42.4789347715437,2,https://www.malaymail.com/news/malaysia/2020/03/13/foreign-ministry-sets-up-covid-19-task-force-confirms-11-cases-of-malaysian/1846131 ; https://www.bharian.com.my/berita/nasional/2020/03/664992/wisma-putra-sahkan-11-rakyat-malaysia-positif-covid-19-di-luar-negara,2020-12-26,2020-12-26T05:21:52Z
R_r856OSNuKVtWyv7Cj,7187803,new_entry,original,,,"On May 19th, Malaysian police have formed a special task force to identify individuals travelling interstate without permission to celebrate Aidilfitri across the country, says Inspector-General of Police Abdul Hamid Bador.",2020-05-19,2020-05-19,,Malaysia,MYS,MY,National,1,,,"New Task Force, Bureau or Administrative Configuration",New Task Force or Bureau (i.e. establishment of a temporary body),,"",Malaysia,,,,,,All Residents (Citizen Residents + Foreign Residents),,,Mandatory (Unspecified/Implied),Police,,,,,https://www.malaysiakini.com/news/526357,2020-05-29,2020-05-29T13:57:20Z
R_ahs2KJes3VeSvxDNA,8982296,new_entry,original,,,"March 22 — Forty-six Malaysian nationals have been repatriated from Iran today through the third Humanitarian Assistance and Disaster Relief (HADR) mission following the Covid-19 outbreak. The flight chartered specifically for the Humanitarian Assistance and Disaster Relief (HADR) mission initiated by the Malaysian government landed at 6.35am, according to the National Disaster Management Agency. All passengers had undergone health screening at the Air Disaster Unit at the KLIA before being ferried to the monitoring centre in Bandar Enstek, Nilai, Negeri Sembilan, where they will undergo a 14-day quarantine.",2020-03-13,2020-03-22,2020-03-22,Malaysia,MYS,MY,National,0,,,Other Policy Not Listed Above,,Repatriation of Malaysians stranded in Iran by Humanitarian Assistance and Disaster Relief (HADR) mission,"",Iran,"One or more countries, but not all countries",,,,,All Citizens (Citizen Residents + Citizen Travelers),Inbound,Not Applicable,Voluntary/Recommended but No Penalties,"National Government,Ministry/Department of Health,Ministry/Department of Foreign Affairs,Other (Please specify in the text box)",50.2568571445642,46.2015377983767,42.1594243134148,1,https://www.malaymail.com/news/malaysia/2020/03/13/pm-putrajaya-working-to-bring-malaysians-in-italy-iran-back-home/1846341 ; https://www.malaymail.com/news/malaysia/2020/03/22/special-aircraft-on-evacuation-mission-from-tehran-arrives-in-klia/1848851 ; https://www.malaymail.com/news/malaysia/2020/03/22/46-malaysians-safely-repatriated-from-iran/1848925,2020-12-23,2020-12-23T19:21:29Z
R_3fuS4ggsXHGOs6FNA,2440684,new_entry,original,,,"March 26 - Eighty-one Malaysians and their families were brought back from Italy this morning, said Deputy Foreign Minister Kamarudin Jaafar. In a statement issued today, Kamarudin said the special AirAsia flight which brought them home landed at Kuala Lumpur International Airport at 10am. 
Kamarudin said the repatriation mission was the result of close collaboration between the Foreign Ministry, National Disaster Management Agency (Nadma), the Health Ministry, the Malaysian Embassy in Rome and Holy See as well as other related agencies.
He added that upon arrival in Malaysia, the group began their 14-day quarantine process at the Higher Education Leadership Academy in Nilai as required by the Health Ministry.
",2020-03-21,2020-03-26,2020-03-26,Malaysia,MYS,MY,National,0,,,Other Policy Not Listed Above,,Repatriation of Malaysians stranded in Italy by special chartered flight,"",Italy,"One or more countries, but not all countries",,,,,All Citizens (Citizen Residents + Citizen Travelers),Inbound,Not Applicable,Voluntary/Recommended but No Penalties,"National Government,Ministry/Department of Health,Ministry/Department of Foreign Affairs,Other (Please specify in the text box)",51.1420761333603,46.1269078946391,41.3793858800724,1,https://www.malaysiakini.com/news/516912 ; https://www.nst.com.my/news/nation/2020/03/576759/govt-mulls-ways-bring-malaysians-home-italy-permission-land-revoked,2020-12-25,2020-12-25T02:06:02Z
R_2rjRCwgzeM7fiVRNA,3355631,new_entry,original,,,"March 26 — A total of 225 Malaysians based in Bangladesh safely arrived at the KL International Airport at 5.46am today, said Deputy Foreign Minister Datuk Kamarudin Jaffar. He said they were made up of 130 students, 55 officers working at the Malaysian Field Hospital in Cox’s Bazar, 35 expatriates and five officers of the Malaysian High Commission in Dhaka.",2020-03-24,2020-03-26,2020-03-26,Malaysia,MYS,MY,National,0,,,Other Policy Not Listed Above,,Repatriation of Malaysians stranded in Bangladesh using special chartered flight,"",Bangladesh,"One or more countries, but not all countries",,,,,All Citizens (Citizen Residents + Citizen Travelers),Inbound,Not Applicable,Voluntary/Recommended but No Penalties,"National Government,Ministry/Department of Health,Ministry/Department of Foreign Affairs,Other (Please specify in the text box)",51.1420761333603,46.1269078946391,41.3793858800724,1,https://www.malaymail.com/news/malaysia/2020/03/24/hishammuddin-270-malaysians-in-bangladesh-to-return-soon/1849642 ; https://www.malaymail.com/news/malaysia/2020/03/26/225-malaysians-arrive-at-klia-from-bangladesh/1850459,2020-12-24,2020-12-24T20:02:10Z
R_41m3tqSF0QefX0tNA,6042392,new_entry,original,,,"March 28 - A total of 86 Malaysians will be flown from Cairo, Egypt on a Brunei government-chartered plane to Bandar Seri Begawan tomorrow.  They would be brought home aboard Malaysia Airlines (MAS) special flight on the same day and are expected to arrive at the Kuala Lumpur International Airport at 11.25 am tomorrow.",2020-03-27,2020-03-29,2020-12-29,Malaysia,MYS,MY,National,0,,,Other Policy Not Listed Above,,Repatriation of Malaysians stranded in Cairo,"",Egypt,"One or more countries, but not all countries",,,,,All Citizens (Citizen Residents + Citizen Travelers),Inbound,Not Applicable,Voluntary/Recommended but No Penalties,"National Government,Ministry/Department of Foreign Affairs,Other (Please specify in the text box)",51.7597427227033,46.2615132436584,41.2173704554037,1,https://www.malaymail.com/news/malaysia/2020/03/27/govt-to-bring-home-51-malaysians-stranded-in-cairo-with-help-from-brunei/1850766 ; https://www.malaymail.com/news/malaysia/2020/03/28/kamarudin-86-malaysians-stranded-in-egypt-to-return-home-tomorrow/1851171,2020-12-24,2020-12-24T11:49:28Z
R_3lYtFIuUtn0GfyTNA,9413918,new_entry,original,,,"March 29 — A total of eighteen Malaysians who were reported to be stranded in the Maldives as a result of the global cross-border travel restrictions amid the Covid-19 pandemic have safely arrived in Malaysia in a special aircraft early this morning. All of them, comprising tourists and those working in the Maldives, departed from the capital city Male and arrived at the Sultan Salahuddin Abdul Aziz Shah Airport in Subang at 1.35am local time via Weststar’s Boeing Business Jet BBJ 767 aircraft.

",2020-03-29,2020-03-29,2020-03-29,Malaysia,MYS,MY,National,0,,,Other Policy Not Listed Above,,Repatriation of several Malaysians stranded in Maldives by special chartered flight,"",Maldives,"One or more countries, but not all countries",,,,,All Citizens (Citizen Residents + Citizen Travelers),Inbound,Not Applicable,Voluntary/Recommended but No Penalties,"National Government,Ministry/Department of Foreign Affairs",51.7597427227033,46.2615132436584,41.2173704554037,1,https://www.malaysiakini.com/news/517512 ; https://www.freemalaysiatoday.com/category/bahasa/2020/03/29/18-rakyat-malaysia-terkandas-di-maldives-pulang-ke-tanah-air/,2020-12-26,2020-12-26T04:23:03Z
R_1rBmJFyNpeXUvQmNA,4288680,new_entry,original,,,"March 19 ― In Malaysia, electricity bill discounts will be given to all consumers for six months from April 1 to September 30, Minister of Energy and Natural Resources Datuk Dr Shamsul Anuar Nasarah said today. According to him, the government has agreed to provide a 15 per cent discount on electricity usage to six selected business sectors, namely hotels; travel and tourism agencies; shopping complexes; convention centres; theme parks; and local airline offices. Other commercial, industrial and agricultural accounts as well as domestic consumers would also receive a two percent discount during the same period. 
The cost of the electricity rebate in Peninsular Malaysia will be borne by the government through the Electricity Industry Fund, while for Sabah and Sarawak, it will be borne directly by the Federal government.",2020-03-19,2020-04-01,2020-09-30,Malaysia,MYS,MY,National,0,,,Other Policy Not Listed Above,,Discount on electricity bills for domestic consumers and some business sectors,"",Malaysia,,,,,,,,,Voluntary/Recommended but No Penalties,"National Government,Other (Please specify in the text box)",51.4137075525,46.26894988673,40.7160171718505,1,https://www.malaymail.com/news/malaysia/2020/03/19/minister-six-months-electricity-bill-discount-beginning-april-1/1848223 ; https://www.sinarharian.com.my/article/74538/BERITA/Nasional/Enam-bulan-diskaun-bil-elektrik-mulai-1-April,2020-12-25,2020-12-25T03:58:35Z
R_3HhIJnqw0tcuiU2NA,5911615,new_entry,original,,,"March 24 — Bank Negara Malaysia (BNM) has ordered an automatic six-month moratorium on all bank loans — except for credit card balances — for those affected by the Covid-19 outbreak. BNM said the measure was designed to ease the cash flow of small and medium-sized enterprises and individuals that are likely to be most affected by Covid-19.

“Banking institutions will grant an automatic moratorium on all loan/financing repayments/payments, principal and interest (except for credit card balances) by individuals and SME borrowers/customers for a period of six months from April 1, 2020,” the statement read.

",2020-03-24,2020-04-01,2020-10-01,Malaysia,MYS,MY,National,0,,,Other Policy Not Listed Above,,Automatic moratorium on loan repayments will be granted to small and medium enterprises (SMEs) and individuals to relieve the burden on businesses and households that are expected to be affected by the Covid-19 outbreak.,"",Malaysia,,,,,,,,,Voluntary/Recommended but No Penalties,"National Government,Other (Please specify in the text box)",51.4137075525,46.26894988673,40.7160171718505,1,https://www.malaymail.com/news/malaysia/2020/03/24/bank-negara-announces-automatic-six-month-moratorium-on-all-bank-loans-exce/1849820 ; https://www.theedgemarkets.com/article/bnm-grant-sixmonth-automatic-moratorium-all-loans-individuals-and-smes-except-credit-cards,2020-12-24,2020-12-24T19:41:16Z
R_2ZVPuIFOX4bkbSLNA,756907,new_entry,original,,,"March 16 - Malaysian government will provide monthly financial aid of RM600 for workers forced to go on unpaid leave beginning March 1, for a maximum of 6 months. The initiative is for those with an income not exceeding RM4,000 per month. 

Other key measures announced are a one-off RM600 cash handout to public transport workers, a monthly special allowance of RM400 for medical doctors and health workers, and RM200 for immigration officers.",2020-03-16,2020-04-01,2020-09-30,Malaysia,MYS,MY,National,0,,,Other Policy Not Listed Above,,"Economic stimulus package: monthly financial aid to help workers who are forced to take no-pay leave, one-off cash handout to public transport workers, monthly special allowance for medical doctors and health workers and for immigration officers.","",Malaysia,,,,,,,,,Voluntary/Recommended but No Penalties,"National Government,Other (Please specify in the text box)",51.4137075525,46.26894988673,40.7160171718505,1,https://www.malaymail.com/news/malaysia/2020/03/16/govt-announces-rm600-aid-for-workers-on-no-pay-leave-discounts-on-electrici/1847127 ; https://www.freemalaysiatoday.com/category/nation/2020/03/16/rm600-a-month-govt-aid-for-those-forced-to-take-unpaid-leave/,2020-12-25,2020-12-25T02:39:15Z
R_3KZo477Kyv5E6fINA,1059384,new_entry,original,,,"April 2 — Seventy pregnant Malaysian women working in Singapore along with 10 children and people with disabilities were brought home today by bus via the Johor causeway. The trip was made possible by the Malaysian High Commission in Singapore.
Malaysian Deputy High Commissioner to Singapore Muhd Radzi Jamaluddin told Bernama that special attention was given to the group as some of the women were almost due to deliver.

",2020-04-02,2020-04-02,2020-04-02,Malaysia,MYS,MY,National,0,,,Other Policy Not Listed Above,,Pregnant Malaysian women working in Singapore were brought back to Malaysia,"",Singapore,"One or more countries, but not all countries",,,,,All Citizens (Citizen Residents + Citizen Travelers),Inbound,Buses,Voluntary/Recommended but No Penalties,"National Government,Ministry/Department of Health,Other (Please specify in the text box)",51.5863973881615,46.1621545843856,40.5488662108267,1,https://www.malaymail.com/news/malaysia/2020/04/02/mco-pregnant-women-children-brought-home-from-singapore/1852962 ; https://www.bharian.com.my/dunia/asean/2020/04/672329/70-wanita-hamil-warga-malaysia-di-bawa-pulang,2020-12-27,2020-12-27T01:57:23Z
R_27fegovcfpQyHTiNA,2193443,new_entry,original,,,"April 2 - Malaysia launched a rescue flight into Medan, Indonesia to repatriate a total of 158 Malaysian citizens, with 144 of them being students studying in Medan, Aceh and Sumatera. They arrived in KLIA yesterday aboard MH865 at 5.50pm, operated by the Boeing 737-800 aircraft with 5 crew onboard.",2020-04-03,2020-04-02,2020-04-02,Malaysia,MYS,MY,National,0,,,Other Policy Not Listed Above,,"Repatriation of Malaysians stranded in Sumatera, Indonesia by special chartered flight","",Indonesia,"One or more countries, but not all countries",,,,,All Citizens (Citizen Residents + Citizen Travelers),Inbound,Flights,Voluntary/Recommended but No Penalties,"National Government,Ministry/Department of Foreign Affairs,Other (Please specify in the text box)",51.5863973881615,46.1621545843856,40.5488662108267,1,https://www.antaranews.com/berita/1399070/malaysia-pulangkan-160-warganya-dari-sumatera-terkait-covid-19 ; https://www.malaymail.com/news/malaysia/2020/04/03/malaysia-airlines-operates-rescue-flights-in-nepal-philippines/1853294,2020-12-27,2020-12-27T01:35:35Z
