record_id,policy_id,entry_type,correct_type,update_type,update_level,description,date_announced,date_start,date_end,country,ISO_A3,ISO_A2,init_country_level,domestic_policy,province,ISO_L2,city,type,type_sub_cat,type_text,institution_status,target_country,target_geog_level,target_region,target_province,target_city,target_other,target_who_what,target_direction,travel_mechanism,compliance,enforcer,index_high_est,index_med_est,index_low_est,index_country_rank,link,date_updated,recorded_date
R_3dDOriz0nhVTZ2lNA,2748049,new_entry,original,,,"On April 3, Fiji government imposed lockdown measures on the capital city of Suva.",2020-04-02,2020-04-03,2020-04-17,Fiji,FJI,FJ,Municipal,1,Central,,Suva,Lockdown,,,,Fiji,One or more cities within a country,,Central,Suva,,All Residents (Citizen Residents + Foreign Residents),,,Mandatory (Unspecified/Implied),National Government,52.1644272004018,50.5826654595481,48.7976791092844,31,https://www.garda.com/crisis24/news-alerts/328461/fiji-lockdown-to-be-imposed-on-suva-from-april-3-update-3,2020-08-18,2020-08-18T00:14:03Z
R_3LhdeMztCz8zwJINA,2748049,update,original,End of Policy,,"On April 3, Fiji government imposed lockdown measures on the capital city of Suva. On April 17, the Fiji government lifted lockdown measures. UPDATE: The original policy did not have an end date. It was then announced that the lockdown measure will be extended until April 17.",2020-04-16,2020-04-17,2020-04-17,Fiji,FJI,FJ,Municipal,1,Central,,Suva,Lockdown,,,,Fiji,One or more cities within a country,,Central,Suva,,All Residents (Citizen Residents + Foreign Residents),,,Mandatory (Unspecified/Implied),National Government,52.7337043787576,51.0224018157862,49.6791948560955,32,NA ; https://www.worldaware.com/covid-19-alert-fiji-maintains-social-distancing-april-16-lifts-lockdown-suva-april-17,2020-08-18,2020-08-18T00:19:21Z
R_1OOEyEBrG0dD6o1NA,4534954,new_entry,original,,,"On April 19, ""The Fijian Ministry of Health and Medical Services wishes to clarify that the Fijian Government will cover the costs for those individuals who will be kept at the government designated quarantine facilities upon their arrival into the country.""",2020-04-23,2020-04-19,,Fiji,FJI,FJ,National,1,,,,Other Policy Not Listed Above,,"While the policy is related to quarantine measures, the policy is not outlining quarantine restrictions. Rather the policy addresses the monetary cost of enforcing such quarantine restrictions.",,Fiji,"One or more countries, but not all countries",,,,,All Residents (Citizen Residents + Foreign Residents),,,Mandatory (Unspecified/Implied),Ministry/Department of Health,52.7994530737182,50.9862736649211,49.7671364107541,31,http://www.health.gov.fj/fijian-government-to-cater-for-cost-of-quarantine/,2020-08-03,2020-08-03T12:54:56Z
R_pS3DGzzg7KMVQ5PAw,9693707,new_entry,original,,,"On March 26, Fiji's Ministry of Education, Heritage and Arts ""has emailed an information package titled 'COVID-19 Information for Communities – Protecting Yourself and Your Family' to individual teacher email addresses to bring about more awareness without compromising their health and safety.""",2020-03-26,2020-03-26,2020-03-26,Fiji,FJI,FJ,National,1,,,,Public Awareness Measures,Disseminating information related to COVID-19 to the public that is reliable and factually accurate,,,Fiji,"One or more countries, but not all countries",,,,,All Residents (Citizen Residents + Foreign Residents),,,Voluntary/Recommended but No Penalties,Other (Please specify in the text box),51.2732309364302,50.1210822989221,48.8196845187671,33,http://www.education.gov.fj/2020/03/26/lets-fulfil-our-civic-responsibility/,2020-08-10,2020-08-10T22:28:04Z
R_bdP74so6JLhq4IpAw,7998303,new_entry,original,,,"On April 1, the Fijian Government has opened a toll-free helpline for the public to call for all COVID-19 related queries and concerns.",2020-04-01,2020-04-01,,Fiji,FJI,FJ,National,1,,,,Public Awareness Measures,Disseminating information related to COVID-19 to the public that is reliable and factually accurate,,,Fiji,"One or more countries, but not all countries",,,,,All Residents (Citizen Residents + Foreign Residents),,,Mandatory with Exceptions (Please list exceptions in the text entry),National Government,52.4049304967968,50.4887213562042,49.0821341292036,31,http://www.health.gov.fj/toll-free-helpline-158-for-covid-19-response/,2020-08-02,2020-08-02T23:42:27Z
R_sbBdARNypovTNdfEo,8151670,new_entry,original,,,Fiji extends the duration of the quarantine for all people to 28 days. The gouvernment pays for the food the people need during this time.,2020-04-18,2020-04-18,,Fiji,FJI,FJ,National,0,,,,Quarantine,Self-Quarantine (i.e. quarantine at home),,,All countries,All countries,,,,,All (Travelers + Residents),,All kinds of transport,Mandatory (Unspecified/Implied),"National Government,Ministry/Department of Health",52.3919493215165,51.1308545550368,49.8512294448587,33,http://www.health.gov.fj/twenty-eight-day-self-quarantine-crucial-to-contain-the-spread-of-covid-19/,2020-04-28,2020-04-28T11:23:12Z
R_sbBdARNypovTNdfBk,8151670,new_entry,original,,,Fiji extends the duration of the quarantine for all people to 28 days. The gouvernment pays for the food the people need during this time.,2020-04-18,2020-04-18,,Fiji,FJI,FJ,National,0,,,,Quarantine,Government Quarantine (i.e. quarantine at a government hotel or facility),,,All countries,All countries,,,,,All (Travelers + Residents),,All kinds of transport,Mandatory (Unspecified/Implied),"National Government,Ministry/Department of Health",52.3919493215165,51.1308545550368,49.8512294448587,33,http://www.health.gov.fj/twenty-eight-day-self-quarantine-crucial-to-contain-the-spread-of-covid-19/,2020-04-28,2020-04-28T11:23:12Z
R_2ASaR6ica8p8Rj5NA,6269699,new_entry,correction,,,"March 25, Fiji announces a Lockdown to Lautoka area.",2020-03-25,2020-03-25,,Fiji,FJI,FJ,Provincial,1,Central,,,Restriction and Regulation of Businesses,,,,Fiji,,,,,,All Residents (Citizen Residents + Foreign Residents),,,Mandatory (Unspecified/Implied),National Government,51.1278035232632,49.9293002171753,48.6256587564622,32,NA ; http://www.health.gov.fj/statement-by-the-hon-prime-minister-on-fifth-covid-19-case/,2020-05-18,2020-05-18T10:00:57Z
R_YS9JWbpbue0VHu9NA,8952897,new_entry,original,,,Fiji bans any gathering greater than 20 persons.,2020-03-23,2020-03-23,,Fiji,FJI,FJ,National,1,,,,Restrictions of Mass Gatherings,,,,Fiji,,,,,,All Residents (Citizen Residents + Foreign Residents),,,Mandatory with Fines,National Government,51.1011363832261,49.6434170876273,48.428301146729,27,https://www.rnz.co.nz/international/pacific-news/412756/fiji-to-be-under-nationwide-curfew-from-monday,2020-04-01,2020-04-01T09:17:38Z
R_1EZmUNTbtazZO1mNA,895289,update,original,,Strengthening,Fiji bans any social gathering. UPDATE: Any form of social gathering is prohibited in Fiji,2020-04-02,2020-04-02,,Fiji,FJI,FJ,,1,,,,Restrictions of Mass Gatherings,,,,,,,,,,All Residents (Citizen Residents + Foreign Residents),,,,,52.1988870383715,50.5373231549038,49.0367965995173,32,http://www.health.gov.fj/friday-april-17-suva-lockdown-ends-but-fight-against-covid-19-continues/,2020-05-01,2020-05-01T10:31:20Z
R_21ibM7IVAV4MmqVNA,895289,update,original,,Relaxing,"FIji allows social gatherings up to 20 people. UPDATE: Social gatherings were competely banned, mow they are allowed with less than 20 People.",2020-04-24,2020-04-26,,Fiji,FJI,FJ,,1,,,,Restrictions of Mass Gatherings,,,,,,,,,,All Residents (Citizen Residents + Foreign Residents),,,,,54.0788673097911,51.0185651326396,48.7651272015888,30,https://www.fijivillage.com/news/Govt-has-delivered-thousands-of-food-ration-packs-to-those-affected-by-TC-Harold-5rxf84/,2020-04-24,2020-04-24T11:45:23Z
R_2uJP1Wr9mV6RDizAq,5236152,new_entry,original,,,"On April 27, Fiji is temporarily suspending all sporting events.",2020-04-28,2020-04-27,,Fiji,FJI,FJ,National,1,,,,Restrictions of Mass Gatherings,Cancellation of a recreational or commercial event,,,Fiji,"One or more countries, but not all countries",,,,,All Residents (Citizen Residents + Foreign Residents),,,Mandatory (Unspecified/Implied),National Government,53.8952998133605,51.0937353927683,48.8110194855854,32,http://www.health.gov.fj/all-sporting-events-remain-temporarily-suspended/ ; http://www.health.gov.fj/media-center/novel-coronavirus-covid-19/media-releases/,2020-08-03,2020-08-03T21:12:39Z
R_2uJP1Wr9mV6RDizDi,5236152,new_entry,original,,,"On April 27, Fiji is temporarily suspending all sporting events.",2020-04-28,2020-04-27,,Fiji,FJI,FJ,National,1,,,,Restrictions of Mass Gatherings,Postponement of a recreational or commercial event,,,Fiji,"One or more countries, but not all countries",,,,,All Residents (Citizen Residents + Foreign Residents),,,Mandatory (Unspecified/Implied),National Government,53.8952998133605,51.0937353927683,48.8110194855854,32,http://www.health.gov.fj/all-sporting-events-remain-temporarily-suspended/ ; http://www.health.gov.fj/media-center/novel-coronavirus-covid-19/media-releases/,2020-08-03,2020-08-03T21:12:39Z
R_27maBJI3Nx6QphzAk,1061514,new_entry,original,,,"Effective from Friday, the 26th of June, Fijian government is allowing houses of worship to re-open their doors to 100 worshippers at a time.",2020-06-21,2020-06-26,,Fiji,FJI,FJ,National,1,,,,Restrictions of Mass Gatherings,Attendance at religious services restricted (e.g. mosque/church closings),,,Fiji,"One or more countries, but not all countries",,,,,All Residents (Citizen Residents + Foreign Residents),,,Mandatory (Unspecified/Implied),National Government,,,,,http://www.health.gov.fj/prime-minister-voreqe-bainimaramas-statement-on-covid-safe-economic-recovery/,2020-08-10,2020-08-10T22:08:34Z
R_NVo7boBVofMqPwlNA,923147,new_entry,correction,,,"Fiji, March 17:  In the interest of preventing an outbreak of COVID-19 in Fiji, it is vital that all Fijians heed the call from the Honourable Prime Minister to wash your hands regularly and thoroughly with soap and water and limit person-to-person contact as much as possible.",2020-03-17,2020-03-17,,Fiji,FJI,FJ,National,1,,,,Social Distancing,,,,Fiji,,,,,,All Residents (Citizen Residents + Foreign Residents),,,Voluntary/Recommended but No Penalties,National Government,50.332009004088,48.7471140675611,46.3033848823107,23,NA ; http://www.immigration.gov.fj,2020-05-17,2020-05-17T13:01:03Z
