record_id,policy_id,entry_type,correct_type,update_type,update_level,description,date_announced,date_start,date_end,country,ISO_A3,ISO_A2,init_country_level,domestic_policy,province,city,type,type_sub_cat,type_text,institution_status,target_country,target_geog_level,target_region,target_province,target_city,target_other,target_who_what,target_direction,travel_mechanism,compliance,enforcer,index_high_est,index_med_est,index_low_est,index_country_rank,link,date_updated,recorded_date
R_3nwoHMSdhwyBJyMNA,8846279,new_entry,original,,,"March 9 - As an anti-disinformation measure, state of Johor police in Malaysia have opened six investigation papers in connection with false reports on the Covid-19 infection after police received six reports on the matter between January and March 7 this year. Four of the cases were being investigated under Sections 203 and 505 of the Penal Code and the other two under Section 233 of the Communications and Multimedia Act 1998 (CMA). Sections 203 and 505 of the Penal Code deal with giving false information and statements conducing to public mischief, while Section 233 of the CMA is regarding improper use of network facilities or network service.

",2020-03-09,2020-03-09,,Malaysia,MYS,MY,Provincial,0,Johor,,Anti-Disinformation Measures,,,"",Malaysia,,,Johor,,,,,,"Mandatory with Legal Penalties (Jail Time),Mandatory with Fines","Provincial/State Government,Police",51.1020509407504,46.3390994803653,42.3008652090692,1,https://www.malaymail.com/news/malaysia/2020/03/09/johor-police-probing-six-cases-of-false-reports-on-covid-19/1844738 ; https://www.astroawani.com/berita-malaysia/polis-johor-siasat-enam-kes-berita-palsu-covid19-232997,2020-12-14,2020-12-14T19:18:23Z
R_2THOiPaIeqQ0ZOmNA,4960503,new_entry,original,,,March 16 - The Malaysia Communications and Multimedia Commission (MCMC) has launched an official Telegram channel for the Sebenarnya.my news portal as part of a measure to curb the spread of fake news regarding Covid-19 on social media. Members of the public can join the Telegram channel through https://t.me/sebenarnyamy and receive the latest and most accurate information about Covid-19 verified by authorities such as the Ministry of Health.,2020-03-16,2020-03-16,,Malaysia,MYS,MY,National,0,,,Anti-Disinformation Measures,,,"",Malaysia,,,,,,,,,Voluntary/Recommended but No Penalties,"National Government,Other (Please specify in the text box)",49.2341531141848,46.7346561211786,42.8072977790968,2,https://www.hmetro.com.my/mutakhir/2020/03/555244/covid-19-sertai-telegram-skmm-tangani-berita-palsu ; https://www.thestar.com.my/tech/tech-news/2020/03/16/covid-19-mcmc-launches-telegram-channel-for-anti-fake-news-portal-sebenarnyamy,2020-12-15,2020-12-15T04:23:04Z
R_eL0h0gTRMkabNuxNA,8177235,new_entry,original,,,"March 23 - The Malaysian Communications and Multimedia Commission (MCMC), with the cooperation of the police, is investigating the cases of individuals alleged to have spread fake news about COVID-19. The commission said the investigations are being conducted under section 233 of the Communications and Multimedia Act 1988 which carries a maximum fine of RM50,000 or one year of imprisonment or both, upon conviction. To date, the MCMC has received 43 reports from members of the public, with 18 suspects identified. Six of them, including a celebrity, have been charged in court under Section 505 (b) of the Penal Code which carries a maximum jail term of two years or a fine or both, if found guilty.",2020-01-25,2020-03-18,,Malaysia,MYS,MY,National,0,,,Anti-Disinformation Measures,,,"",Malaysia,,,,,,,,,"Mandatory with Legal Penalties (Jail Time),Mandatory with Fines","National Government,Police,Other (Please specify in the text box)",49.6801917407872,46.6666744309057,42.7471979209896,2,https://www.mcmc.gov.my/en/media/press-clippings/covid-19-fake-news-mcmc-police-investigating-five ; https://www.malaymail.com/news/malaysia/2020/03/22/communications-ministry-probes-42-cases-of-fake-news-on-covid-19-and-mco/1849028 ; https://www.malaymail.com/news/malaysia/2020/03/18/police-say-already-opened-40-cases-on-covid-19-fake-news-since-january-25/1847756,2020-12-18,2020-12-18T05:49:41Z
R_viqGXijPmp6ytnXNA,7220675,new_entry,original,,,"Malaysian government's Quick Response Team (PRP) was set up on March 24 to counter fake news pertaining to the movement control order (MCO), Bantuan Prihatin Nasional (BPN), Welfare Department aid, and other hotly debated topics in the wake of the Covid-19 pandemic. The focus of PRP is to monitor and clarify suspicious news as well as announcements and to obtain clarification from those involved so as not to cause concern and apprehension among the public. PRP which comprised of department and agency officers under the Ministry of Communications and Multimedia in cooperation with the National Security Council (NSC) would continue to function throughout the MCO.",2020-04-21,2020-03-24,,Malaysia,MYS,MY,National,0,,,Anti-Disinformation Measures,,,"",Malaysia,,,,,,,,,Voluntary/Recommended but No Penalties,"National Government,Other (Please specify in the text box)",51.0275400246002,46.2321246584111,41.4557765810081,1,https://www.malaysiakini.com/news/521875 ; https://www.mcmc.gov.my/en/media/press-clippings/saifuddin-205-fake-news-items-%E2%80%98busted%E2%80%99-by-communic,2020-12-17,2020-12-17T22:59:39Z
R_2CUr0XLtxkOOpyCNA,9807429,new_entry,original,,,"March 24 — Individuals who deliberately conceal important information about Covid-19 from hospital authorities, and thereby pose a risk to staff and medical facilities, are liable to be charged under Section 22 (d) of the Prevention and Control of Infectious Diseases Act 1988. The penalty comprises a fine or imprisonment of up to two years or both.

Doctors, nurses and other hospital personnel who are the front liners, have a higher risk of contracting the infection, so they should report to the police if they encounter individuals concealing important information about their contact history with individuals infected with Covid-19.",2020-03-24,2020-03-24,,Malaysia,MYS,MY,National,0,,,Anti-Disinformation Measures,,,"",Malaysia,,,,,,,,,"Mandatory with Legal Penalties (Jail Time),Mandatory with Fines","National Government,Police",51.0275400246002,46.2321246584111,41.4557765810081,1,https://www.malaymail.com/news/malaysia/2020/03/24/malaysian-bar-those-who-withhold-information-from-hospitals-could-be-fined/1849661 ; https://www.hmetro.com.my/mutakhir/2020/03/557872/covid-19-denda-penjara-jika-sembunyi-maklumat,2020-12-23,2020-12-23T08:41:59Z
R_DFSOK8TwRdvV8HvDi,995151,new_entry,original,,,"Muhyiddin added that all nurseries, government and private schools, including boarding schools, international schools, tahfiz centres as well as primary, secondary and pre-university education institutions will be closed. This also includes all public and private universities as well as vocational training centres.

",2020-03-16,2020-03-18,2020-03-31,Malaysia,MYS,MY,National,1,,,Closure and Regulation of Schools,Preschool or childcare facilities (generally for children ages 5 and below),,Preschool or childcare facilities closed/locked down,Malaysia,,,,,,All Residents (Citizen Residents + Foreign Residents),,,Mandatory (Unspecified/Implied),National Government,49.6801917407872,46.6666744309057,42.7471979209896,2,https://www.thestar.com.my/news/nation/2020/03/16/malaysia-announces-restricted-movement-measure-after-spike-in-covid-19-cases?utm_source=outbreak.my,2020-09-23,2020-09-23T12:59:18Z
R_DFSOK8TwRdvV8HvDk,995151,new_entry,original,,,"Muhyiddin added that all nurseries, government and private schools, including boarding schools, international schools, tahfiz centres as well as primary, secondary and pre-university education institutions will be closed. This also includes all public and private universities as well as vocational training centres.

",2020-03-16,2020-03-18,2020-03-31,Malaysia,MYS,MY,National,1,,,Closure and Regulation of Schools,Primary Schools (generally for children ages 10 and below),,Primary Schools closed/locked down,Malaysia,,,,,,All Residents (Citizen Residents + Foreign Residents),,,Mandatory (Unspecified/Implied),National Government,49.6801917407872,46.6666744309057,42.7471979209896,2,https://www.thestar.com.my/news/nation/2020/03/16/malaysia-announces-restricted-movement-measure-after-spike-in-covid-19-cases?utm_source=outbreak.my,2020-09-23,2020-09-23T12:59:18Z
R_DFSOK8TwRdvV8HvEj,995151,new_entry,original,,,"Muhyiddin added that all nurseries, government and private schools, including boarding schools, international schools, tahfiz centres as well as primary, secondary and pre-university education institutions will be closed. This also includes all public and private universities as well as vocational training centres.

",2020-03-16,2020-03-18,2020-03-31,Malaysia,MYS,MY,National,1,,,Closure and Regulation of Schools,Secondary Schools (generally for children ages 10 to 18),,Secondary Schools closed/locked down,Malaysia,,,,,,All Residents (Citizen Residents + Foreign Residents),,,Mandatory (Unspecified/Implied),National Government,49.6801917407872,46.6666744309057,42.7471979209896,2,https://www.thestar.com.my/news/nation/2020/03/16/malaysia-announces-restricted-movement-measure-after-spike-in-covid-19-cases?utm_source=outbreak.my,2020-09-23,2020-09-23T12:59:18Z
R_DFSOK8TwRdvV8HvBr,995151,new_entry,original,,,"Muhyiddin added that all nurseries, government and private schools, including boarding schools, international schools, tahfiz centres as well as primary, secondary and pre-university education institutions will be closed. This also includes all public and private universities as well as vocational training centres.

",2020-03-16,2020-03-18,2020-03-31,Malaysia,MYS,MY,National,1,,,Closure and Regulation of Schools,Higher education institutions (i.e. degree granting institutions),,Higher education institutions closed/locked down,Malaysia,,,,,,All Residents (Citizen Residents + Foreign Residents),,,Mandatory (Unspecified/Implied),National Government,49.6801917407872,46.6666744309057,42.7471979209896,2,https://www.thestar.com.my/news/nation/2020/03/16/malaysia-announces-restricted-movement-measure-after-spike-in-covid-19-cases?utm_source=outbreak.my,2020-09-23,2020-09-23T12:59:18Z
R_1C7QIkzj9fqgzwFNA,4213225,new_entry,original,,,"Malaysians will be barred from leaving the country and restrictions placed on the entry of all tourists and foreign visitors into Malaysia.
",2020-03-16,2020-03-18,2020-03-31,Malaysia,MYS,MY,National,0,,,External Border Restrictions,,,"",Malaysia,All countries,,,,,All (Travelers + Residents),Inbound/Outbound,All kinds of transport,Mandatory (Unspecified/Implied),National Government,49.6801917407872,46.6666744309057,42.7471979209896,2,https://www.thestar.com.my/news/nation/2020/03/16/malaysia-announces-restricted-movement-measure-after-spike-in-covid-19-cases?utm_source=outbreak.my,2020-09-21,2020-09-21T20:39:45Z
R_eVy96HrWfMgDS4pEr,1861326,new_entry,original,,,"March 19 ― The state government of Sarawak, Malaysia has added three more quarantine centres for persons under investigation (PUIs) for suspected Covid-19 cases, Deputy Chief Minister Datuk Amar Douglas Uggah said today. He said the new centres are the Institut Kemajuan Desa, Institut Tadbiran Awam Negara, Sarawak and Tun Abdul Razak Campus Teacher's Training College, all in Kota Samarahan.

He said all places would be guarded around the clock by security personnel and would be completely out of bond to the public. The other quarantine centres in Sarawak are at the Kemuyang Youth Camp in Sibu, Similajau National Park in Bintulu, and the Petronas Games Village in Miri.",2020-03-19,2020-03-19,,Malaysia,MYS,MY,Provincial,0,Sarawak,,Health Resources,Temporary Quarantine Centers,,"",Malaysia,,,Sarawak,,,,,,Voluntary/Recommended but No Penalties,Provincial/State Government,49.8040006213097,46.4773085595602,42.8158232271261,1,https://www.thestar.com.my/news/nation/2020/03/19/sarawak-identifies-three-more-covid-19-quarantine-centres ; https://www.malaymail.com/news/malaysia/2020/03/19/sarawak-adds-more-quarantine-centres-for-covid-19-suspects/1848211,2020-12-22,2020-12-22T21:56:59Z
R_2veNUfS5WMYB1xSEr,2859591,new_entry,original,,,"March 21 - In Malaysia, just over 400 sites, mostly government buildings, have been gazetted as quarantine stations to house Covid-19 patients as part of the government’s contingency plans.The buildings include community colleges, polytechnic colleges, teacher training institutions, government training centres and academies, the Seameo-Recsam campus in Penang, Tabung Haji hotel in Penang and the Hotel UiTM in Dungun.",2020-03-21,2020-03-21,,Malaysia,MYS,MY,National,0,,,Health Resources,Temporary Quarantine Centers,,"",Malaysia,,,,,,,,,Voluntary/Recommended but No Penalties,"National Government,Ministry/Department of Health",50.5296232125708,46.2444199082076,42.2538968671935,1,https://www.malaymail.com/news/malaysia/2020/03/21/all-409-gazetted-covid-19-quarantine-sites/1848837 ; https://www.freemalaysiatoday.com/category/nation/2020/03/21/409-govt-buildings-to-be-used-as-quarantine-stations/,2020-12-25,2020-12-25T04:19:18Z
R_3nMWnPHIHov3je4Cf,3162947,new_entry,original,,,"March 22 - The Malaysian Finance Ministry has exempted certain types of face masks from import duty and sales tax, effective March 23.

In a statement issued by the Royal Malaysian Customs Department, the MoF has agreed for registered manufacturers to be exempted from charging a sales tax on the face masks.

The exemptions are in accordance with Section 14(2) of the Customs Act 1967 and Section 35(3) (a) of the Sales Tax Act 2018, and will be in place until further notice by the MoF, pending the end of the Covid-19 pandemic as determined by the government.",2020-03-22,2020-03-23,,Malaysia,MYS,MY,National,0,,,Health Resources,Masks,,"",Malaysia,,,,,,,,,Voluntary/Recommended but No Penalties,"National Government,Other (Please specify in the text box)",50.9098294011487,46.1917509751006,42.0191875853321,1,https://www.treasury.gov.my/index.php/en/gallery-activities/news/item/6080-bernama-import-duty-and-sales-tax-exemption-on-face-masks-for-domestic-market.html ; https://www.thestar.com.my/business/business-news/2020/03/22/face-masks-exempted-from-import-duty-and-sales-tax,2020-12-23,2020-12-23T09:08:37Z
R_291hSR88dqBU3EoAy,3958210,new_entry,original,,,"March 23 — Malaysian Ministry of Health said today around 3,000 retired nurses and medical practitioners have registered to come back to serve at the frontline and help to contain the Covid-19 outbreak.

Health director-general Datuk Dr Noor Hisham Abdullah said that the ministry is trying to establish the expertise of each of them to be able to deploy them appropriately.",2020-03-23,2020-03-23,,Malaysia,MYS,MY,National,0,,,Health Resources,Doctors,,"",Malaysia,,,,,,,,,Voluntary/Recommended but No Penalties,"National Government,Ministry/Department of Health",50.9098294011487,46.1917509751006,42.0191875853321,1,https://www.sinarharian.com.my/article/75399/KHAS/Covid-19/KKM-kenal-pasti-3000-staf-kontrak-bantu-tangani-Covid-19 ; https://www.malaymail.com/news/malaysia/2020/03/25/covid-19-3000-retired-nurses-to-return-to-service/1850174,2020-12-23,2020-12-23T08:18:39Z
R_291hSR88dqBU3EoCm,3958210,new_entry,original,,,"March 23 — Malaysian Ministry of Health said today around 3,000 retired nurses and medical practitioners have registered to come back to serve at the frontline and help to contain the Covid-19 outbreak.

Health director-general Datuk Dr Noor Hisham Abdullah said that the ministry is trying to establish the expertise of each of them to be able to deploy them appropriately.",2020-03-23,2020-03-23,,Malaysia,MYS,MY,National,0,,,Health Resources,Nurses,,"",Malaysia,,,,,,,,,Voluntary/Recommended but No Penalties,"National Government,Ministry/Department of Health",50.9098294011487,46.1917509751006,42.0191875853321,1,https://www.sinarharian.com.my/article/75399/KHAS/Covid-19/KKM-kenal-pasti-3000-staf-kontrak-bantu-tangani-Covid-19 ; https://www.malaymail.com/news/malaysia/2020/03/25/covid-19-3000-retired-nurses-to-return-to-service/1850174,2020-12-23,2020-12-23T08:18:39Z
R_2eXBpDY7Xw9rM1ZFf,3443963,new_entry,original,,,"March 24 — The Malaysian Ministry of Finance (MoF) has exempted import duty and sales tax for the purchase of medical and laboratory equipment, personal protective equipment (PPE) and disposable products by any parties donating to the Ministry of Health (MoH) to help address Covid-19. The import duty and sales tax exemption is effective from 0001 hours (12.01am) on March 25 (Wednesday) until a date to be notified later by the MoF after COVID-19 is declared contained by the government.

The import duty and sales tax exemption is also subject to contributors importing or making local purchases of taxable items by submitting an endorsement letter from the MoH to the Customs Department. The permit application must be made to the relevant ministries/ departments/ agencies, namely the MoH, Department of Environment and Atomic Energy Licensing Board (AELB).

Among the medical equipment exempted from import duty and sales tax are Infrared Thermometer, Thermal Scanner, ICU Ventilator, Portable Ventilator, Patient Monitor, Vital Sign Monitor, Syringe Pump, Infusion Pump, and Defibrillator. Other exempt lab equipment are Ealtime Thermal cycler, Sanger Sequence, Biological Safety Cabinet, Automated Inverted Microscope, Inverted Microscope, Lab type freezer, ELISA Reader, ELISA Washer and Automated Extractor Machine, PPEs (face and eye protection, gloves -- plastic gloves, rubber gloves for surgery), and disposables.",2020-03-24,2020-03-25,,Malaysia,MYS,MY,National,0,,,Health Resources,Ventilators,,"",Malaysia,,,,,,,,,Voluntary/Recommended but No Penalties,"National Government,Ministry/Department of Health,Other (Please specify in the text box)",50.7817313452556,46.2179212893549,41.9350108983693,1,"https://www.malaymail.com/news/malaysia/2020/03/24/medical-equipment-ppes-exempted-from-import-duty-sales-tax/1849818 ; https://www.treasury.gov.my/index.php/en/gallery-activities/news/item/6081-bernama-medical-equipment,-ppes-exempted-from-import-duty,-sales-tax.html",2020-12-23,2020-12-23T16:56:47Z
R_2eXBpDY7Xw9rM1ZDe,3443963,new_entry,original,,,"March 24 — The Malaysian Ministry of Finance (MoF) has exempted import duty and sales tax for the purchase of medical and laboratory equipment, personal protective equipment (PPE) and disposable products by any parties donating to the Ministry of Health (MoH) to help address Covid-19. The import duty and sales tax exemption is effective from 0001 hours (12.01am) on March 25 (Wednesday) until a date to be notified later by the MoF after COVID-19 is declared contained by the government.

The import duty and sales tax exemption is also subject to contributors importing or making local purchases of taxable items by submitting an endorsement letter from the MoH to the Customs Department. The permit application must be made to the relevant ministries/ departments/ agencies, namely the MoH, Department of Environment and Atomic Energy Licensing Board (AELB).

Among the medical equipment exempted from import duty and sales tax are Infrared Thermometer, Thermal Scanner, ICU Ventilator, Portable Ventilator, Patient Monitor, Vital Sign Monitor, Syringe Pump, Infusion Pump, and Defibrillator. Other exempt lab equipment are Ealtime Thermal cycler, Sanger Sequence, Biological Safety Cabinet, Automated Inverted Microscope, Inverted Microscope, Lab type freezer, ELISA Reader, ELISA Washer and Automated Extractor Machine, PPEs (face and eye protection, gloves -- plastic gloves, rubber gloves for surgery), and disposables.",2020-03-24,2020-03-25,,Malaysia,MYS,MY,National,0,,,Health Resources,Personal Protective Equipment,,"",Malaysia,,,,,,,,,Voluntary/Recommended but No Penalties,"National Government,Ministry/Department of Health,Other (Please specify in the text box)",50.7817313452556,46.2179212893549,41.9350108983693,1,"https://www.malaymail.com/news/malaysia/2020/03/24/medical-equipment-ppes-exempted-from-import-duty-sales-tax/1849818 ; https://www.treasury.gov.my/index.php/en/gallery-activities/news/item/6081-bernama-medical-equipment,-ppes-exempted-from-import-duty,-sales-tax.html",2020-12-23,2020-12-23T16:56:47Z
R_2eXBpDY7Xw9rM1ZCt,3443963,new_entry,original,,,"March 24 — The Malaysian Ministry of Finance (MoF) has exempted import duty and sales tax for the purchase of medical and laboratory equipment, personal protective equipment (PPE) and disposable products by any parties donating to the Ministry of Health (MoH) to help address Covid-19. The import duty and sales tax exemption is effective from 0001 hours (12.01am) on March 25 (Wednesday) until a date to be notified later by the MoF after COVID-19 is declared contained by the government.

The import duty and sales tax exemption is also subject to contributors importing or making local purchases of taxable items by submitting an endorsement letter from the MoH to the Customs Department. The permit application must be made to the relevant ministries/ departments/ agencies, namely the MoH, Department of Environment and Atomic Energy Licensing Board (AELB).

Among the medical equipment exempted from import duty and sales tax are Infrared Thermometer, Thermal Scanner, ICU Ventilator, Portable Ventilator, Patient Monitor, Vital Sign Monitor, Syringe Pump, Infusion Pump, and Defibrillator. Other exempt lab equipment are Ealtime Thermal cycler, Sanger Sequence, Biological Safety Cabinet, Automated Inverted Microscope, Inverted Microscope, Lab type freezer, ELISA Reader, ELISA Washer and Automated Extractor Machine, PPEs (face and eye protection, gloves -- plastic gloves, rubber gloves for surgery), and disposables.",2020-03-24,2020-03-25,,Malaysia,MYS,MY,National,0,,,Health Resources,Other Health Materials,,"",Malaysia,,,,,,,,,Voluntary/Recommended but No Penalties,"National Government,Ministry/Department of Health,Other (Please specify in the text box)",50.7817313452556,46.2179212893549,41.9350108983693,1,"https://www.malaymail.com/news/malaysia/2020/03/24/medical-equipment-ppes-exempted-from-import-duty-sales-tax/1849818 ; https://www.treasury.gov.my/index.php/en/gallery-activities/news/item/6081-bernama-medical-equipment,-ppes-exempted-from-import-duty,-sales-tax.html",2020-12-23,2020-12-23T16:56:47Z
R_2zANO9wp7iWHl22Bs,5535424,new_entry,original,,,"The Malaysia Agro Exposition Park Serdang (MAEPS) will be converted into a temporary makeshift hospital as a precautionary measure to house Covid-19 patients should there be an increase in cases.

Health director-general Datuk Dr Noor Hisham Abdullah said this temporary hospital, which is being coordinated with the National Disaster Management Agency, would be ready by tomorrow evening, March 29th 2020. 

The makeshift hospital would have 600 beds for Covid-19 patients who are asymptomatic or have mild symptoms.",2020-03-28,2020-03-29,,Malaysia,MYS,MY,National,0,,,Health Resources,Hospitals,,"",Malaysia,,,,,,,,,Voluntary/Recommended but No Penalties,"Ministry/Department of Health,Other (Please specify in the text box)",51.7597427227033,46.2615132436584,41.2173704554037,1,https://www.nst.com.my/news/nation/2020/03/579065/maeps-become-makeshift-hospital-anticipation-more-covid-19-cases ; https://www.malaymail.com/news/malaysia/2020/03/28/health-ministry-serdang-exposition-centre-set-up-as-makeshift-hospital-in-p/1851177,2020-12-26,2020-12-26T02:17:33Z
R_2R3RKKQpg2ppG7jBq,7880829,new_entry,original,,,"March 29 — The Malaysian Ministry of Health (MOH) today announced that 157 healthcare and medical volunteer services have joined the ministry, to help contain the Covid-19 virus outbreak. Its director-general, Datuk Dr Noor Hisham Abdullah said that 1,008 from various medical backgrounds are set to join soon.
MOH is also calling for more volunteers to join the medical assistance and Covid-19 treatment team, by filling out the registration form to join the team, which is available on the ministry’s Facebook page.",2020-03-29,2020-03-29,,Malaysia,MYS,MY,National,0,,,Health Resources,Health Volunteers,,"",Malaysia,,,,,,,,,Voluntary/Recommended but No Penalties,Ministry/Department of Health,51.7597427227033,46.2615132436584,41.2173704554037,1,https://www.malaymail.com/news/malaysia/2020/03/29/health-d-g-157-volunteers-join-covid-19-fight-over-1000-to-follow-suit/1851419 ; https://www.bharian.com.my/berita/nasional/2020/03/670763/covid-19-157-sukarelawan-sertai-kkm,2020-12-25,2020-12-25T09:41:17Z
R_2R3RKKQpg2ppG7jFa,7880829,new_entry,original,,,"March 29 — The Malaysian Ministry of Health (MOH) today announced that 157 healthcare and medical volunteer services have joined the ministry, to help contain the Covid-19 virus outbreak. Its director-general, Datuk Dr Noor Hisham Abdullah said that 1,008 from various medical backgrounds are set to join soon.
MOH is also calling for more volunteers to join the medical assistance and Covid-19 treatment team, by filling out the registration form to join the team, which is available on the ministry’s Facebook page.",2020-03-29,2020-03-29,,Malaysia,MYS,MY,National,0,,,Health Resources,Unspecified Health Staff,,"",Malaysia,,,,,,,,,Voluntary/Recommended but No Penalties,Ministry/Department of Health,51.7597427227033,46.2615132436584,41.2173704554037,1,https://www.malaymail.com/news/malaysia/2020/03/29/health-d-g-157-volunteers-join-covid-19-fight-over-1000-to-follow-suit/1851419 ; https://www.bharian.com.my/berita/nasional/2020/03/670763/covid-19-157-sukarelawan-sertai-kkm,2020-12-25,2020-12-25T09:41:17Z
